,Bucket,Sentence
155,05::00::Fixed Income::USA,FFc1 FFc1 FFc1 FFc1 FFc1 FFc1 FFc1 FFc1 FFc1 TYc1 FVc1 FFc1 FFc1 TYc1 FVc1 TYc1 FVc1 TYc1 FFc1 FVc1 TYc1 FFc1 FVc1 FFc1 FFc1 FFc1 EDc1 FFc1 FFc1 TYc1 FVc1 FFc1 FFc1 FFc1 TYc1 TYc1 FFc1 FFc1 FFc1 FFc1 EDc1 FFc1 FVc1 TYc1 FFc1 FVc1 EDc1 FFc1 FFc1 FFc1 FFc1 EMc1 EMc1 EMc1 EMc1 EMc1 EMc1 EMc1 EMc1 EMc1 EMc1 EMc1 EMc1 EMc1 EMc1 EMc1 EMc1 EMc1 EMc1 EMc1 EMc1 EMc1 EMc1 EMc1 EMc1 EMc1 EMc1 EMc1 EMc1 EMc1 EMc1 EMc1 EMc1 EMc1 EMc1 EMc1 EMc1 EMc1 EMc1 EMc1 EMc1 EMc1 EMc1 EMc1 EMc1 EMc1 EMc1 EMc1 EMc1 FFc1 EMc1 EMc1 EMc1 EMc1 EMc1 EMc1 EMc1 EMc1 EMc1 EMc1 EMc1 EMc1 EMc1 EMc1 EMc1 EMc1 EMc1 EMc1 EMc1 EMc1 EMc1 EMc1 EMc1 EMc1 EMc1 EMc1 EMc1 EMc1 EMc1 EMc1 EMc1 EMc1 EMc1 EMc1 EMc1 EMc1 EMc1 EMc1 EMc1 EMc1 FVc1 FVc1 FVc1
156,05::01::Commodities::USA,CLc1 CLc1 CLc1
157,05::01::Fixed Income::Australia,YBAc1 YBAc1 YBAc1 YBAc1 YBAc1 YBAc1 YBAc1 YBAc1 YBAc1
158,05::01::Fixed Income::Canada,CGBc1 CGBc1 CGBc1 CGBc1 CGBc1 CGBc1 CGBc1 CGBc1 CGBc1 CGBc1 CGBc1 CGBc1 CGBc1 CGBc1 CGBc1 CGBc1 CGBc1 CGBc1 CGBc1 CGBc1 CGBc1 CGBc1 CGBc1 CGBc1 CGBc1 CGBc1 CGBc1 CGBc1 CGBc1 CGBc1 CGBc1 CGBc1 CGBc1 CGBc1 CGBc1 CGBc1 CGBc1 CGBc1 CGBc1 CGBc1 CGBc1 CGBc1 CGBc1 CGBc1 CGBc1 CGBc1 CGBc1 CGBc1 CGBc1 CGBc1 CGBc1 CGBc1 CGBc1 CGBc1 CGBc1 CGBc1 BAXc1 BAXc1 BAXc1 BAXc1 CGBc1 CGBc1 CGBc1 CGBc1 CGBc1 CGBc1 CGBc1 CGBc1 CGBc1 CGBc1 CGBc1 CGBc1 CGBc1 CGBc1 CGBc1 CGBc1 CGBc1 CGBc1 CGBc1 CGBc1 CGBc1 CGBc1 CGBc1 CGBc1 CGBc1 CGBc1 CGBc1 CGBc1 CGBc1
159,05::01::Fixed Income::Germany,CONFc1 CONFc1 CONFc1 CONFc1 CONFc1 CONFc1 CONFc1 CONFc1 CONFc1 CONFc1 CONFc1 CONFc1 CONFc1 CONFc1 CONFc1 CONFc1 CONFc1 CONFc1 CONFc1 CONFc1 CONFc1 CONFc1 CONFc1 CONFc1 CONFc1 CONFc1 CONFc1
160,05::01::Fixed Income::USA,FVc1 FVc1 FVc1 FVc1 FVc1 TYc1 USc1 FVc1 USc1 FVc1 FVc1 FVc1 TYc1 TYc1 TYc1 TYc1 EMc1 EMc1 EMc1 EMc1 EMc1 EMc1 EMc1 EMc1 EMc1 EMc1 EMc1 EMc1 EMc1 EMc1 EMc1 EMc1 EMc1 EMc1 EMc1 EMc1 EMc1 EMc1 EMc1 EMc1 EMc1 EMc1 EMc1 EMc1 EMc1 EMc1 EMc1 EMc1 EMc1 EMc1 EMc1 EMc1 EMc1 EMc1 EMc1 EMc1 EMc1 EMc1 EMc1 EMc1 EMc1 EMc1 EMc1 EMc1 EMc1 EMc1 EMc1 EMc1 EMc1 EMc1 EMc1 EMc1 EMc1 EMc1 EMc1 EMc1 EMc1 EMc1 EMc1 FVc1 TYc1 USc1 FVc1 FVc1 FVc1 FVc1 FVc1 FVc1 FVc1 FVc1 FVc1 FVc1 FVc1 FVc1 FVc1 TYc1 FVc1 TYc1 FVc1 FVc1 FVc1 FVc1
161,05::02::Commodities::USA,LCOc1 LCOc1 LCOc1 CLc1 LCOc1 LCOc1 CLc1 CLc1 CLc1 CLc1 CLc1 CLc1 CLc1
162,05::02::Fixed Income::Australia,YBAc1 YTCc1 YTCc1 YTCc1
163,05::02::Fixed Income::Canada,CGBc1 CGBc1 CGBc1 CGBc1 CGBc1 CGBc1 CGBc1 CGBc1 CGBc1 CGBc1 CGBc1 CGBc1 CGBc1 CGBc1 CGBc1 CGBc1 CGBc1 CGBc1 CGBc1 CGBc1 CGBc1 CGBc1 CGBc1 CGBc1 CGBc1 CGBc1 CGBc1 CGBc1 CGBc1 CGBc1 CGBc1 CGBc1 CGBc1 CGBc1 CGBc1 CGBc1 CGBc1 CGBc1 CGBc1 CGBc1 CGBc1 CGBc1 CGBc1 CGBc1 CGBc1 CGBc1 CGBc1 CGBc1 CGBc1 CGBc1 CGBc1 CGBc1 CGBc1 CGBc1 CGBc1 CGBc1 CGBc1 CGBc1 CGBc1 CGBc1 CGBc1 CGBc1 CGBc1 CGBc1 CGBc1 CGBc1 CGBc1 CGBc1 CGBc1 CGBc1 CGBc1 CGBc1 CGBc1 CGBc1 CGBc1 CGBc1 CGBc1 CGBc1 CGBc1 CGBc1 CGBc1 CGBc1 CGBc1 CGBc1 CGBc1 CGBc1 CGBc1 CGBc1 CGBc1 CGBc1 CGBc1 CGBc1 CGBc1 CGBc1 CGBc1 CGBc1 CGBc1 CGBc1 CGBc1 CGBc1 CGBc1 CGBc1 CGBc1 CGBc1 CGBc1 CGBc1 CGBc1 CGBc1 CGBc1 CGBc1 CGBc1 CGBc1 CGBc1 CGBc1 CGBc1 CGBc1 CGBc1 CGBc1 CGBc1 CGBc1 CGBc1 CGBc1 CGBc1 CGBc1 CGBc1 CGBc1 CGBc1 CGBc1 CGBc1 CGBc1 CGBc1 CGBc1 CGBc1 CGBc1 CGBc1 CGBc1 CGBc1 CGBc1 CGBc1 CGBc1 CGBc1 CGBc1 CGBc1 CGBc1 CGBc1 CGBc1 CGBc1 CGBc1 CGBc1 CGBc1 CGBc1 CGBc1 CGBc1 CGBc1 CGBc1 CGBc1 CGBc1 CGBc1 CGBc1 CGBc1 CGBc1 CGBc1 CGBc1 CGBc1 CGBc1 CGBc1 CGBc1 CGBc1 CGBc1 CGBc1 CGBc1 CGBc1 CGBc1 CGBc1 CGBc1 CGBc1 CGBc1 CGBc1 CGBc1 CGBc1 CGBc1 CGBc1 CGBc1 CGBc1 CGBc1 CGBc1 CGBc1 CGBc1 CGBc1 CGBc1 CGBc1 CGBc1 CGBc1 CGBc1 CGBc1 CGBc1 CGBc1 CGBc1 CGBc1 CGBc1 CGBc1 CGBc1 CGBc1 CGBc1 CGBc1 CGBc1 CGBc1 CGBc1 CGBc1 CGBc1 CGBc1 CGBc1 CGBc1 CGBc1 CGBc1 CGBc1 CGBc1 CGBc1 CGBc1 CGBc1 CGBc1 CGBc1 CGBc1 CGBc1 CGBc1 CGBc1 CGBc1 CGBc1 CGBc1 CGBc1 CGBc1 CGBc1 CGBc1 CGBc1 CGBc1 CGBc1 CGBc1 CGBc1 CGBc1 CGBc1 CGBc1 CGBc1 CGBc1 CGBc1 CGBc1 CGBc1 CGBc1 CGBc1 CGBc1 CGBc1 CGBc1 CGBc1 CGBc1 CGBc1 CGBc1 CGBc1 CGBc1 CGBc1 CGBc1 CGBc1 CGBc1 CGBc1 CGBc1 CGBc1 CGBc1 CGBc1 CGBc1 CGBc1 CGBc1 CGBc1 CGBc1 CGBc1 CGBc1 CGBc1 CGBc1 CGBc1 CGBc1 CGBc1 CGBc1 CGBc1 CGBc1 CGBc1 CGBc1 CGBc1 CGBc1 CGBc1 CGBc1 CGBc1 CGBc1 CGBc1 CGBc1 CGBc1 CGBc1 CGBc1 CGBc1 CGBc1 CGBc1 CGBc1 CGBc1 CGBc1 CGBc1 CGBc1 CGBc1 CGBc1 CGBc1 CGBc1 CGBc1 CGBc1 CGBc1 CGBc1 CGBc1 CGBc1 CGBc1 CGBc1 CGBc1 CGBc1 CGBc1 CGBc1 CGBc1 CGBc1 CGBc1 CGBc1 CGBc1 CGBc1 CGBc1 CGBc1 CGBc1 CGBc1 CGBc1 CGBc1 CGBc1 CGBc1 CGBc1 CGBc1 CGBc1 CGBc1 CGBc1 CGBc1 CGBc1
164,05::02::Fixed Income::Germany,CONFc1 CONFc1 CONFc1 CONFc1 CONFc1 CONFc1 CONFc1 CONFc1 CONFc1 CONFc1 CONFc1 CONFc1 CONFc1 CONFc1 CONFc1 CONFc1 CONFc1 CONFc1 CONFc1 CONFc1 CONFc1 CONFc1 CONFc1 CONFc1 CONFc1 CONFc1 CONFc1 CONFc1 CONFc1 CONFc1 CONFc1 CONFc1 CONFc1 CONFc1 CONFc1 CONFc1 CONFc1 CONFc1 CONFc1 CONFc1 CONFc1 CONFc1 CONFc1 CONFc1 CONFc1 CONFc1 CONFc1 CONFc1 CONFc1 CONFc1 CONFc1 CONFc1 CONFc1 CONFc1 CONFc1 CONFc1 CONFc1 CONFc1 CONFc1 CONFc1 CONFc1 CONFc1 CONFc1 CONFc1 CONFc1 CONFc1 CONFc1 CONFc1 CONFc1 CONFc1 CONFc1 CONFc1 CONFc1 CONFc1 CONFc1 CONFc1 CONFc1 CONFc1 CONFc1 CONFc1 CONFc1 CONFc1 CONFc1 CONFc1 CONFc1 CONFc1 CONFc1 CONFc1 CONFc1 CONFc1 CONFc1 CONFc1 CONFc1 CONFc1 CONFc1 CONFc1 CONFc1 CONFc1 CONFc1 CONFc1 CONFc1 CONFc1 CONFc1 CONFc1 CONFc1 CONFc1 CONFc1 CONFc1 CONFc1 CONFc1 CONFc1 CONFc1 CONFc1 CONFc1 CONFc1 CONFc1 CONFc1 CONFc1 CONFc1 CONFc1 CONFc1 CONFc1 CONFc1 CONFc1 CONFc1 CONFc1 CONFc1 CONFc1 CONFc1 CONFc1 CONFc1 CONFc1 CONFc1 CONFc1 CONFc1 CONFc1 CONFc1 CONFc1 CONFc1 CONFc1 CONFc1 CONFc1 CONFc1 CONFc1 CONFc1 CONFc1 CONFc1 CONFc1 CONFc1 CONFc1 CONFc1 CONFc1 CONFc1 CONFc1 CONFc1 CONFc1 CONFc1 CONFc1 CONFc1 CONFc1 CONFc1 CONFc1 CONFc1 CONFc1 CONFc1 CONFc1 CONFc1 CONFc1 CONFc1 CONFc1 CONFc1 CONFc1 CONFc1 CONFc1 CONFc1 CONFc1 CONFc1 CONFc1 CONFc1 CONFc1 CONFc1 CONFc1 CONFc1 CONFc1 CONFc1 CONFc1 CONFc1 CONFc1 CONFc1 CONFc1 CONFc1 CONFc1 CONFc1 CONFc1 CONFc1 CONFc1 CONFc1 CONFc1 CONFc1 CONFc1 CONFc1 CONFc1 CONFc1 CONFc1 CONFc1 CONFc1 CONFc1 CONFc1 CONFc1 CONFc1 CONFc1 CONFc1 CONFc1 CONFc1 CONFc1 CONFc1 CONFc1 CONFc1 CONFc1 CONFc1 CONFc1 CONFc1 CONFc1 CONFc1 CONFc1 CONFc1 CONFc1 CONFc1 CONFc1 CONFc1 CONFc1 CONFc1 CONFc1 CONFc1 CONFc1 CONFc1 CONFc1 CONFc1 CONFc1 CONFc1 CONFc1 CONFc1 CONFc1 CONFc1 CONFc1 CONFc1 CONFc1 CONFc1 CONFc1 CONFc1 CONFc1 CONFc1 CONFc1 CONFc1 CONFc1 CONFc1 CONFc1 CONFc1 CONFc1 CONFc1 CONFc1 CONFc1 CONFc1 CONFc1 CONFc1 CONFc1 CONFc1 CONFc1 CONFc1 CONFc1 CONFc1 CONFc1 CONFc1 CONFc1 CONFc1 CONFc1 CONFc1 CONFc1 CONFc1 CONFc1 CONFc1 CONFc1 CONFc1 CONFc1 CONFc1 CONFc1 CONFc1 CONFc1 CONFc1 CONFc1 CONFc1 CONFc1 CONFc1 CONFc1 CONFc1 CONFc1 CONFc1 CONFc1 CONFc1 CONFc1 CONFc1 CONFc1 CONFc1 CONFc1 CONFc1 CONFc1 CONFc1 CONFc1 CONFc1 CONFc1 CONFc1 CONFc1 CONFc1 CONFc1 CONFc1 CONFc1 CONFc1 CONFc1 CONFc1 CONFc1 CONFc1 CONFc1 CONFc1 CONFc1 CONFc1 CONFc1 CONFc1 CONFc1 CONFc1 CONFc1 CONFc1 CONFc1 CONFc1 CONFc1 CONFc1 CONFc1 CONFc1 CONFc1 CONFc1 CONFc1 CONFc1 CONFc1 CONFc1 CONFc1 CONFc1 CONFc1 CONFc1 CONFc1 CONFc1 CONFc1 CONFc1 CONFc1 CONFc1 CONFc1 CONFc1 CONFc1 CONFc1 CONFc1 CONFc1 CONFc1 CONFc1 CONFc1 CONFc1 CONFc1 CONFc1 CONFc1 CONFc1 CONFc1 CONFc1 CONFc1 CONFc1 CONFc1 CONFc1 CONFc1 CONFc1 CONFc1 CONFc1 CONFc1 CONFc1 CONFc1 CONFc1 CONFc1 CONFc1 CONFc1 CONFc1 CONFc1 CONFc1 CONFc1 CONFc1 CONFc1 CONFc1 CONFc1 CONFc1 CONFc1 CONFc1 CONFc1 CONFc1 CONFc1 CONFc1 CONFc1 CONFc1 CONFc1 CONFc1 CONFc1 CONFc1 CONFc1 CONFc1 CONFc1 CONFc1 CONFc1 CONFc1 CONFc1 CONFc1 CONFc1 CONFc1 CONFc1 CONFc1 CONFc1 CONFc1 CONFc1 CONFc1 CONFc1 CONFc1 CONFc1 CONFc1 CONFc1 CONFc1 CONFc1 CONFc1 CONFc1 CONFc1 CONFc1 CONFc1 CONFc1 CONFc1 CONFc1 CONFc1 CONFc1 CONFc1 CONFc1 CONFc1 CONFc1 CONFc1 CONFc1 CONFc1 CONFc1 CONFc1 CONFc1 CONFc1 CONFc1 CONFc1 CONFc1 CONFc1 CONFc1 CONFc1 CONFc1 CONFc1 CONFc1 CONFc1 CONFc1 CONFc1 CONFc1 CONFc1 CONFc1 CONFc1 CONFc1 CONFc1 CONFc1 CONFc1 CONFc1 CONFc1 CONFc1 CONFc1 CONFc1 CONFc1 CONFc1 CONFc1 CONFc1 CONFc1 CONFc1 CONFc1 CONFc1 CONFc1 CONFc1 CONFc1 CONFc1 CONFc1 CONFc1 CONFc1 CONFc1 CONFc1 CONFc1 CONFc1 CONFc1 CONFc1 CONFc1 CONFc1 CONFc1 CONFc1 CONFc1 CONFc1 CONFc1 CONFc1 CONFc1 CONFc1 CONFc1 CONFc1 CONFc1 CONFc1 CONFc1 CONFc1 CONFc1 CONFc1 CONFc1 CONFc1 CONFc1 CONFc1 CONFc1 CONFc1 CONFc1 CONFc1 CONFc1 CONFc1 CONFc1 CONFc1 CONFc1 CONFc1 CONFc1 CONFc1 CONFc1 CONFc1 CONFc1 CONFc1 CONFc1 CONFc1 CONFc1 CONFc1 CONFc1 CONFc1 CONFc1 CONFc1 CONFc1 CONFc1 CONFc1 CONFc1 CONFc1 CONFc1 CONFc1 CONFc1 CONFc1 CONFc1 CONFc1 CONFc1 CONFc1 CONFc1 CONFc1 CONFc1 CONFc1 CONFc1 CONFc1 CONFc1 CONFc1 CONFc1 CONFc1 CONFc1 CONFc1 CONFc1 CONFc1 CONFc1 CONFc1 CONFc1 CONFc1 CONFc1 CONFc1 CONFc1 CONFc1 CONFc1 CONFc1 CONFc1 CONFc1 CONFc1 CONFc1 CONFc1 CONFc1 CONFc1 CONFc1 CONFc1 CONFc1 CONFc1 CONFc1 CONFc1 CONFc1 CONFc1 CONFc1 CONFc1 CONFc1 CONFc1 CONFc1 CONFc1 CONFc1 CONFc1 CONFc1 CONFc1 CONFc1 CONFc1 CONFc1 CONFc1 CONFc1 CONFc1 CONFc1 CONFc1 CONFc1 CONFc1 CONFc1 CONFc1 CONFc1 CONFc1 CONFc1 CONFc1 CONFc1 CONFc1 CONFc1 CONFc1 CONFc1 CONFc1 CONFc1 CONFc1 CONFc1 CONFc1 CONFc1 CONFc1 CONFc1 CONFc1 CONFc1 CONFc1 CONFc1 CONFc1 CONFc1 CONFc1 CONFc1 CONFc1 CONFc1 CONFc1 CONFc1 CONFc1 CONFc1 CONFc1 CONFc1 CONFc1 CONFc1 CONFc1 CONFc1 CONFc1 CONFc1 CONFc1 CONFc1 CONFc1 CONFc1 CONFc1 CONFc1 CONFc1 CONFc1 CONFc1 CONFc1 CONFc1 CONFc1 CONFc1 CONFc1 CONFc1 CONFc1 CONFc1 CONFc1 CONFc1 CONFc1 CONFc1 CONFc1 CONFc1 CONFc1 CONFc1 CONFc1 CONFc1 CONFc1 CONFc1 CONFc1 CONFc1 CONFc1 CONFc1 CONFc1 CONFc1 CONFc1 CONFc1 CONFc1 CONFc1 CONFc1 CONFc1 CONFc1 CONFc1 CONFc1 CONFc1 CONFc1 CONFc1 CONFc1 CONFc1 CONFc1 CONFc1 CONFc1 CONFc1 CONFc1 CONFc1 CONFc1 CONFc1 CONFc1 CONFc1 CONFc1 CONFc1 CONFc1 CONFc1 CONFc1 CONFc1 CONFc1 CONFc1 CONFc1 CONFc1 CONFc1 CONFc1 CONFc1 CONFc1 CONFc1 CONFc1 CONFc1 CONFc1 CONFc1 CONFc1 CONFc1 CONFc1 CONFc1 CONFc1 CONFc1 CONFc1 CONFc1 CONFc1 CONFc1 CONFc1 CONFc1 CONFc1 CONFc1 CONFc1 CONFc1 CONFc1 CONFc1 CONFc1 CONFc1 CONFc1 CONFc1 CONFc1 CONFc1 CONFc1 CONFc1 CONFc1 CONFc1 CONFc1 CONFc1 CONFc1 CONFc1 CONFc1 CONFc1 CONFc1 CONFc1 CONFc1 CONFc1 CONFc1 CONFc1 CONFc1 CONFc1 CONFc1 CONFc1 CONFc1 CONFc1 CONFc1 CONFc1 CONFc1 CONFc1 CONFc1 CONFc1 CONFc1 CONFc1 CONFc1 CONFc1 CONFc1 CONFc1 CONFc1 CONFc1 CONFc1 CONFc1 CONFc1 CONFc1 CONFc1 CONFc1 CONFc1 CONFc1 CONFc1 CONFc1 CONFc1 CONFc1 CONFc1 CONFc1 CONFc1 CONFc1 CONFc1 CONFc1 CONFc1 CONFc1 CONFc1 CONFc1 CONFc1 CONFc1 CONFc1 CONFc1 CONFc1 CONFc1 CONFc1 CONFc1 CONFc1 CONFc1 CONFc1 CONFc1 CONFc1 CONFc1 CONFc1 CONFc1 CONFc1 CONFc1 CONFc1 CONFc1 CONFc1 CONFc1 CONFc1 CONFc1 CONFc1 CONFc1 CONFc1 CONFc1 CONFc1 CONFc1 CONFc1 CONFc1 CONFc1 CONFc1 CONFc1 CONFc1 CONFc1 CONFc1 CONFc1 CONFc1 CONFc1 CONFc1 CONFc1 CONFc1 CONFc1 CONFc1 CONFc1 CONFc1 CONFc1 CONFc1 CONFc1 CONFc1 CONFc1 CONFc1 CONFc1 CONFc1 CONFc1 CONFc1 CONFc1 CONFc1 CONFc1 CONFc1 CONFc1 CONFc1 CONFc1 CONFc1 CONFc1 CONFc1 CONFc1 CONFc1 CONFc1 CONFc1 CONFc1 CONFc1 CONFc1 CONFc1 CONFc1 CONFc1 CONFc1 CONFc1 CONFc1 CONFc1 CONFc1 CONFc1 CONFc1 CONFc1 CONFc1 CONFc1 CONFc1 CONFc1 CONFc1 CONFc1 CONFc1 CONFc1 CONFc1 CONFc1 CONFc1 CONFc1 CONFc1 CONFc1 CONFc1 CONFc1 CONFc1 CONFc1 CONFc1 CONFc1 CONFc1 CONFc1 CONFc1 CONFc1 CONFc1 CONFc1 CONFc1 CONFc1 CONFc1 CONFc1 CONFc1 CONFc1 CONFc1 CONFc1 CONFc1 CONFc1 CONFc1 CONFc1 CONFc1 CONFc1 CONFc1 CONFc1 CONFc1 CONFc1 CONFc1 CONFc1 CONFc1 CONFc1 CONFc1 CONFc1 CONFc1 CONFc1 CONFc1 CONFc1 CONFc1 CONFc1 CONFc1 CONFc1 CONFc1 CONFc1 CONFc1 CONFc1 CONFc1 CONFc1 CONFc1 CONFc1 CONFc1 CONFc1 CONFc1 CONFc1 CONFc1 CONFc1 CONFc1 CONFc1 CONFc1 CONFc1 CONFc1 CONFc1 CONFc1 CONFc1 CONFc1 CONFc1 CONFc1 CONFc1 CONFc1 CONFc1 CONFc1 CONFc1 CONFc1 CONFc1 CONFc1 CONFc1 CONFc1 CONFc1 CONFc1 CONFc1 CONFc1 CONFc1 CONFc1 CONFc1 CONFc1 CONFc1 CONFc1 CONFc1 CONFc1 CONFc1 CONFc1 CONFc1 CONFc1 CONFc1 CONFc1 CONFc1 CONFc1 CONFc1 CONFc1 CONFc1 CONFc1 CONFc1 CONFc1 CONFc1 CONFc1 CONFc1 CONFc1 CONFc1 CONFc1 CONFc1 CONFc1 CONFc1 CONFc1 CONFc1 CONFc1 CONFc1 CONFc1 CONFc1 CONFc1 CONFc1 CONFc1 CONFc1 CONFc1 CONFc1 CONFc1 CONFc1 CONFc1 CONFc1 CONFc1 CONFc1 CONFc1 CONFc1 CONFc1 CONFc1 CONFc1 CONFc1 CONFc1 CONFc1 CONFc1 CONFc1 CONFc1 CONFc1 CONFc1 CONFc1 CONFc1 CONFc1 CONFc1 CONFc1 CONFc1 CONFc1 CONFc1 CONFc1 CONFc1 CONFc1 CONFc1 CONFc1 CONFc1 CONFc1 CONFc1 CONFc1 CONFc1 CONFc1 CONFc1 CONFc1 CONFc1 CONFc1 CONFc1 CONFc1 CONFc1 CONFc1 CONFc1 CONFc1 CONFc1 CONFc1 CONFc1 CONFc1 CONFc1 CONFc1 CONFc1 CONFc1 CONFc1 CONFc1 CONFc1 CONFc1 CONFc1 CONFc1 CONFc1 CONFc1 CONFc1 CONFc1 CONFc1 CONFc1 CONFc1 CONFc1 CONFc1 CONFc1 CONFc1 CONFc1 CONFc1 CONFc1 CONFc1 CONFc1 CONFc1 CONFc1 CONFc1 CONFc1 CONFc1 CONFc1 CONFc1 CONFc1 CONFc1 CONFc1 CONFc1 CONFc1 CONFc1 CONFc1 CONFc1 CONFc1 CONFc1 CONFc1 CONFc1 CONFc1 CONFc1 CONFc1 CONFc1 CONFc1 CONFc1 CONFc1 CONFc1 CONFc1 CONFc1 CONFc1 CONFc1 CONFc1 CONFc1 CONFc1 CONFc1 CONFc1 CONFc1 CONFc1 CONFc1 CONFc1 CONFc1 CONFc1 CONFc1 CONFc1 CONFc1 CONFc1 CONFc1 CONFc1 CONFc1 CONFc1 CONFc1 CONFc1 CONFc1 CONFc1 CONFc1 CONFc1 CONFc1 CONFc1 CONFc1 CONFc1 CONFc1 CONFc1 CONFc1 CONFc1 CONFc1 CONFc1 CONFc1 CONFc1 CONFc1 CONFc1 CONFc1 CONFc1 CONFc1 CONFc1 CONFc1 CONFc1 CONFc1 CONFc1 CONFc1 CONFc1 CONFc1 CONFc1 CONFc1 CONFc1 CONFc1 CONFc1 CONFc1 CONFc1 CONFc1 CONFc1 CONFc1 CONFc1 CONFc1 CONFc1 CONFc1 CONFc1 CONFc1 CONFc1 CONFc1 CONFc1 CONFc1 CONFc1 CONFc1 CONFc1 CONFc1 CONFc1 CONFc1 CONFc1 CONFc1 CONFc1 CONFc1 CONFc1 CONFc1 CONFc1 CONFc1 CONFc1 CONFc1 CONFc1 CONFc1 CONFc1 CONFc1 CONFc1 CONFc1 CONFc1 CONFc1 CONFc1 CONFc1 CONFc1 CONFc1 CONFc1 CONFc1 CONFc1 CONFc1 CONFc1 CONFc1 CONFc1 CONFc1 CONFc1 CONFc1 CONFc1 CONFc1 CONFc1 CONFc1 CONFc1 CONFc1 CONFc1 CONFc1 CONFc1 CONFc1 CONFc1 CONFc1 CONFc1 CONFc1 CONFc1 CONFc1 CONFc1 CONFc1 CONFc1 CONFc1 CONFc1 CONFc1 CONFc1 CONFc1 CONFc1 CONFc1 CONFc1 CONFc1 CONFc1 CONFc1 CONFc1 CONFc1 CONFc1 CONFc1 CONFc1 CONFc1 CONFc1 CONFc1 CONFc1 CONFc1 CONFc1 CONFc1 CONFc1 CONFc1 CONFc1 CONFc1 CONFc1 CONFc1 CONFc1 CONFc1 CONFc1 CONFc1 CONFc1 CONFc1 CONFc1 CONFc1 CONFc1 CONFc1 CONFc1 CONFc1 CONFc1 CONFc1 CONFc1 CONFc1 CONFc1 CONFc1 CONFc1 CONFc1 CONFc1 CONFc1 CONFc1 CONFc1 CONFc1 CONFc1 CONFc1 CONFc1 CONFc1 CONFc1 CONFc1 CONFc1 CONFc1 CONFc1 CONFc1 CONFc1 CONFc1 CONFc1 CONFc1 CONFc1 CONFc1 CONFc1 CONFc1 CONFc1 CONFc1 CONFc1 CONFc1 CONFc1 CONFc1 CONFc1 CONFc1 CONFc1 CONFc1 CONFc1 CONFc1 CONFc1 CONFc1 CONFc1 CONFc1 CONFc1 CONFc1 CONFc1 CONFc1 CONFc1 CONFc1 CONFc1 CONFc1 CONFc1 CONFc1 CONFc1 CONFc1 CONFc1 CONFc1 CONFc1 CONFc1 CONFc1 CONFc1 CONFc1 CONFc1 CONFc1 CONFc1 CONFc1 CONFc1 CONFc1 CONFc1 CONFc1 CONFc1 CONFc1 CONFc1 CONFc1 CONFc1 CONFc1 CONFc1 CONFc1 CONFc1 CONFc1 CONFc1 CONFc1 CONFc1 CONFc1 CONFc1 CONFc1 CONFc1 CONFc1 CONFc1 CONFc1 CONFc1 CONFc1 CONFc1 CONFc1 CONFc1 CONFc1 CONFc1 CONFc1 CONFc1 CONFc1 CONFc1 CONFc1 CONFc1 CONFc1 CONFc1 CONFc1 CONFc1 CONFc1 CONFc1 CONFc1 CONFc1 CONFc1 CONFc1 CONFc1 CONFc1 CONFc1 CONFc1 CONFc1 CONFc1 CONFc1 CONFc1 CONFc1 CONFc1 CONFc1 CONFc1 CONFc1 CONFc1 CONFc1 CONFc1 CONFc1 CONFc1 CONFc1 CONFc1 CONFc1 CONFc1 CONFc1 CONFc1 CONFc1 CONFc1 CONFc1 CONFc1 CONFc1 CONFc1 CONFc1 CONFc1 CONFc1 CONFc1 CONFc1 CONFc1 CONFc1 CONFc1 CONFc1 CONFc1 CONFc1 CONFc1 CONFc1 CONFc1 CONFc1 CONFc1 CONFc1 CONFc1 CONFc1 CONFc1 CONFc1 CONFc1 CONFc1 CONFc1 CONFc1 CONFc1 CONFc1 CONFc1 CONFc1 CONFc1 CONFc1 CONFc1 CONFc1 CONFc1 CONFc1 CONFc1 CONFc1 CONFc1 CONFc1 CONFc1 CONFc1 CONFc1 CONFc1 CONFc1 CONFc1 CONFc1 CONFc1 CONFc1 CONFc1 CONFc1 CONFc1 CONFc1 CONFc1 CONFc1 CONFc1 CONFc1 CONFc1 CONFc1 CONFc1 CONFc1 CONFc1 CONFc1 CONFc1 CONFc1 CONFc1 CONFc1 CONFc1 CONFc1 CONFc1 CONFc1 CONFc1 CONFc1 CONFc1 CONFc1 CONFc1 CONFc1 CONFc1 CONFc1 CONFc1 CONFc1 CONFc1 CONFc1 CONFc1 CONFc1 CONFc1 CONFc1 CONFc1 CONFc1 CONFc1 CONFc1 CONFc1 CONFc1 CONFc1 CONFc1 CONFc1 CONFc1 CONFc1 CONFc1 CONFc1 CONFc1 CONFc1 CONFc1 CONFc1 CONFc1 CONFc1 CONFc1 CONFc1 CONFc1 CONFc1 CONFc1 CONFc1 CONFc1 CONFc1 CONFc1 CONFc1 CONFc1 CONFc1 CONFc1 CONFc1 CONFc1 CONFc1 CONFc1 CONFc1 CONFc1 CONFc1 CONFc1 CONFc1 CONFc1 CONFc1 CONFc1 CONFc1 CONFc1 CONFc1 CONFc1 CONFc1 CONFc1 CONFc1 CONFc1 CONFc1 CONFc1 CONFc1 CONFc1 CONFc1 CONFc1 CONFc1 CONFc1 CONFc1 CONFc1 CONFc1 CONFc1 CONFc1 CONFc1 CONFc1 CONFc1 CONFc1 CONFc1 CONFc1 CONFc1 CONFc1 CONFc1 CONFc1 CONFc1 CONFc1 CONFc1 CONFc1 CONFc1 CONFc1 CONFc1 CONFc1 CONFc1 CONFc1 CONFc1 CONFc1 CONFc1 CONFc1 CONFc1 CONFc1 CONFc1 CONFc1 CONFc1 CONFc1 CONFc1 CONFc1 CONFc1 CONFc1 CONFc1 CONFc1 CONFc1 CONFc1 CONFc1 CONFc1 CONFc1 CONFc1 CONFc1 CONFc1 CONFc1 CONFc1 CONFc1 CONFc1 CONFc1 CONFc1 CONFc1 CONFc1 CONFc1 CONFc1 CONFc1 CONFc1 CONFc1 CONFc1 CONFc1 CONFc1 CONFc1 CONFc1 CONFc1 CONFc1 CONFc1 CONFc1 CONFc1 CONFc1 CONFc1 CONFc1 CONFc1 CONFc1 CONFc1 CONFc1 CONFc1 CONFc1 CONFc1 CONFc1 CONFc1 CONFc1 CONFc1 CONFc1 CONFc1 CONFc1 CONFc1 CONFc1 CONFc1 CONFc1 CONFc1 CONFc1 CONFc1 CONFc1 CONFc1 CONFc1 CONFc1 CONFc1 CONFc1 CONFc1 CONFc1 CONFc1 CONFc1 CONFc1 CONFc1 CONFc1 CONFc1 CONFc1 CONFc1 CONFc1 CONFc1 CONFc1 CONFc1 CONFc1 CONFc1 CONFc1 CONFc1 CONFc1 CONFc1 CONFc1 CONFc1 CONFc1 CONFc1 CONFc1 CONFc1 CONFc1 CONFc1 CONFc1 CONFc1 CONFc1 CONFc1 CONFc1 CONFc1 CONFc1 CONFc1 CONFc1 CONFc1 CONFc1 CONFc1 CONFc1 CONFc1 CONFc1 CONFc1 CONFc1 CONFc1 CONFc1 CONFc1 CONFc1 CONFc1 CONFc1 CONFc1 CONFc1 CONFc1 CONFc1 CONFc1 CONFc1 CONFc1 CONFc1 CONFc1 CONFc1 CONFc1 CONFc1 CONFc1 CONFc1 CONFc1 CONFc1 CONFc1 CONFc1 CONFc1 CONFc1 CONFc1 CONFc1 CONFc1 CONFc1 CONFc1 CONFc1 CONFc1 CONFc1 CONFc1 CONFc1 CONFc1 CONFc1 CONFc1 CONFc1 CONFc1 CONFc1 CONFc1 CONFc1 CONFc1 CONFc1 CONFc1 CONFc1 CONFc1 CONFc1 CONFc1 CONFc1 CONFc1 CONFc1 CONFc1 CONFc1 CONFc1 CONFc1 CONFc1 CONFc1 CONFc1 CONFc1 CONFc1 CONFc1 CONFc1 CONFc1 CONFc1 CONFc1 CONFc1 CONFc1 CONFc1 CONFc1 CONFc1 CONFc1 CONFc1 CONFc1 CONFc1 CONFc1 CONFc1 CONFc1 CONFc1 CONFc1 CONFc1 CONFc1 CONFc1 CONFc1 CONFc1 CONFc1 CONFc1 CONFc1 CONFc1 CONFc1 CONFc1 CONFc1 CONFc1 CONFc1 CONFc1 CONFc1 CONFc1 CONFc1 CONFc1 CONFc1 CONFc1 CONFc1 CONFc1 CONFc1 CONFc1 CONFc1 CONFc1 CONFc1 CONFc1 CONFc1 CONFc1 CONFc1 CONFc1 CONFc1 CONFc1 CONFc1 CONFc1 CONFc1 CONFc1 CONFc1 CONFc1 CONFc1 CONFc1 CONFc1 CONFc1 CONFc1 CONFc1 CONFc1 CONFc1 CONFc1 CONFc1 CONFc1 CONFc1 CONFc1 CONFc1 CONFc1 CONFc1 CONFc1 CONFc1 CONFc1 CONFc1 CONFc1 CONFc1 CONFc1 CONFc1 CONFc1 CONFc1 CONFc1 CONFc1 CONFc1 CONFc1 CONFc1 CONFc1 CONFc1 CONFc1 CONFc1 CONFc1 CONFc1 CONFc1 CONFc1 CONFc1 CONFc1 CONFc1 CONFc1 CONFc1 CONFc1 CONFc1 CONFc1 CONFc1 CONFc1 CONFc1 CONFc1 CONFc1 CONFc1 CONFc1 CONFc1 CONFc1 CONFc1 CONFc1 CONFc1 CONFc1 CONFc1 CONFc1 CONFc1 CONFc1 CONFc1 CONFc1 CONFc1 CONFc1 CONFc1 CONFc1 CONFc1 CONFc1 CONFc1 CONFc1 CONFc1 CONFc1 CONFc1 CONFc1 CONFc1 CONFc1 CONFc1 CONFc1 CONFc1 CONFc1 CONFc1 CONFc1 CONFc1 CONFc1 CONFc1 CONFc1 CONFc1 CONFc1 CONFc1 CONFc1 CONFc1 CONFc1 CONFc1 CONFc1 CONFc1 CONFc1 CONFc1 CONFc1 CONFc1 CONFc1 CONFc1 CONFc1 CONFc1 CONFc1 CONFc1 CONFc1 CONFc1 CONFc1 CONFc1 CONFc1 CONFc1 CONFc1 CONFc1 CONFc1 CONFc1 CONFc1 CONFc1 CONFc1 CONFc1 CONFc1 CONFc1 CONFc1 CONFc1 CONFc1 CONFc1 CONFc1 CONFc1 CONFc1 CONFc1 CONFc1 CONFc1 CONFc1 CONFc1 CONFc1 CONFc1 CONFc1 CONFc1 CONFc1 CONFc1 CONFc1 CONFc1 CONFc1 CONFc1 CONFc1 CONFc1 CONFc1 CONFc1 CONFc1 CONFc1 CONFc1 CONFc1 CONFc1 CONFc1 CONFc1 CONFc1 CONFc1 CONFc1 CONFc1 CONFc1 CONFc1 CONFc1 CONFc1 CONFc1 CONFc1 CONFc1 CONFc1 CONFc1 CONFc1 CONFc1 CONFc1 CONFc1 CONFc1 CONFc1 CONFc1 CONFc1 CONFc1 CONFc1 CONFc1 CONFc1 CONFc1 CONFc1 CONFc1 CONFc1 CONFc1 CONFc1 CONFc1 CONFc1 CONFc1 CONFc1 CONFc1 CONFc1 CONFc1 CONFc1 CONFc1 CONFc1
165,05::02::Fixed Income::USA,EDc1 EDc1 EDc1 EDc1 EDc1 EDc1 EDc1 EDc1 FVc1 FVc1 FVc1 EDc1 EDc1 EDc1 EDc1 EDc1 EDc1 EDc1 EDc1 EDc1 EDc1 TYc1 TYc1 EDc1 EDc1 EDc1 EDc1 EDc1 EDc1 EDc1 FVc1 FVc1 FVc1 TYc1 FVc1 TYc1 FVc1 TYc1 TYc1 EDc1 EDc1 EDc1 EDc1 EDc1 EDc1 FVc1 FVc1 FVc1 FVc1 EDc1 EDc1 EDc1 EDc1 EDc1 EDc1 EDc1 EDc1 EDc1 EDc1 EDc1 EDc1 EDc1 EDc1 EDc1 FVc1 FVc1 FVc1 FVc1 FVc1 FVc1 FVc1 EDc1 EDc1 EDc1 EDc1 EDc1 EDc1 EDc1 EDc1 EDc1 EDc1 EDc1 EDc1 EDc1 EDc1 EDc1 EDc1 EDc1 EDc1 EDc1 EDc1 EDc1 EDc1 EDc1 EDc1 EDc1 EDc1 EDc1 EDc1 EDc1 EDc1 EDc1 EDc1 EDc1 EDc1 EDc1 EDc1 EDc1 EDc1 EDc1 EDc1 EDc1 EDc1 EDc1 EDc1 EDc1 EDc1 EDc1 EDc1 EDc1 EDc1 EDc1 FVc1 FVc1 FVc1 FFc1 FFc1 FFc1 FFc1 FFc1 FFc1 FFc1 FFc1 FFc1 FFc1 FFc1 FFc1 FFc1 FFc1 FFc1 FFc1 FFc1 FFc1 FFc1 FFc1 FFc1 FFc1 FFc1 FFc1 FFc1 FFc1 FFc1 FFc1 FFc1 FFc1 FFc1 FFc1 FFc1 FFc1 FFc1 FFc1 FFc1 FFc1 FFc1 FFc1 FFc1 FFc1 FFc1 FFc1 FFc1 FFc1 FFc1 FFc1 FFc1 FFc1 FFc1 FFc1 FFc1 TYc1 FFc1 TYc1 FFc1 FVc1 TYc1 FFc1 FVc1 FFc1 FFc1 FFc1 FFc1 FFc1 FFc1 FFc1 FFc1 FFc1 FFc1 FFc1 FFc1 FFc1 FFc1 FFc1 FFc1 FFc1 FFc1 FFc1 FFc1 FFc1 FFc1 FFc1 FFc1 FFc1 USc1 FFc1 USc1 FFc1 USc1 FFc1 FVc1 FFc1 FVc1 FFc1 FVc1 TYc1 FFc1 FVc1 FFc1 FFc1 FFc1 FFc1 FFc1 FFc1 FFc1 FFc1 FFc1 FFc1 FFc1 FFc1 FFc1 FFc1 FFc1 FFc1 FFc1 FFc1 FFc1 FFc1 FFc1 FFc1 FFc1 FFc1 FFc1 FFc1 FFc1 FFc1 FFc1 FVc1 FFc1 FVc1 FVc1 FFc1 USc1 FFc1 FVc1 FFc1 TYc1 FFc1 FFc1 FFc1 FFc1 FFc1 FFc1 FFc1 FFc1 FFc1 FFc1 FFc1 FFc1 FFc1 FFc1 FFc1 FFc1 FFc1 FFc1 FFc1 FFc1 FFc1 FFc1 FFc1 FFc1 FFc1 FFc1 EDc1 FFc1 EDc1 FFc1 FFc1 EDc1 FFc1 EDc1 FFc1 EDc1 FFc1 EDc1 EDc1 TYc1 TYc1 TYc1 TYc1 FFc1 FFc1 FFc1 FFc1 FFc1 FFc1 FFc1 FFc1 FFc1 FFc1 FFc1 FFc1 FFc1 FFc1 FFc1 FFc1 FFc1 FFc1 FFc1 USc1 USc1 USc1 USc1 TYc1 USc1 TYc1 USc1 FVc1 FVc1 USc1 EMc1 EMc1 EMc1 EMc1 EMc1 EMc1 EMc1 EMc1 EMc1 EMc1 EMc1 EMc1 EMc1 EMc1 EMc1 EMc1 EMc1 EMc1 EMc1 EMc1 EMc1 EMc1 EMc1 EMc1 EMc1 EMc1 EMc1 EMc1 EMc1 EMc1 EMc1 EMc1 EMc1 EMc1 EMc1 EMc1 EMc1 EMc1 EMc1 EMc1 EMc1 EMc1 EMc1 EMc1 EMc1 EMc1 EMc1 EMc1 EMc1 EMc1 EMc1 EMc1 EMc1 EMc1 EMc1 EMc1 EMc1 EMc1 EMc1 EMc1 EMc1 EMc1 EMc1 EMc1 EMc1 EMc1 EMc1 EMc1 EMc1 EMc1 EMc1 EMc1 EMc1 EMc1 EMc1 EMc1 EMc1 EMc1 EMc1 EMc1 EMc1 EMc1 EMc1 EMc1 EMc1 EMc1 EMc1 EMc1 EMc1 EMc1 EMc1 EMc1 EMc1 EMc1 EMc1 EMc1 EMc1 EMc1 EMc1 EMc1 EMc1 EMc1 EMc1 EMc1 EMc1 EMc1 EMc1 EMc1 EMc1 EMc1 EMc1 EMc1 EMc1 EMc1 EMc1 EMc1 EMc1 EMc1 EMc1 EMc1 EMc1 EMc1 EMc1 EMc1 EMc1 EMc1 EMc1 EMc1 EMc1 EMc1 EMc1 EMc1 EMc1 EMc1 EMc1 EMc1 EMc1 EMc1 EMc1 EMc1 EMc1 EMc1 EMc1 EMc1 EMc1 EMc1 EMc1 EMc1 EMc1 EMc1 EMc1 EMc1 EMc1 EMc1 EMc1 EMc1 EMc1 EMc1 EMc1 EMc1 FVc1 FVc1 FVc1 EMc1 FVc1 FVc1 FVc1 TYc1 EMc1 EMc1 EMc1 EMc1 EMc1 EMc1 EMc1 EMc1 EMc1 EMc1 EMc1 EMc1 USc1 TYc1 USc1 FVc1 TYc1 USc1 FVc1 FVc1 FVc1 FVc1 FVc1 FVc1 FVc1 EMc1 EMc1 EMc1 EMc1 EMc1 EMc1 EMc1 EMc1 EMc1 EMc1 EMc1 EMc1 EMc1 EMc1 EMc1 EMc1 EMc1 EMc1 EMc1 EMc1 EMc1 EMc1 EMc1 EMc1 FVc1 FVc1 FVc1 FVc1 TYc1 FVc1 FVc1 FVc1 FVc1 EMc1 EMc1 EMc1 EMc1 EMc1 EMc1 EMc1 EMc1 EMc1 EMc1 EMc1 EMc1 EMc1 EMc1 EMc1 EMc1 EMc1 EMc1 FVc1 EMc1 FVc1 EMc1 FVc1 EMc1 FVc1 FVc1 EMc1 EMc1 EMc1 FVc1 FVc1 EMc1 EMc1 EMc1 EMc1 EMc1 EMc1 EMc1 EMc1 EMc1 EMc1 EMc1 EMc1 EMc1 EMc1 EMc1 EMc1 EMc1 FVc1 FVc1 TYc1 EMc1 USc1 EMc1 USc1 EMc1 EMc1 EMc1 EMc1 EMc1 FVc1 EMc1 EMc1 EMc1 EMc1 EMc1 EMc1 EMc1 EMc1 EMc1 EMc1 EMc1 EMc1 EMc1 EMc1 EMc1 EMc1 EMc1 EMc1 EMc1 EMc1 EMc1 EMc1 EMc1 EMc1 EMc1 EMc1 EMc1 EMc1 EMc1 EMc1 EMc1 EMc1 EMc1 EMc1 EMc1 EMc1 EMc1 EMc1 EMc1 EMc1 EMc1 EMc1 EMc1 EMc1 EMc1 EMc1 EMc1 EMc1 EMc1 EMc1 EMc1 EMc1 EMc1 EMc1 EMc1 EMc1 EMc1 EMc1 EMc1 EMc1 EMc1 EMc1 EMc1 EMc1 EMc1 EMc1 EMc1 EMc1 EMc1 EMc1 EMc1 EMc1 EMc1 EMc1 EMc1 EMc1 EMc1 EMc1 EMc1 EMc1 EMc1 EMc1 EMc1 EMc1 EMc1 EMc1 EMc1 EMc1 EMc1 EMc1 EMc1 EMc1 EMc1 EMc1 EMc1 EMc1 EMc1 EMc1 EMc1 EMc1 EMc1 EMc1 EMc1 EMc1 EMc1 EMc1 EMc1 EMc1 EMc1 EMc1 EMc1 EMc1 EMc1 EMc1 EMc1 EMc1 EMc1 EMc1 EMc1 EMc1 EMc1 EMc1 EMc1 EMc1 EMc1 EMc1 EMc1 EMc1 EMc1 EMc1 EMc1 EMc1 EMc1 EMc1 EMc1 EMc1 EMc1 EMc1 EMc1 EMc1 EMc1 EMc1 EMc1 EMc1 EMc1 EMc1 EMc1 EMc1 EMc1 EMc1 EMc1 EMc1 EMc1 EMc1 EMc1 EMc1 EMc1 EMc1 EMc1 EMc1 EMc1 EMc1 EMc1 EMc1 EMc1 EMc1 EMc1 EMc1 EMc1 EMc1 EMc1 EMc1 EMc1 EMc1 EMc1 EMc1 EMc1 EMc1 EMc1 EMc1 EMc1 EMc1 EMc1 EMc1 EMc1 EMc1 EMc1 EMc1 EMc1 EMc1 EMc1 EMc1 EMc1 EMc1 EMc1 EMc1 EMc1 EMc1 EMc1 EMc1 EMc1 EMc1 EMc1 EMc1 EMc1 EMc1 EMc1 EMc1 EMc1 EMc1 EMc1 EMc1 EMc1 EMc1 EMc1 EMc1 EMc1 EMc1 EMc1 EMc1 EMc1 EMc1 EMc1 EMc1 EMc1 EMc1 EMc1 EMc1 EMc1 EMc1 EMc1 EMc1 EMc1 EMc1 EMc1 EMc1 EMc1 EMc1 EMc1 EMc1 EMc1 EMc1 EMc1 EMc1 EMc1 EMc1 EMc1 EMc1 EMc1 EMc1 EMc1 EMc1 EMc1 EMc1 EMc1 EMc1 EMc1 EMc1 EMc1 EMc1 EMc1 EMc1 EMc1 EMc1 EMc1 EMc1 EMc1 EMc1 EMc1 EMc1 EMc1 EMc1 EMc1 EMc1 EMc1 EMc1 EMc1 EMc1 EMc1 EMc1 EMc1 EMc1 EMc1 EMc1 EMc1 EMc1 EMc1 EMc1 EMc1 EMc1 EMc1 EMc1 EMc1 EMc1 EMc1 EMc1 EMc1 EMc1 EMc1 EMc1 EMc1 EMc1 EMc1 EMc1 EMc1 EMc1 EMc1 EMc1 EMc1 EMc1 EMc1 EMc1 EMc1 EMc1 EMc1 EMc1 EMc1 EMc1 EMc1 EMc1 EMc1 EMc1 EMc1 EMc1 EMc1 EMc1 EMc1 EMc1 EMc1 EMc1 EMc1 EMc1 EMc1 EMc1 EMc1 EMc1 EMc1 EMc1 EMc1 EMc1 EMc1 EMc1 EMc1 EMc1 EMc1 EMc1 EMc1 EMc1 EMc1 EMc1 EMc1 EMc1
166,05::03::Commodities::USA,LCOc1 LCOc1 LCOc1 LCOc1 LCOc1 LCOc1 CLc1 LCOc1 LCOc1 LCOc1 LCOc1 LCOc1 LCOc1 CLc1 LCOc1 CLc1 LCOc1 LCOc1 CLc1 LCOc1 LCOc1 CLc1 LCOc1 LCOc1 LCOc1 LCOc1 CLc1 LCOc1 LCOc1 CLc1 LCOc1 LCOc1 CLc1
167,05::03::Fixed Income::Australia,YBAc1 YTCc1 YTCc1 YTCc1 YTCc1 YTCc1 YTCc1
