,Bucket,Sentence
0,00::00::Commodities::USA,BOc1 BOc1 BOc1 BOc1 BOc1 LHc1 BOc1 BOc1 LCc1 BOc1 BOc1 BOc1 LHc1 LHc1 BOc1 LHc1 BOc1 BOc1 BOc1 LHc1 BOc1 BOc1 BOc1 BOc1 BOc1 LHc1 BOc1 LHc1 BOc1 LHc1 BOc1 BOc1 BOc1 BOc1 BOc1 BOc1 BOc1 BOc1 BOc1 BOc1 BOc1 BOc1 BOc1 BOc1 BOc1 BOc1 BOc1 BOc1 BOc1 BOc1 BOc1 BOc1 BOc1 BOc1 BOc1 BOc1 BOc1 BOc1 BOc1 BOc1 BOc1 BOc1 BOc1 BOc1 LCc1 BOc1 BOc1 BOc1 BOc1 BOc1 BOc1 BOc1 LCc1 LCc1 BOc1 BOc1 BOc1 BOc1 BOc1 BOc1 LCc1 LCc1 LCc1 BOc1 BOc1 BOc1 BOc1 BOc1 BOc1 BOc1 BOc1 BOc1 LCc1 LCc1 BOc1 BOc1 BOc1 LCc1 HGc1 HGc1 HGc1 HGc1 HGc1 HGc1 HGc1 BOc1 HGc1 HGc1 BOc1 HGc1 HGc1 HGc1 HGc1 BOc1 BOc1 BOc1 BOc1 BOc1 HGc1 HGc1 HGc1 HGc1 HOc1 HGc1 HGc1 HGc1 BOc1 BOc1 BOc1 BOc1 BOc1 BOc1 BOc1 BOc1 BOc1 BOc1 BOc1 BOc1 BOc1 BOc1 BOc1 BOc1 BOc1 BOc1 BOc1 BOc1 BOc1 BOc1 BOc1 BOc1 BOc1 BOc1 BOc1 BOc1 BOc1 BOc1 BOc1 BOc1 BOc1 BOc1 BOc1 BOc1 BOc1 BOc1 BOc1 BOc1 BOc1 BOc1 BOc1 BOc1 BOc1 BOc1 BOc1 BOc1 BOc1 BOc1 BOc1 LHc1 BOc1 BOc1 BOc1 HGc1 HGc1 HGc1 HGc1 HGc1 HGc1 LHc1 BOc1 BOc1 BOc1 BOc1 LCc1 LCc1 BOc1 BOc1 BOc1 LCc1 LCc1 BOc1 BOc1 BOc1 BOc1 BOc1 BOc1 BOc1 BOc1 BOc1 BOc1 BOc1 BOc1 BOc1 BOc1 BOc1 BOc1 BOc1 BOc1 BOc1 BOc1 BOc1 BOc1 BOc1 BOc1 BOc1 BOc1 BOc1 BOc1 BOc1 BOc1 BOc1 BOc1 BOc1 BOc1 BOc1 BOc1 BOc1 BOc1 BOc1 BOc1 BOc1 BOc1 BOc1 BOc1 BOc1 BOc1 BOc1 BOc1 BOc1 BOc1 BOc1 BOc1 BOc1 BOc1 BOc1 BOc1 BOc1 BOc1 BOc1 BOc1 BOc1 BOc1 BOc1 BOc1 BOc1 BOc1 BOc1 BOc1 BOc1 BOc1 BOc1 BOc1 BOc1 BOc1 BOc1 BOc1 BOc1 BOc1 BOc1 BOc1 BOc1 BOc1 BOc1 BOc1 BOc1 BOc1 BOc1 BOc1 BOc1 BOc1 BOc1 BOc1 BOc1 YOc1 YOc1 YOc1 YOc1 TTAc1 YOc1 BOc1 TTAc1 YOc1 BOc1 TTAc1 YOc1 BOc1 TTAc1 YOc1 YOc1 YOc1 TTAc1 YOc1 TTAc1 YOc1 YOc1 TTAc1 YOc1 TTAc1 TTAc1 YOc1 TTAc1 YOc1 TTAc1 YOc1 TTAc1 YOc1 TTAc1 YOc1 TTAc1 YOc1 TTAc1 YOc1 TTAc1 YOc1 TTAc1 YOc1 TTAc1 YOc1 TTAc1 YOc1 TTAc1 YOc1 TTAc1 YOc1 TTAc1 YOc1 TTAc1 YOc1 TTAc1 YOc1 TTAc1 YOc1 TTAc1 YOc1 TTAc1 YOc1 TTAc1 YOc1 TTAc1 YOc1 TTAc1 YOc1 TTAc1 YOc1 TTAc1 YOc1 TTAc1 YOc1 TTAc1 YOc1 TTAc1 YOc1 TTAc1 YOc1 TTAc1 YOc1 TTAc1 YOc1 BOc1 TTAc1 YOc1 BOc1 TTAc1 YOc1 BOc1 TTAc1 YOc1 BOc1 TTAc1 YOc1 TTAc1 YOc1 TTAc1 YOc1 TTAc1 YOc1 TTAc1 YOc1 TTAc1 YOc1 TTAc1 YOc1 TTAc1 YOc1 TTAc1 YOc1 TTAc1 YOc1 TTAc1 YOc1 TTAc1 YOc1 TTAc1 YOc1 TTAc1 YOc1 TTAc1 YOc1 TTAc1 YOc1 TTAc1 YOc1 TTAc1 YOc1 TTAc1 YOc1 TTAc1 YOc1 TTAc1 YOc1 TTAc1 YOc1 TTAc1 YOc1 TTAc1 YOc1 TTAc1 YOc1 TTAc1 YOc1 TTAc1 YOc1 TTAc1 YOc1 TTAc1 YOc1 TTAc1 YOc1 TTAc1 YOc1 TTAc1 YOc1 TTAc1 YOc1 TTAc1 YOc1 TTAc1 YOc1 TTAc1 YOc1 TTAc1 YOc1 TTAc1 YOc1 TTAc1 YOc1 TTAc1 YOc1 BOc1 TTAc1 YOc1 BOc1 TTAc1 YOc1 BOc1 TTAc1 YOc1 TTAc1 YOc1 TTAc1 YOc1 TTAc1 YOc1 TTAc1 YOc1 TTAc1 YOc1 TTAc1 YOc1 TTAc1 YOc1 TTAc1 YOc1 TTAc1 YOc1 TTAc1 YOc1 TTAc1 YOc1 TTAc1 YOc1 TTAc1 YOc1 TTAc1 YOc1 TTAc1 YOc1 TTAc1 YOc1 TTAc1 YOc1 TTAc1 YOc1 TTAc1 YOc1 TTAc1 YOc1 TTAc1 YOc1 TTAc1 YOc1 TTAc1 YOc1 TTAc1 YOc1 TTAc1 YOc1 TTAc1 YOc1 TTAc1 YOc1 TTAc1 YOc1 TTAc1 YOc1 TTAc1 YOc1 YOc1 TTAc1 YOc1 TTAc1 YOc1 TTAc1 YOc1 YOc1 YOc1 YOc1 YOc1 YOc1 YOc1 TTAc1 YOc1 BOc1 YOc1 TTAc1 YOc1 TTAc1 YOc1 TTAc1 YOc1 YOc1 TTAc1 YOc1 TTAc1 YOc1 TTAc1 YOc1 TTAc1 YOc1 YOc1 TTAc1 YOc1 TTAc1 YOc1 TTAc1 YOc1 TTAc1 YOc1 TTAc1 YOc1 YOc1 TTAc1 YOc1 TTAc1 YOc1 YOc1 TTAc1 YOc1 BOc1 TTAc1 YOc1 BOc1 TTAc1 YOc1 BOc1 TTAc1 YOc1 TTAc1 YOc1 TTAc1 YOc1 YOc1 YOc1 TTAc1 YOc1 TTAc1 YOc1 TTAc1 YOc1 TTAc1 YOc1 TTAc1 YOc1 TTAc1 YOc1 YOc1 TTAc1 YOc1 YOc1 TTAc1 YOc1 TTAc1 YOc1 TTAc1 TTAc1 YOc1 TTAc1 YOc1 YOc1 BOc1 TTAc1 YOc1 YOc1 YOc1 YOc1 YOc1 YOc1 YOc1 YOc1 YOc1 YOc1 TTAc1 YOc1 TTAc1 YOc1 TTAc1 YOc1 TTAc1 YOc1 TTAc1 YOc1 TTAc1 YOc1 TTAc1 YOc1 TTAc1 YOc1 TTAc1 YOc1 TTAc1 YOc1 TTAc1 YOc1 TTAc1 YOc1 YOc1 YOc1 TTAc1 YOc1 YOc1 TTAc1 YOc1 YOc1 YOc1 YOc1 TTAc1 YOc1 TTAc1 YOc1 TTAc1 YOc1 TTAc1 YOc1 TTAc1 YOc1 YOc1 YOc1 YOc1 YOc1 TTAc1 YOc1 TTAc1 YOc1 TTAc1 YOc1 TTAc1 YOc1 TTAc1 YOc1 TTAc1 YOc1 TTAc1 YOc1 TTAc1 YOc1 YOc1 YOc1 YOc1 YOc1 YOc1 YOc1 TTAc1 YOc1 TTAc1 YOc1 YOc1 TTAc1 YOc1 YOc1 YOc1 TTAc1 YOc1 YOc1 BOc1 YOc1 BOc1 YOc1 BOc1 YOc1 YOc1 YOc1 YOc1 YOc1 YOc1 YOc1 YOc1 YOc1 YOc1 YOc1 YOc1 YOc1 YOc1 YOc1 YOc1 YOc1 YOc1 BOc1 YOc1 BOc1 YOc1 YOc1 YOc1 YOc1 YOc1 YOc1 YOc1 YOc1 YOc1 YOc1 YOc1 YOc1 YOc1 YOc1 YOc1 YOc1 YOc1 YOc1 YOc1 YOc1 YOc1 YOc1 YOc1 YOc1 YOc1 YOc1 YOc1 YOc1 YOc1 YOc1 YOc1 YOc1 YOc1 YOc1 YOc1 YOc1 YOc1 YOc1 YOc1 YOc1 YOc1 BOc1 YOc1 BOc1 YOc1 YOc1 YOc1 YOc1 YOc1 YOc1 YOc1 YOc1 YOc1 YOc1 YOc1 YOc1 YOc1 YOc1 YOc1 YOc1 YOc1 YOc1 YOc1 YOc1 YOc1 YOc1 YOc1 YOc1 YOc1 YOc1 YOc1 YOc1 YOc1 YOc1 YOc1 YOc1 YOc1 YOc1 YOc1 YOc1 YOc1 YOc1 YOc1 BOc1 YOc1 BOc1 YOc1 BOc1 YOc1 BOc1 YOc1 YOc1 YOc1 YOc1 YOc1 YOc1 YOc1 YOc1 YOc1 YOc1 YOc1 YOc1 YOc1 TTAc1 YOc1 YOc1 YOc1 YOc1 YOc1 YOc1 YOc1 YOc1 YOc1 YOc1 YOc1 YOc1 YOc1 YOc1 YOc1 YOc1 YOc1 YOc1 YOc1 YOc1 YOc1 YOc1 YOc1 YOc1 YOc1 YOc1 BOc1 YOc1 BOc1 YOc1 BOc1 YOc1 YOc1 YOc1 YOc1 YOc1 YOc1 YOc1 YOc1 YOc1 YOc1 YOc1 YOc1 YOc1 YOc1 YOc1 YOc1 YOc1 YOc1 YOc1 YOc1 YOc1 BOc1 YOc1 YOc1 BOc1 YOc1 BOc1 YOc1 YOc1 YOc1 YOc1 YOc1 YOc1 YOc1 YOc1 YOc1 YOc1 YOc1 YOc1 YOc1 TTAc1 YOc1 YOc1 TTAc1 YOc1 YOc1 YOc1 YOc1 TTAc1 YOc1 YOc1 TTAc1 YOc1 YOc1 TTAc1 YOc1 YOc1 YOc1 TTAc1 YOc1 TTAc1 YOc1 TTAc1 YOc1 TTAc1 YOc1 TTAc1 TTAc1 YOc1 TTAc1 YOc1 TTAc1 YOc1 TTAc1 YOc1 TTAc1 YOc1 TTAc1 YOc1 TTAc1 YOc1 BOc1 TTAc1 YOc1 BOc1 TTAc1 YOc1 BOc1 TTAc1 YOc1 BOc1 TTAc1 YOc1 TTAc1 YOc1 TTAc1 YOc1 TTAc1 YOc1 TTAc1 YOc1 TTAc1 YOc1 TTAc1 YOc1 TTAc1 YOc1 TTAc1 YOc1 TTAc1 YOc1 TTAc1 YOc1 TTAc1 YOc1 TTAc1 YOc1 TTAc1 YOc1 TTAc1 YOc1 TTAc1 YOc1 TTAc1 YOc1 TTAc1 YOc1 TTAc1 YOc1 TTAc1 YOc1 TTAc1 YOc1 TTAc1 YOc1 TTAc1 YOc1 TTAc1 YOc1 TTAc1 YOc1 TTAc1 YOc1 TTAc1 YOc1 TTAc1 YOc1 TTAc1 YOc1 TTAc1 YOc1 TTAc1 YOc1 TTAc1 YOc1 TTAc1 YOc1 TTAc1 YOc1 TTAc1 YOc1 TTAc1 YOc1 TTAc1 YOc1 TTAc1 YOc1 TTAc1 YOc1 TTAc1 YOc1 TTAc1 YOc1 TTAc1 YOc1 TTAc1 YOc1 TTAc1 TTAc1 YOc1 TTAc1 YOc1 YOc1 TTAc1 YOc1 TTAc1 TTAc1 YOc1 TTAc1 YOc1 TTAc1 YOc1 TTAc1 YOc1 TTAc1 YOc1 TTAc1 YOc1 TTAc1 YOc1 BOc1 TTAc1 YOc1 BOc1 TTAc1 YOc1 TTAc1 YOc1 TTAc1 YOc1 TTAc1 YOc1 TTAc1 YOc1 TTAc1 YOc1 TTAc1 YOc1 TTAc1 YOc1 YOc1 TTAc1 YOc1 TTAc1 YOc1 TTAc1 YOc1 TTAc1 YOc1 YOc1 YOc1 TTAc1 YOc1 YOc1 TTAc1 YOc1 YOc1 TTAc1 TTAc1 TTAc1 YOc1 TTAc1 YOc1 TTAc1 YOc1 YOc1 TTAc1 YOc1 TTAc1 YOc1 TTAc1 YOc1 TTAc1 YOc1 TTAc1 YOc1 TTAc1 YOc1 YOc1 TTAc1 YOc1 YOc1 YOc1 TTAc1 YOc1 TTAc1 YOc1 TTAc1 YOc1 BOc1 TTAc1 YOc1 YOc1 TTAc1 YOc1 YOc1 TTAc1 YOc1 TTAc1 YOc1 TTAc1 YOc1 TTAc1 YOc1 TTAc1 YOc1 YOc1 TTAc1 YOc1 YOc1 TTAc1 TTAc1 YOc1 TTAc1 YOc1 TTAc1 YOc1 TTAc1 YOc1 TTAc1 YOc1 TTAc1 YOc1 TTAc1 YOc1 TTAc1 YOc1 TTAc1 YOc1 TTAc1 YOc1 TTAc1 YOc1 TTAc1 YOc1 TTAc1 YOc1 TTAc1 YOc1 TTAc1 YOc1 TTAc1 YOc1 YOc1 TTAc1 YOc1 TTAc1 TTAc1 TTAc1 TTAc1 TTAc1 YOc1 TTAc1 YOc1 TTAc1 YOc1 TTAc1 YOc1 TTAc1 YOc1 TTAc1 YOc1 TTAc1 YOc1 TTAc1 YOc1 BOc1 TTAc1 YOc1 TTAc1 YOc1 TTAc1 YOc1 TTAc1 YOc1 TTAc1 YOc1 TTAc1 YOc1 TTAc1 YOc1 TTAc1 YOc1 TTAc1 YOc1 TTAc1 YOc1 TTAc1 YOc1 TTAc1 YOc1 TTAc1 YOc1 TTAc1 YOc1 TTAc1 YOc1 TTAc1 YOc1 TTAc1 YOc1 TTAc1 YOc1 TTAc1 YOc1 TTAc1 YOc1 TTAc1 YOc1 TTAc1 YOc1 TTAc1 YOc1 TTAc1 YOc1 YOc1 TTAc1 YOc1 TTAc1 YOc1 TTAc1 YOc1 TTAc1 YOc1 TTAc1 YOc1 TTAc1 YOc1 TTAc1 YOc1 TTAc1 YOc1 TTAc1 YOc1 TTAc1 YOc1 TTAc1 YOc1 TTAc1 YOc1 YOc1 TTAc1 YOc1 YOc1 BOc1 YOc1 YOc1 YOc1 YOc1 TTAc1 YOc1 TTAc1 YOc1 TTAc1 YOc1 TTAc1 YOc1 TTAc1 YOc1 YOc1 TTAc1 YOc1 YOc1 YOc1 TTAc1 YOc1 YOc1 YOc1 YOc1 YOc1 YOc1 TTAc1 YOc1 TTAc1 YOc1 BOc1 YOc1 BOc1 YOc1 BOc1 YOc1 TTAc1 YOc1 YOc1 YOc1 YOc1 YOc1 YOc1 TTAc1 YOc1 YOc1 YOc1 YOc1 TTAc1 YOc1 YOc1 YOc1 YOc1 YOc1 YOc1 YOc1 TTAc1 YOc1 YOc1 BOc1 YOc1 YOc1 YOc1 TTAc1 YOc1 YOc1 YOc1 YOc1 YOc1 YOc1 TTAc1 YOc1 TTAc1 YOc1 TTAc1 YOc1 TTAc1 YOc1 TTAc1 YOc1 TTAc1 YOc1 TTAc1 YOc1 TTAc1 YOc1 TTAc1 YOc1 YOc1 TTAc1 YOc1 BOc1 YOc1 BOc1 TTAc1 YOc1 BOc1 YOc1 YOc1 YOc1 YOc1 YOc1 YOc1 YOc1 YOc1 YOc1 YOc1 YOc1 YOc1 YOc1 YOc1 YOc1 YOc1 YOc1 YOc1 YOc1 YOc1 YOc1 YOc1 YOc1 YOc1 YOc1 YOc1 YOc1 YOc1 YOc1 YOc1 YOc1 YOc1 YOc1 YOc1 YOc1 YOc1 YOc1 YOc1 YOc1 YOc1 YOc1 YOc1 BOc1 YOc1 BOc1 YOc1 YOc1 YOc1 YOc1 YOc1 YOc1 YOc1 YOc1 YOc1 YOc1 YOc1 YOc1 YOc1
1,00::00::FX::USA,RAc1 RAc1 RAc1 RAc1 RAc1 RAc1 RAc1 RAc1 RAc1 RAc1 RAc1 RAc1 RAc1 RAc1 RAc1 RAc1 RAc1 RAc1 RAc1 RAc1 RAc1 RAc1 RAc1 RAc1 RAc1 RAc1 RAc1 RAc1 RAc1 RAc1 RAc1 RAc1 RAc1 RAc1 RAc1 RAc1 RAc1 RAc1 RAc1 RAc1 RAc1 RAc1 NEc1 RAc1 RAc1 NEc1 RAc1 RAc1 RAc1 RAc1 RAc1 RAc1 NEc1 RAc1 NEc1 NEc1 NEc1 NEc1 NEc1 NEc1 NEc1 NEc1 NEc1 NEc1 NEc1 NEc1 NEc1 NEc1 NEc1 NEc1 NEc1 NEc1 NEc1 NEc1 NEc1 NEc1 NEc1 NEc1 NEc1 NEc1 NEc1 NEc1 NEc1 NEc1 NEc1 NEc1 NEc1 NEc1 NEc1 NEc1 NEc1 NEc1 NEc1 NEc1 NEc1 NEc1 NEc1 NEc1 RAc1 NEc1 NEc1 NEc1 NEc1 RAc1 NEc1 NEc1 NEc1 NEc1 NEc1 NEc1 NEc1 NEc1 NEc1 NEc1 NEc1 NEc1 NEc1 NEc1 NEc1 NEc1 NEc1 NEc1 NEc1 NEc1 RAc1 NEc1 RAc1 RAc1 RAc1 RAc1 RAc1 RAc1 NEc1 RAc1 NEc1 NEc1 NEc1 RAc1 NEc1 NEc1 NEc1 NEc1 RAc1 NEc1 NEc1 NEc1 NEc1 NEc1 NEc1 NEc1 NEc1 NEc1 NEc1 NEc1 NEc1 NEc1 NEc1 NEc1 NEc1 RAc1 NEc1 NEc1 NEc1 NEc1 NEc1 NEc1 NEc1 NEc1 RAc1 NEc1 NEc1 NEc1 NEc1 NEc1 NEc1 NEc1 NEc1 NEc1 NEc1 NEc1 RAc1 RAc1 NEc1 RAc1 RAc1 NEc1 RAc1 RAc1 NEc1 NEc1 NEc1 NEc1 NEc1 NEc1 NEc1 NEc1 NEc1 NEc1 NEc1 NEc1 NEc1 NEc1 RAc1 NEc1 BRc1 BRc1 NEc1 NEc1 NEc1 NEc1 BRc1 BRc1 NEc1 BRc1 NEc1 RAc1 BRc1 BRc1 BRc1 BRc1 BRc1 BRc1 NEc1 BRc1 BRc1 BRc1 BRc1 BRc1 NEc1 BRc1 BRc1 BRc1 NEc1 BRc1 BRc1 NEc1 NEc1 NEc1 NEc1 BRc1 BRc1 NEc1 NEc1 NEc1 NEc1 NEc1 NEc1 NEc1 BRc1 BRc1 NEc1 BRc1 NEc1 BRc1 NEc1 BRc1 BRc1 BRc1 BRc1 BRc1 NEc1 NEc1 RAc1 NEc1 RAc1 RAc1 NEc1 NEc1 NEc1 NEc1 NEc1 NEc1 NEc1 NEc1 JYc1 NEc1 NEc1 NEc1 NEc1 NEc1 NEc1 NEc1 NEc1 NEc1 RAc1 NEc1 NEc1 RAc1 RAc1 NEc1 NEc1 NEc1 NEc1 NEc1 NEc1 NEc1 NEc1 NEc1 NEc1 RAc1 NEc1 NEc1 RAc1 NEc1 RAc1 NEc1 NEc1 NEc1 NEc1 NEc1 NEc1 NEc1 NEc1 NEc1 NEc1 NEc1 NEc1 NEc1 NEc1 RAc1 RAc1 RAc1 RAc1 RAc1 RAc1 RAc1 RAc1 RAc1 RAc1 RAc1 RAc1 NEc1 NEc1 RAc1 NEc1 NEc1 NEc1 NEc1 NEc1 NEc1 NEc1 NEc1 RAc1 NEc1 NEc1 NEc1 RAc1 NEc1 NEc1 RUc1 RUc1 NEc1 NEc1 NEc1 NEc1 NEc1 NEc1 NEc1 NEc1 NEc1 NEc1 RUc1 NEc1 NEc1 MPc1 NEc1 MPc1 NEc1 MPc1 MPc1 MPc1 MPc1 MPc1 NEc1 MPc1 RAc1 MPc1 MPc1 MPc1 MPc1 MPc1 MPc1 MPc1 MPc1 MPc1 RAc1 MPc1 MPc1 MPc1 MPc1 MPc1 MPc1 NEc1 MPc1 MPc1 MPc1 MPc1 MPc1 MPc1 NEc1 MPc1 MPc1 NEc1 RAc1 NEc1 RAc1 NEc1 RUc1 NEc1 MPc1 MPc1 MPc1 MPc1 MPc1 MPc1 MPc1 MPc1 RAc1 MPc1 MPc1 MPc1 MPc1 MPc1 MPc1 MPc1 MPc1 MPc1 MPc1 MPc1 RAc1 MPc1 MPc1 MPc1 MPc1 RAc1 MPc1 MPc1 MPc1 MPc1 MPc1 MPc1 MPc1 MPc1 MPc1 MPc1 MPc1 RAc1 MPc1 MPc1 RAc1 MPc1 RAc1 MPc1 MPc1 MPc1 MPc1 RAc1 MPc1 NEc1 NEc1 NEc1 NEc1 NEc1 NEc1 NEc1 NEc1 NEc1 NEc1 NEc1 NEc1 NEc1 NEc1 NEc1 NEc1 NEc1 NEc1 NEc1 MPc1 NEc1 NEc1 NEc1 NEc1 NEc1 NEc1 NEc1 NEc1 NEc1 NEc1 NEc1 NEc1 NEc1 NEc1 NEc1 NEc1 NEc1 NEc1 NEc1 NEc1 NEc1 NEc1 NEc1 NEc1 NEc1 NEc1 NEc1 RAc1 NEc1 NEc1 NEc1 NEc1 RAc1 NEc1 NEc1 NEc1 NEc1 NEc1 NEc1 NEc1 NEc1 NEc1 NEc1 NEc1 NEc1 NEc1 RAc1 RAc1 RAc1 RAc1 RAc1 MPc1 MPc1 MPc1 MPc1 MPc1 MPc1 MPc1 MPc1 MPc1 MPc1 MPc1 MPc1 MPc1 MPc1 MPc1 MPc1 MPc1 MPc1 MPc1 RAc1 RAc1 MPc1 MPc1 MPc1 MPc1 MPc1 MPc1 MPc1 MPc1 MPc1 MPc1 MPc1 MPc1 MPc1 MPc1 MPc1 MPc1 MPc1 RAc1 MPc1 MPc1 MPc1 RUc1 RUc1 RUc1 RUc1 RAc1 RAc1 RAc1 RAc1 RAc1 RAc1 RAc1 RAc1 RAc1 RUc1 JYc1 JYc1 RUc1 RUc1 RUc1 RUc1 RUc1 RUc1 RUc1 RUc1 RUc1 RUc1 RUc1 RAc1 RAc1 RUc1 RAc1 RUc1 RAc1 RUc1 RAc1 MPc1 MPc1 MPc1 MPc1 MPc1 MPc1 MPc1 MPc1 RUc1 MPc1 RUc1 RUc1 RUc1 RUc1 RUc1 RUc1 MPc1 RUc1 RUc1 RUc1 RUc1 RUc1 RUc1 MPc1 MPc1 MPc1 MPc1 MPc1 MPc1 MPc1 MPc1 MPc1 RAc1 RUc1 MPc1 MPc1 RAc1 MPc1 MPc1 RAc1 RUc1 MPc1 RAc1 RUc1 MPc1 MPc1 MPc1 RAc1 MPc1 RUc1 MPc1 MPc1 RAc1 MPc1 RUc1 RUc1 RUc1 RUc1 MPc1 MPc1 NEc1 NEc1 RUc1 MPc1 NEc1 RUc1 MPc1 MPc1 RUc1 MPc1 RUc1 RUc1 MPc1 MPc1 RUc1 MPc1 RUc1 RAc1 RUc1 RAc1 RUc1 RAc1 RUc1 RUc1 RUc1 RUc1 RUc1 RUc1 RUc1 RUc1 RUc1 RUc1 RUc1 RUc1 RUc1 RUc1 RUc1 RUc1 RUc1 RUc1 RUc1 RUc1 RUc1 RUc1 RUc1 RUc1 RUc1 RUc1 RUc1 RUc1 RUc1 RUc1 MPc1 RAc1 RUc1 MPc1 RAc1 MPc1 RUc1 MPc1 RAc1 RUc1 MPc1 RUc1 MPc1 MPc1 RAc1 RUc1 MPc1 RUc1 MPc1 MPc1 MPc1 MPc1 RAc1 RUc1 MPc1 RAc1 MPc1 RAc1 MPc1 MPc1 RAc1 RUc1 MPc1 MPc1 RUc1 MPc1 RUc1 MPc1 RUc1 RUc1 RUc1 RUc1 RUc1 RUc1 MPc1 RUc1 RUc1 RUc1 RUc1 MPc1 RUc1 RUc1 RUc1 MPc1 RUc1 RUc1 MPc1 NEc1 RUc1 MPc1 NEc1 RUc1 NEc1 RUc1 NEc1 RUc1 NEc1 RUc1 MPc1 NEc1 NEc1 NEc1 NEc1 NEc1 NEc1 MPc1 NEc1 MPc1 NEc1 NEc1 RUc1 MPc1 RAc1 MPc1 MPc1 MPc1 RUc1 MPc1 RUc1 MPc1 MPc1 MPc1 MPc1 NEc1 RAc1 MPc1 NEc1 RAc1 RUc1 NEc1 MPc1 NEc1 NEc1 NEc1 RUc1 NEc1 RAc1 NEc1 RAc1 NEc1 RAc1 RUc1 NEc1 RUc1 NEc1 NEc1 NEc1 NEc1 NEc1 NEc1 NEc1 NEc1 NEc1 NEc1 NEc1 NEc1 NEc1 RUc1 RUc1 RUc1 RUc1 NEc1 NEc1 RUc1 NEc1 NEc1 NEc1 NEc1 RUc1 RUc1 MPc1 HFOc1 RUc1 RUc1 RUc1 RUc1 RUc1 RUc1 MPc1 RUc1 HFOc1 RUc1 RUc1 RUc1 RUc1 RUc1 RUc1 MPc1 MPc1 RUc1 MPc1 MPc1 RUc1 MPc1 RUc1 MPc1 RUc1 MPc1 RUc1 MPc1 MPc1 RAc1 RUc1 MPc1 RUc1 MPc1 RAc1 RUc1 MPc1 RAc1 MPc1 RAc1 MPc1 RAc1 RUc1 MPc1 MPc1 RUc1 MPc1 MPc1 RAc1 RUc1 RUc1 MPc1 RUc1 RUc1 RUc1 RUc1 RUc1 RUc1 RUc1 RUc1 RUc1 RUc1 RUc1 RUc1 RUc1 RUc1 RUc1 RUc1 RUc1 RUc1 RUc1 MPc1 RAc1 RUc1 MPc1 RAc1 RUc1 MPc1 RAc1 RUc1 MPc1 RAc1 MPc1 RAc1 MPc1 RAc1 MPc1 RAc1 RUc1 MPc1 RAc1 RUc1 MPc1 RUc1 MPc1 RAc1 RUc1 MPc1 RAc1 MPc1 RAc1 MPc1 RAc1 MPc1 RAc1 MPc1 RAc1 MPc1 RAc1 RUc1 MPc1 RAc1 RUc1 MPc1 RAc1 MPc1 RUc1 MPc1 RUc1 RUc1 RUc1 MPc1 RUc1 MPc1 RUc1 RUc1 RUc1 RUc1 RUc1 RUc1 RUc1 RUc1 RUc1 RUc1 RUc1 RUc1 RUc1 MPc1 RUc1 RAc1 RAc1 RAc1 RAc1 RAc1 RUc1 RAc1 RAc1 RAc1 RAc1 RAc1 RAc1 RUc1 RAc1 RAc1 RAc1 RAc1 RUc1 RAc1 RAc1 RAc1 RUc1 MPc1 RAc1 MPc1 RUc1 MPc1 RUc1 MPc1 RUc1 RUc1 MPc1 MPc1 RUc1 MPc1 RUc1 RUc1 RUc1 RUc1 MPc1 MPc1 RUc1 RUc1 RUc1 RUc1 RUc1 RUc1 RUc1 RUc1 RUc1 RUc1 RUc1 RUc1 RUc1 MPc1 RAc1 MPc1 RAc1 RUc1 MPc1 RAc1 RUc1 MPc1 RAc1 MPc1 RAc1 MPc1 RAc1 MPc1 RUc1 MPc1 RAc1 RUc1 MPc1 RAc1 MPc1 RAc1 MPc1 MPc1 RAc1 RUc1 MPc1 RAc1 MPc1 RAc1 RUc1 MPc1 RAc1 MPc1 MPc1 RAc1 RUc1 MPc1 RAc1 RUc1 MPc1 RAc1 MPc1 RAc1 RUc1 MPc1 RUc1 MPc1 RAc1 MPc1 RAc1 MPc1 RUc1 RUc1 RUc1 RUc1 RUc1 HFOc1 RUc1 RUc1 RUc1 MPc1 RUc1 RUc1 RUc1 RUc1 RUc1 RUc1 RUc1 RUc1 RUc1 RUc1 MPc1 RUc1 MPc1 RAc1 RUc1 MPc1 MPc1 RAc1 MPc1 RAc1 MPc1 RAc1 RUc1 MPc1 RAc1 MPc1 RAc1 RUc1 MPc1 RAc1 RUc1 BRc1 MPc1 BRc1 RAc1 RUc1 RAc1 RUc1 RAc1 RUc1 RAc1 RAc1 RUc1 RAc1 RAc1 RUc1 RAc1 RAc1 RUc1 RAc1 RUc1 RAc1 RAc1 RAc1 RAc1 RUc1 RAc1 RAc1 RAc1 RAc1 RAc1 RAc1 MPc1 MPc1 MPc1 CKOc1 CKOc1 CKOc1 CKOc1 CKOc1 HFOc1 CKOc1 HFOc1 CKOc1 HFOc1 CKOc1 CKOc1 HFOc1 MPc1 CKOc1 HFOc1 MPc1 CKOc1 CKOc1 HFOc1 BRc1 CKOc1 CKOc1 CKOc1 HFOc1 CKOc1 HFOc1 MPc1 BRc1 HFOc1 HFOc1 HFOc1 HFOc1 HFOc1 HFOc1 CKOc1 HFOc1 HFOc1 CKOc1 CKOc1 HFOc1 CKOc1 MPc1 HFOc1 BRc1 CKOc1 CKOc1 HFOc1 HFOc1 HFOc1 MPc1 CKOc1 HFOc1 MPc1 CKOc1 MPc1 BRc1 CKOc1 BRc1 CKOc1 HFOc1 BRc1 BRc1 BRc1 MPc1 BRc1 CKOc1 BRc1 HFOc1 MPc1 HFOc1 MPc1 MPc1 BRc1 CKOc1 CKOc1 HFOc1 CKOc1 HFOc1 CKOc1 CKOc1 HFOc1 CKOc1 HFOc1 HFOc1 CKOc1 HFOc1 CKOc1 HFOc1 CKOc1 HFOc1 HFOc1 CKOc1 HFOc1 CKOc1 CKOc1 CKOc1 CKOc1 CKOc1 CKOc1 CKOc1 CKOc1 HFOc1 HFOc1 HFOc1 MPc1 CKOc1 MPc1 CKOc1 MPc1 MPc1 MPc1 CKOc1 HFOc1 MPc1 CKOc1 HFOc1 MPc1 CKOc1 HFOc1 MPc1 CKOc1 HFOc1 MPc1 HFOc1 MPc1 CKOc1 MPc1 CKOc1 HFOc1 MPc1 BRc1 CKOc1 MPc1 MPc1 CKOc1 HFOc1 MPc1 MPc1 CKOc1 MPc1 MPc1 HFOc1 CKOc1 HFOc1 CKOc1 HFOc1 CKOc1 CKOc1 HFOc1 HFOc1 HFOc1 CKOc1 HFOc1 HFOc1 HFOc1 HFOc1 HFOc1 HFOc1 HFOc1 HFOc1 HFOc1 CKOc1 HFOc1 HFOc1 RUc1 RUc1 CKOc1 RUc1 CKOc1 HFOc1 CKOc1 HFOc1 CKOc1 BRc1 CKOc1 HFOc1 BRc1 HFOc1 CKOc1 BRc1 CKOc1 HFOc1 BRc1 HFOc1 HFOc1 HFOc1 MPc1 HFOc1 MPc1 MPc1 HFOc1 MPc1 HFOc1 MPc1 MPc1 CKOc1 HFOc1 MPc1 MPc1 MPc1 CKOc1 CKOc1 CKOc1 CKOc1 CKOc1 HFOc1 CKOc1 CKOc1 CKOc1 HFOc1 CKOc1 BRc1 BRc1 BRc1 CKOc1 CKOc1 HFOc1 CKOc1 HFOc1 CKOc1 CKOc1 MPc1 MPc1 MPc1 CKOc1 MPc1 BRc1 CKOc1 HFOc1 MPc1 CKOc1 MPc1 MPc1 CKOc1 MPc1 CKOc1 MPc1 HFOc1 MPc1 MPc1 MPc1 MPc1 HFOc1 MPc1 MPc1 MPc1 CKOc1 MPc1 MPc1 MPc1 MPc1 CKOc1 CKOc1 HFOc1 CKOc1 HFOc1 CKOc1 CKOc1 MPc1 HFOc1 MPc1 MPc1 MPc1 CKOc1 HFOc1 MPc1 CKOc1 MPc1 CKOc1 MPc1 CKOc1 MPc1 CKOc1 CKOc1 HFOc1 CKOc1 HFOc1 CKOc1 HFOc1 HFOc1 CKOc1 CKOc1 CKOc1 CKOc1 CKOc1 HFOc1 HFOc1 BRc1 BRc1 BRc1 BRc1 BRc1 BRc1 BRc1 CKOc1 CKOc1 CKOc1 CKOc1 CKOc1 CKOc1 CKOc1 HFOc1 CKOc1 CKOc1 CKOc1 CKOc1 CKOc1 HFOc1 CKOc1 CKOc1 CKOc1 BRc1 CKOc1 BRc1 CKOc1 CKOc1 HFOc1 BRc1 CKOc1 BRc1 CKOc1 HFOc1 CKOc1 BRc1 HFOc1 BRc1 BRc1 BRc1 BRc1 BRc1 BRc1 CKOc1 CKOc1 HFOc1 HFOc1 CKOc1 CKOc1 CKOc1 HFOc1 CKOc1 CKOc1 HFOc1 CKOc1 CKOc1 CKOc1 CKOc1 CKOc1 HFOc1 CKOc1 HFOc1 HFOc1 CKOc1 HFOc1 CKOc1 HFOc1 MPc1 HFOc1 BRc1 HFOc1 CKOc1 BRc1 CKOc1 HFOc1 CKOc1 HFOc1 CKOc1 MPc1 HFOc1 CKOc1 HFOc1 MPc1 MPc1 MPc1 HFOc1 MPc1 CKOc1 HFOc1 MPc1 MPc1 CKOc1 MPc1 CKOc1 HFOc1 MPc1 MPc1 MPc1 MPc1 MPc1 MPc1 MPc1 MPc1 HFOc1 MPc1 MPc1 MPc1 MPc1 MPc1 MPc1 BRc1 BRc1 BRc1 BRc1 BRc1 BRc1 BRc1 BRc1 BRc1 BRc1 BRc1 BRc1 BRc1 BRc1 MPc1 BRc1 BRc1 MPc1 RAc1 BRc1 MPc1 RAc1 BRc1 MPc1 RAc1 BRc1 MPc1 RAc1 BRc1 MPc1 RAc1 BRc1 MPc1 RAc1 BRc1 MPc1 RAc1 MPc1 RAc1 MPc1 RAc1 MPc1 RAc1 MPc1 RAc1 MPc1 RAc1 BRc1 RAc1 RAc1 RAc1 RAc1 RAc1 RAc1 HFOc1 CKOc1 HFOc1 CKOc1 HFOc1 CKOc1 HFOc1 HFOc1 HFOc1 CKOc1 HFOc1 CKOc1 HFOc1 CKOc1 HFOc1 CKOc1 HFOc1 HFOc1 MPc1 MPc1 MPc1 MPc1 CKOc1 CKOc1 CKOc1 HFOc1 CKOc1 HFOc1 HFOc1 CKOc1 CKOc1 HFOc1 CKOc1 CKOc1 HFOc1 CKOc1 HFOc1 HFOc1 HFOc1 CKOc1 HFOc1 HFOc1 CKOc1 HFOc1 MPc1 HFOc1 CKOc1 HFOc1 HFOc1 MPc1 HFOc1 MPc1 MPc1 MPc1 MPc1 MPc1 MPc1 MPc1 MPc1 MPc1 MPc1 HFOc1 MPc1 CKOc1 HFOc1 MPc1 BRc1 MPc1 HFOc1 MPc1 BRc1 MPc1 BRc1 MPc1 BRc1 MPc1 BRc1 MPc1 BRc1 HFOc1 BRc1 HFOc1 HFOc1 BRc1 BRc1 HFOc1 HFOc1 MPc1 BRc1 BRc1 HFOc1 HFOc1 BRc1 HFOc1 BRc1 BRc1 HFOc1 BRc1 CKOc1 HFOc1 HFOc1 BRc1 CKOc1 HFOc1 CKOc1 HFOc1 BRc1 HFOc1 BRc1 BRc1 BRc1 HFOc1 BRc1 HFOc1 CKOc1 HFOc1 MPc1 HFOc1 MPc1 HFOc1 MPc1 CKOc1 HFOc1 MPc1 MPc1 HFOc1 MPc1 MPc1 HFOc1 MPc1 HFOc1 MPc1 RAc1 HFOc1 MPc1 RAc1 MPc1 RAc1 MPc1 RAc1 MPc1 RAc1 MPc1 RAc1 HFOc1 RAc1 RAc1 HFOc1 RAc1 HFOc1 HFOc1 HFOc1 HFOc1 HFOc1 HFOc1 HFOc1 HFOc1 CKOc1 HFOc1 HFOc1 HFOc1 HFOc1 HFOc1 RAc1 HFOc1 RAc1 RAc1 RAc1 CKOc1 RAc1 RAc1 RAc1 RAc1 HFOc1 RAc1 HFOc1 RAc1 HFOc1 RAc1 MPc1 RAc1 HFOc1 MPc1 RAc1 HFOc1 MPc1 MPc1 RAc1 CKOc1 MPc1 RAc1 MPc1 RAc1 MPc1 HFOc1 HFOc1 HFOc1 HFOc1 HFOc1 HFOc1 HFOc1 HFOc1 HFOc1 MPc1 RAc1 MPc1 RAc1 MPc1 RAc1 MPc1 RAc1 MPc1 RAc1 MPc1 RAc1 MPc1 RAc1 MPc1 MPc1 RAc1 MPc1 RAc1 MPc1 RAc1 MPc1 RAc1 MPc1 RAc1 MPc1 RAc1 CKOc1 HFOc1 MPc1 RAc1 MPc1 RAc1 MPc1 RAc1 HFOc1 MPc1 RAc1 MPc1 RAc1 CKOc1 HFOc1 HFOc1 HFOc1 HFOc1 HFOc1 HFOc1 HFOc1 HFOc1 MPc1 RAc1 MPc1 RAc1 MPc1 MPc1 MPc1 MPc1 MPc1 MPc1 MPc1 MPc1 CKOc1 MPc1 MPc1 CKOc1 CKOc1 HFOc1 CKOc1 HFOc1 CKOc1 HFOc1 HFOc1 CKOc1 CKOc1 HFOc1 CKOc1
2,00::00::Fixed Income::Korea,10TBc1 10TBc1 10TBc1 10TBc1 10TBc1 10TBc1 10TBc1 10TBc1 10TBc1 10TBc1 10TBc1 10TBc1 10TBc1 10TBc1 10TBc1 10TBc1 10TBc1 10TBc1
3,00::01::Commodities::USA,FCc1 BOc1 FCc1 BOc1 FCc1 BOc1 FCc1 BOc1 FCc1 BOc1 FCc1 BOc1 FCc1 BOc1 FCc1 BOc1 FCc1 BOc1 FCc1 FCc1 FCc1 FCc1 FCc1 FCc1 FCc1 FCc1 LHc1 LHc1 LHc1 LHc1 LHc1 LHc1 LHc1 LCc1 LHc1 LCc1 LHc1 LCc1 LHc1 LCc1 LHc1 LCc1 BOc1 BOc1 BOc1 BOc1 FCc1 BOc1 FCc1 BOc1 FCc1 BOc1 FCc1 BOc1 FCc1 BOc1 FCc1 BOc1 FCc1 FCc1 FCc1 FCc1 FCc1 FCc1 FCc1 FCc1 FCc1 FCc1 FCc1 FCc1 FCc1 FCc1 FCc1 FCc1 LHc1 FCc1 LHc1 FCc1 LCc1 LHc1 FCc1 LCc1 LHc1 FCc1 LCc1 LHc1 FCc1 LCc1 LHc1 FCc1 LCc1 LHc1 FCc1 LCc1 LHc1 FCc1 LHc1 FCc1 FCc1 BOc1 FCc1 BOc1 FCc1 BOc1 FCc1 BOc1 FCc1 BOc1 FCc1 BOc1 FCc1 BOc1 FCc1 BOc1 FCc1 BOc1 FCc1 BOc1 FCc1 BOc1 FCc1 BOc1 FCc1 FCc1 FCc1 LHc1 LHc1 LHc1 LCc1 LHc1 LCc1 LHc1 LCc1 LHc1 LCc1 BOc1 LHc1 BOc1 LHc1 BOc1 LHc1 BOc1 LHc1 BOc1 LHc1 BOc1 LHc1 BOc1 LHc1 BOc1 LHc1 BOc1 LHc1 BOc1 LHc1 BOc1 FCc1 FCc1 FCc1 FCc1 FCc1 FCc1 FCc1 LHc1 FCc1 LHc1 BOc1 FCc1 LHc1 BOc1 LHc1 BOc1 FCc1 LHc1 BOc1 FCc1 LHc1 BOc1 FCc1 LHc1 BOc1 FCc1 LHc1 BOc1 FCc1 LHc1 BOc1 FCc1 LHc1 BOc1 FCc1 LHc1 FCc1 BOc1 FCc1 FCc1 FCc1 FCc1 FCc1 FCc1 FCc1 FCc1 BOc1 FCc1 BOc1 FCc1 BOc1 FCc1 BOc1 FCc1 BOc1 FCc1 BOc1 FCc1 BOc1 FCc1 BOc1 FCc1 BOc1 FCc1 BOc1 FCc1 BOc1 FCc1 BOc1 FCc1 FCc1 FCc1 FCc1 BOc1 BOc1 LHc1 BOc1 LHc1 BOc1 FCc1 LHc1 BOc1 FCc1 LHc1 BOc1 FCc1 LHc1 BOc1 FCc1 LHc1 BOc1 FCc1 LHc1 BOc1 FCc1 LHc1 FCc1 LHc1 BOc1 FCc1 LHc1 BOc1 FCc1 FCc1 FCc1 FCc1 FCc1 FCc1 FCc1 FCc1 FCc1 FCc1 FCc1 FCc1 FCc1 BOc1 BOc1 BOc1 LHc1 BOc1 LHc1 BOc1 LHc1 BOc1 LHc1 BOc1 BOc1 BOc1 BOc1 BOc1 BOc1 BOc1 BOc1 BOc1 BOc1 BOc1 BOc1 BOc1 BOc1 LCc1 LCc1 LCc1 LCc1 BOc1 BOc1 BOc1 BOc1 HOc1 BOc1 BOc1 BOc1 HOc1 BOc1 BOc1 BOc1 BOc1 BOc1 BOc1 BOc1 BOc1 BOc1 BOc1 HOc1 LCc1 HOc1 BOc1 BOc1 BOc1 BOc1 BOc1 BOc1 BOc1 BOc1 BOc1 HOc1 BOc1 BOc1 BOc1 BOc1 BOc1 BOc1 BOc1 BOc1 BOc1 BOc1 BOc1 BOc1 BOc1 BOc1 BOc1 BOc1 BOc1 BOc1 BOc1 BOc1 BOc1 BOc1 BOc1 BOc1 BOc1 BOc1 BOc1 BOc1 BOc1 BOc1 BOc1 BOc1 BOc1 BOc1 BOc1 LHc1 BOc1 BOc1 BOc1 BOc1 BOc1 BOc1 BOc1 BOc1 BOc1 BOc1 BOc1 BOc1 BOc1 BOc1 BOc1 BOc1 BOc1 LHc1 LHc1 LCc1 LCc1 HOc1 LCc1 BOc1 BOc1 BOc1 BOc1 BOc1 BOc1 BOc1 BOc1 BOc1 BOc1 HOc1 LHc1 LHc1 LHc1 HOc1 BOc1 BOc1 BOc1 BOc1 BOc1 BOc1 BOc1 HOc1 LHc1 LHc1 HOc1 LHc1 LCc1 LHc1 LCc1 LHc1 LCc1 LHc1 LHc1 LHc1 LHc1 LHc1 LHc1 LHc1 BOc1 BOc1 BOc1 BOc1 BOc1 BOc1 BOc1 HOc1 LHc1 LHc1 LHc1 LHc1 LHc1 BOc1 BOc1 BOc1 BOc1 BOc1 LCc1 BOc1 LCc1 BOc1 LCc1 BOc1 LCc1 BOc1 LCc1 BOc1 HOc1 LCc1 LCc1 LCc1 LCc1 BOc1 BOc1 BOc1 BOc1 BOc1 BOc1 BOc1 BOc1 BOc1 HOc1 BOc1 BOc1 LHc1 LHc1 LHc1 LHc1 LHc1 BOc1 BOc1 BOc1 BOc1 LCc1 BOc1 LCc1 BOc1 LCc1 BOc1 LCc1 HOc1 LCc1 LCc1 LCc1 HOc1 LHc1 LHc1 LHc1 LHc1 BOc1 BOc1 BOc1 BOc1 BOc1 BOc1 BOc1 LCc1 BOc1 LCc1 BOc1 LCc1 BOc1 LCc1 LCc1 LCc1 LCc1 LCc1 LCc1 BOc1 BOc1 BOc1 BOc1 BOc1 BOc1 BOc1 BOc1 BOc1 BOc1 HOc1 HGc1 HGc1 HGc1 HGc1 HOc1 HGc1 LCc1 HGc1 LCc1 HGc1 HGc1 BOc1 BOc1 BOc1 HGc1 BOc1 HGc1 BOc1 HGc1 BOc1 HGc1 BOc1 HGc1 BOc1 HGc1 BOc1 HGc1 BOc1 HGc1 BOc1 BOc1 HOc1 BOc1 BOc1 LHc1 LHc1 LHc1 HGc1 HGc1 HGc1 HGc1 HGc1 HGc1 HGc1 HOc1 BOc1 BOc1 BOc1 BOc1 BOc1 BOc1 BOc1 BOc1 HOc1 LHc1 LHc1 LHc1 LHc1 HGc1 LHc1 HGc1 HGc1 HGc1 HGc1 HGc1 LHc1 LHc1 LHc1 LHc1 LHc1 BOc1 LHc1 BOc1 BOc1 BOc1 BOc1 BOc1 BOc1 BOc1 BOc1 HOc1 BOc1 BOc1 BOc1 BOc1 BOc1 BOc1 BOc1 BOc1 HOc1 BOc1 BOc1 BOc1 BOc1 BOc1 BOc1 BOc1 BOc1 HOc1 LHc1 LHc1 BOc1 BOc1 BOc1 BOc1 BOc1 BOc1 BOc1 BOc1 BOc1 HOc1 BOc1 BOc1 BOc1 BOc1 BOc1 BOc1 BOc1 BOc1 BOc1 BOc1 BOc1 BOc1 BOc1 LHc1 LHc1 BOc1 BOc1 BOc1 BOc1 BOc1 BOc1 BOc1 BOc1 BOc1 BOc1 BOc1 BOc1 BOc1 BOc1 BOc1 BOc1 BOc1 BOc1 BOc1 BOc1 BOc1 BOc1 BOc1 BOc1 BOc1 BOc1 BOc1 BOc1 BOc1 BOc1 BOc1 BOc1 BOc1 LHc1 BOc1 LHc1 BOc1 BOc1 BOc1 BOc1 BOc1 BOc1 BOc1 BOc1 LHc1 BOc1 BOc1 BOc1 BOc1 BOc1 BOc1 BOc1 BOc1 BOc1 LHc1 LHc1 BOc1 BOc1 BOc1 BOc1 BOc1 BOc1 BOc1 BOc1 LHc1 BOc1 BOc1 BOc1 BOc1 BOc1 BOc1 BOc1 BOc1 BOc1 BOc1 BOc1 BOc1 BOc1 BOc1 BOc1 BOc1 BOc1 BOc1 BOc1 BOc1 BOc1 BOc1 BOc1 BOc1 HGc1 BOc1 HGc1 BOc1 HGc1 BOc1 HGc1 BOc1 HGc1 BOc1 HGc1 HGc1 HGc1 HGc1 HOc1 HGc1 HGc1 HGc1 HGc1 HGc1 HGc1 HGc1 HGc1 HGc1 HGc1 HOc1 LHc1 LHc1 BOc1 BOc1 BOc1 BOc1 BOc1 HOc1 BOc1 LCc1 BOc1 BOc1 BOc1 BOc1 BOc1 BOc1 BOc1 HOc1 LHc1 LHc1 LHc1 LHc1 LHc1 LHc1 LHc1 LHc1 HOc1 BOc1 BOc1 BOc1 BOc1 BOc1 BOc1 LHc1 LHc1 LHc1 LHc1 LHc1 LHc1 LHc1 LHc1 LHc1 LHc1 LHc1 LHc1 LHc1 HOc1 LHc1 LHc1 LHc1 LHc1 LCc1 LHc1 LCc1 LHc1 LCc1 LHc1 LHc1 LHc1 LHc1 LHc1 LHc1 LHc1 LHc1 BOc1 LHc1 BOc1 BOc1 BOc1 BOc1 BOc1 LHc1 LHc1 LHc1 LHc1 LHc1 LHc1 LHc1 LHc1 LCc1 LCc1 LHc1 LCc1 LHc1 LCc1 LHc1 LCc1 LHc1 LHc1 LHc1 LHc1 LHc1 LHc1 LHc1 LHc1 LHc1 BOc1 BOc1 BOc1 BOc1 LHc1 LHc1 LHc1 LHc1 LHc1 BOc1 LHc1 BOc1 LHc1 BOc1 BOc1 BOc1 BOc1 BOc1 BOc1 BOc1 BOc1 BOc1 BOc1 BOc1 LHc1 LHc1 LHc1 LHc1 LHc1 LHc1 BOc1 LHc1 BOc1 LHc1 BOc1 BOc1 BOc1 BOc1 BOc1 BOc1 BOc1 BOc1 BOc1 BOc1 BOc1 BOc1 BOc1 BOc1 BOc1 BOc1 BOc1 LHc1 LHc1 LHc1 LHc1 LHc1 BOc1 BOc1 BOc1 BOc1 BOc1 BOc1 BOc1 LHc1 LHc1 LHc1 LHc1 LHc1 LHc1 LHc1 LHc1 LHc1 LHc1 LHc1 LHc1 LHc1 LHc1 LHc1 LHc1 LHc1 LHc1 LHc1 LHc1 LHc1 LHc1 LHc1 LHc1 LHc1 LHc1 LHc1 BOc1 BOc1 BOc1 BOc1 LHc1 LHc1 BOc1 LHc1 BOc1 BOc1 BOc1 BOc1 BOc1 BOc1 LHc1 LHc1 LHc1 BOc1 LHc1 BOc1 LHc1 BOc1 LHc1 BOc1 BOc1 BOc1 BOc1 BOc1 BOc1 BOc1 BOc1 BOc1 BOc1 BOc1 BOc1 BOc1 BOc1 BOc1 LHc1 BOc1 LHc1 BOc1 LHc1 BOc1 LHc1 BOc1 BOc1 BOc1 LHc1 LHc1 BOc1 BOc1 BOc1 BOc1 BOc1 BOc1 BOc1 BOc1 LHc1 LHc1 LHc1 LHc1 LHc1 LHc1 LHc1 LHc1 BOc1 BOc1 BOc1 BOc1 BOc1 BOc1 LHc1 LHc1 LHc1 LHc1 LHc1 LHc1 LHc1 BOc1 BOc1 BOc1 BOc1 BOc1 BOc1 BOc1 BOc1 BOc1 BOc1 BOc1 BOc1 BOc1 BOc1 BOc1 BOc1 BOc1 BOc1 BOc1 BOc1 BOc1 BOc1 BOc1 BOc1 BOc1 BOc1 BOc1 BOc1 BOc1 BOc1 BOc1 BOc1 BOc1 BOc1 BOc1 BOc1 BOc1 BOc1 BOc1 BOc1 BOc1 BOc1 BOc1 BOc1 BOc1 BOc1 BOc1 FCc1 BOc1 BOc1 BOc1 BOc1 BOc1 BOc1 BOc1 BOc1 BOc1 BOc1 BOc1 BOc1 BOc1 BOc1 BOc1 BOc1 BOc1 BOc1 BOc1 BOc1 BOc1 BOc1 BOc1 BOc1 BOc1 BOc1 BOc1 BOc1 BOc1 BOc1 BOc1 BOc1 BOc1 BOc1 BOc1 BOc1 BOc1 LHc1 BOc1 BOc1 BOc1 BOc1 BOc1 BOc1 BOc1 BOc1 BOc1 BOc1 BOc1 BOc1 BOc1 BOc1 BOc1 BOc1 BOc1 BOc1 BOc1 BOc1 BOc1 BOc1 BOc1 BOc1 BOc1 BOc1 BOc1 BOc1 BOc1 BOc1 BOc1 BOc1 BOc1 BOc1 BOc1 BOc1 BOc1 BOc1 BOc1 BOc1 BOc1 BOc1 BOc1 BOc1 BOc1 BOc1 BOc1 BOc1 BOc1 BOc1 BOc1 BOc1 BOc1 BOc1 BOc1 BOc1 BOc1 BOc1 BOc1 BOc1 BOc1 BOc1 BOc1 BOc1 BOc1 BOc1 BOc1 BOc1 BOc1 BOc1 BOc1 BOc1 BOc1 BOc1 BOc1 BOc1 BOc1 BOc1 BOc1 BOc1 BOc1 BOc1 BOc1 BOc1 BOc1 BOc1 BOc1 BOc1 BOc1 BOc1 BOc1 BOc1 BOc1 BOc1 BOc1 BOc1 BOc1 BOc1 BOc1 BOc1 BOc1 BOc1 BOc1 BOc1 BOc1 BOc1 BOc1 BOc1 BOc1 BOc1 BOc1 BOc1 BOc1 BOc1 BOc1 BOc1 BOc1 BOc1 BOc1 BOc1 BOc1 BOc1 BOc1 BOc1 BOc1 BOc1 BOc1 BOc1 BOc1 BOc1 BOc1 BOc1 BOc1 BOc1 BOc1 BOc1 BOc1 BOc1 BOc1 LHc1 LHc1 LHc1 LHc1 BOc1 LHc1 BOc1 LHc1 BOc1 LHc1 BOc1 LHc1 BOc1 LHc1 BOc1 LHc1 BOc1 BOc1 BOc1 BOc1 BOc1 BOc1 BOc1 BOc1 BOc1 BOc1 BOc1 BOc1 BOc1 BOc1 BOc1 BOc1 BOc1 BOc1 BOc1 BOc1 BOc1 BOc1 BOc1 BOc1 BOc1 BOc1 BOc1 BOc1 BOc1 BOc1
