,Bucket,Sentence
62,02::03::FX::USA,BPc1 BPc1 BPc1 BPc1 BPc1 BPc1 BPc1 BPc1 BPc1 BPc1 BPc1 BPc1 BPc1 BPc1 BPc1 BPc1 BPc1 BPc1 BPc1 BPc1 BPc1 BPc1 BPc1 BPc1 BPc1 BPc1 BPc1 BPc1 BPc1 BPc1 BPc1 BPc1 BPc1 BPc1 BPc1 BPc1 BPc1 BPc1 BPc1 BPc1 BPc1 BPc1 BPc1 BPc1 BPc1 BPc1 BPc1 BPc1 BPc1 BPc1 BPc1 BPc1 BPc1 BPc1 BPc1 BPc1 BPc1 BPc1 BPc1 BPc1 BPc1 BPc1 BPc1 BPc1 BPc1 BPc1 BPc1 BPc1 BPc1 BPc1 BPc1 BPc1 BPc1 BPc1 BPc1 BPc1 BPc1 BPc1 BPc1 BPc1 BPc1 BPc1 BPc1 BPc1 BPc1 BPc1 BPc1 BPc1 BPc1 BPc1 BPc1 BPc1 BPc1 BPc1 BPc1 BPc1 BPc1 BPc1 BPc1 BPc1 BPc1 BPc1 BPc1 BPc1 BPc1 BPc1 BPc1 BPc1 BPc1 BPc1 BPc1 BPc1 BPc1 BPc1 BPc1 BPc1 BPc1 BPc1 BPc1 BPc1 BPc1 BPc1 BPc1 BPc1 BPc1 BPc1 BPc1 BPc1 BPc1 BPc1 BPc1 BPc1 BPc1 BPc1 BPc1 BPc1 BPc1 BPc1 BPc1 BPc1 BPc1 BPc1 BPc1 BPc1 BPc1 BPc1 BPc1 BPc1 BPc1 BPc1 BPc1 BPc1 BPc1 BPc1 BPc1 BPc1 BPc1 BPc1 BPc1 BPc1 BPc1 BPc1 BPc1 BPc1 BPc1 BPc1 BPc1 BPc1 BPc1 BPc1 BPc1 BPc1 BPc1 BPc1 BPc1 BPc1 BPc1 BPc1 BPc1 BPc1 BPc1 BPc1 BPc1 BPc1 BPc1 BPc1 BPc1 BPc1 BPc1 BPc1 BPc1 BPc1 BPc1 BPc1 BPc1 BPc1 BPc1 BPc1 BPc1 BPc1 BPc1 BPc1 BPc1 BPc1 BPc1 BPc1 BPc1 BPc1 BPc1 BPc1 BPc1 BPc1 BPc1 BPc1 BPc1 BPc1 BPc1 BPc1 BPc1 BPc1 BPc1 BPc1 BPc1 BPc1 BPc1 UROc1 UROc1 UROc1 UROc1 UROc1 BPc1 UROc1 BPc1 UROc1 BPc1 UROc1 BPc1 UROc1 BPc1 UROc1 BPc1 UROc1 BPc1 UROc1 BPc1 UROc1 BPc1 UROc1 UROc1 UROc1 UROc1 UROc1 UROc1 UROc1 UROc1 UROc1 UROc1 UROc1 UROc1 UROc1 UROc1 UROc1 UROc1 UROc1 UROc1 UROc1 UROc1 UROc1 UROc1 UROc1 UROc1 UROc1 UROc1 UROc1 UROc1 UROc1 UROc1 UROc1 UROc1 UROc1 UROc1 UROc1 UROc1 BPc1 BPc1 BPc1 BPc1 BPc1 BPc1 BPc1 BPc1 BPc1 BPc1 BPc1 BPc1 BPc1 BPc1 BPc1 BPc1 BPc1 BPc1 BPc1 BPc1 BPc1 BPc1 BPc1 UROc1 UROc1 UROc1 UROc1 BPc1 BPc1 BPc1 BPc1 BPc1 BPc1 BPc1 BPc1 BPc1 BPc1 BPc1 BPc1 BPc1 BPc1 BPc1 BPc1 BPc1 BPc1 BPc1 BPc1 BPc1 BPc1 BPc1 BPc1 BPc1 BPc1 BPc1 BPc1 BPc1 BPc1 BPc1 BPc1 BPc1 BPc1 BPc1 BPc1 BPc1 BPc1 BPc1 BPc1 BPc1 BPc1 BPc1 BPc1 BPc1 BPc1 BPc1 BPc1 BPc1 BPc1 BPc1 BPc1 BPc1 BPc1 BPc1 BPc1 BPc1 BPc1 BPc1 BPc1 BPc1 BPc1 BPc1 BPc1 BPc1 BPc1 BPc1 BPc1 BPc1 BPc1 BPc1 BPc1 BPc1 BPc1 BPc1 BPc1 BPc1 BPc1 BPc1 BPc1 BPc1 BPc1 BPc1 BPc1 BPc1 BPc1 BPc1 BPc1 BPc1 BPc1 BPc1 BPc1 BPc1 BPc1 BPc1 BPc1 BPc1 BPc1 BPc1 BPc1 BPc1 BPc1 BPc1 BPc1 BPc1 BPc1 BPc1 BPc1 BPc1 BPc1 BPc1 BPc1 BPc1 BPc1 BPc1 BPc1 BPc1 BPc1 BPc1 BPc1 BPc1 BPc1 BPc1 BPc1 BPc1 BPc1 BPc1 BPc1 BPc1 BPc1 BPc1 BPc1 BPc1 BPc1 BPc1 BPc1 BPc1 BPc1 BPc1 BPc1 BPc1 BPc1 BPc1 BPc1 BPc1 BPc1 BPc1 BPc1 BPc1 BPc1 BPc1 BPc1 BPc1 BPc1 BPc1 BPc1 BPc1 BPc1 BPc1 BPc1 BPc1 BPc1 BPc1 BPc1 BPc1 BPc1 BPc1 BPc1 BPc1 BPc1 BPc1 BPc1 BPc1 BPc1 BPc1 BPc1 BPc1 BPc1 BPc1 BPc1 BPc1 BPc1 BPc1 BPc1 BPc1 BPc1 BPc1 BPc1 BPc1 BPc1 BPc1 BPc1 BPc1 BPc1 BPc1 BPc1 BPc1 BPc1 BPc1 BPc1 BPc1 BPc1 BPc1 BPc1 BPc1 BPc1 BPc1 BPc1 BPc1 BPc1 BPc1 BPc1 BPc1 BPc1 BPc1 BPc1 BPc1 BPc1 BPc1 BPc1 BPc1 BPc1 BPc1 BPc1 BPc1 BPc1 BPc1 BPc1 BPc1 BPc1 BPc1 BPc1 BPc1 BPc1 BPc1 BPc1 BPc1 BPc1 BPc1 BPc1 BPc1 BPc1 BPc1 BPc1 BPc1 BPc1 BPc1 BPc1 BPc1 BPc1 BPc1 BPc1 BPc1 BPc1 BPc1 BPc1 BPc1 BPc1 BPc1 BPc1 BPc1 BPc1 BPc1 BPc1 BPc1 BPc1 BPc1 BPc1 BPc1 BPc1 BPc1 BPc1 BPc1 BPc1 BPc1 BPc1 BPc1 BPc1 BPc1 BPc1 BPc1 BPc1 BPc1 BPc1 BPc1 BPc1 BPc1 BPc1 BPc1 BPc1 BPc1 BPc1 BPc1 BPc1 BPc1 BPc1 BPc1 BPc1 BPc1 BPc1 BPc1 BPc1 BPc1 BPc1 BPc1 BPc1 BPc1 BPc1 BPc1 BPc1 BPc1 BPc1 BPc1 BPc1 BPc1 BPc1 BPc1 BPc1 BPc1 BPc1 BPc1 BPc1 BPc1 BPc1 BPc1 BPc1 BPc1 BPc1 BPc1 BPc1 BPc1 BPc1 BPc1 BPc1 BPc1 BPc1 BPc1 BPc1 BPc1 BPc1 BPc1 BPc1 BPc1 BPc1 BPc1 BPc1 BPc1 BPc1 BPc1 BPc1 BPc1 BPc1 BPc1 BPc1 BPc1 BPc1 BPc1 BPc1 BPc1 BPc1 BPc1 BPc1 BPc1 BPc1 BPc1 BPc1 BPc1 BPc1 BPc1 BPc1 BPc1 BPc1 BPc1 BPc1 BPc1 BPc1 BPc1 BPc1 BPc1 BPc1 BPc1 BPc1 BPc1 BPc1 BPc1 BPc1 BPc1 BPc1 BPc1 BPc1 BPc1 BPc1 BPc1 BPc1 BPc1 BPc1 BPc1 BPc1 BPc1 BPc1 BPc1 BPc1 BPc1 BPc1 BPc1 BPc1 BPc1 BPc1 BPc1 BPc1 BPc1 BPc1 BPc1 BPc1 BPc1 BPc1 BPc1 BPc1 BPc1 BPc1 BPc1 BPc1 BPc1 BPc1 BPc1 BPc1 BPc1 BPc1 BPc1 BPc1 BPc1 BPc1 BPc1 BPc1 BPc1 BPc1 BPc1 BPc1 BPc1 BPc1 BPc1 BPc1 BPc1 BPc1 BPc1 BPc1 BPc1 BPc1 BPc1 BPc1 BPc1 BPc1 BPc1 BPc1 BPc1 BPc1 BPc1 BPc1 BPc1 BPc1 BPc1 BPc1 BPc1 BPc1 BPc1 UROc1 BPc1 UROc1 BPc1 BPc1 BPc1 BPc1 BPc1 BPc1 BPc1 BPc1 BPc1 BPc1 BPc1 BPc1 BPc1 BPc1 BPc1 BPc1 BPc1 BPc1 BPc1 BPc1 BPc1 BPc1 BPc1 BPc1 BPc1 BPc1 BPc1 UROc1 UROc1 BPc1 BPc1 BPc1 BPc1 BPc1 BPc1 BPc1 BPc1 BPc1 BPc1 BPc1 BPc1 UROc1 UROc1 BPc1 BPc1 BPc1 BPc1 UROc1 BPc1 BPc1 BPc1 BPc1 UROc1 UROc1 BPc1 BPc1 BPc1 BPc1 BPc1 BPc1 BPc1 BPc1 BPc1 BPc1 BPc1 BPc1 BPc1 BPc1 BPc1 BPc1 BPc1 CDc1 BPc1 BPc1 BPc1 UROc1 UROc1 BPc1 BPc1
63,02::03::Fixed Income::Japan,JGBc1 JMBc1 JMBc1 JMBc1 JMBc1 JMBc1 JMBc1 JMBc1 JMBc1 JMBc1 JMBc1 JMBc1 JMBc1 JMBc1 JMBc1 JMBc1 JMBc1 JMBc1 JMBc1 JMBc1 JMBc1 JMBc1 JMBc1 JMBc1 JMBc1 JMBc1 JMBc1 JMBc1 JMBc1 JMBc1 JMBc1 JMBc1 JMBc1 JMBc1 JMBc1 JMBc1 JMBc1 JGBc1 JGBc1 JGBc1 JGBc1 JGBc1 JGBc1 JGBc1 JGBc1 JGBc1 JGBc1 JGBc1 JGBc1 JGBc1 JGBc1 JGBc1 JGBc1 JGBc1 JGBc1 JGBc1 JGBc1 JGBc1 JGBc1 JGBc1 JGBc1 JGBc1 JGBc1 JGBc1 JGBc1 JGBc1 JGBc1 JGBc1 JGBc1 JGBc1 JGBc1 JGBc1 JGBc1 JGBc1 JGBc1 JGBc1 JGBc1 JGBc1 JGBc1 JGBc1 JGBc1 JGBc1 JGBc1 JGBc1 JGBc1 JGBc1 JGBc1 JGBc1 JGBc1 JGBc1 JGBc1 JGBc1 JGBc1 JGBc1 JGBc1 JGBc1 JGBc1 JGBc1 JGBc1 JGBc1 JGBc1 JGBc1 JGBc1 JGBc1 JGBc1 JGBc1 JGBc1 JGBc1 JGBc1 JGBc1 JGBc1 JGBc1 JGBc1 JGBc1 JGBc1 JGBc1 JGBc1 JGBc1 JGBc1 JGBc1 JGBc1 JGBc1
64,02::04::Commodities::USA,NGc1 NGc1 NGc1 NGc1 NGc1 NGc1 NGc1 NGc1 NGc1 NGc1 NGc1 NGc1 NGc1 NGc1 NGc1 NGc1 NGc1 NGc1 NGc1 NGc1 NGc1 NGc1 NGc1 NGc1 NGc1 NGc1 NGc1 NGc1 NGc1 NGc1 NGc1 NGc1 NGc1 NGc1 NGc1 NGc1 NGc1 NGc1 NGc1 NGc1 NGc1 NGc1 NGc1 NGc1 NGc1 NGc1 NGc1 NGc1 NGc1 NGc1 NGc1 NGc1 NGc1 NGc1 NGc1 NGc1 NGc1 NGc1 NGc1 NGc1 NGc1 NGc1 NGc1 NGc1 NGc1 NGc1 NGc1 NGc1 NGc1 NGc1 NGc1 NGc1 NGc1 NGc1 NGc1 NGc1 NGc1 NGc1 NGc1 NGc1 NGc1 Cc1 Cc1 Cc1 HOc1 HOc1 HOc1 HOc1 HOc1 HOc1 HOc1 HOc1 HOc1 HOc1 HOc1 HOc1 HOc1 HOc1 HOc1 HOc1 Cc1 NGc1 NGc1 HOc1 HOc1 HOc1 HOc1 HOc1 HOc1 HOc1 HOc1 HOc1 HOc1 HOc1 HOc1 HOc1 HOc1 HOc1 HOc1 HOc1 HOc1 HOc1 HOc1 HOc1 HOc1 HOc1 HOc1 HOc1 HOc1 HOc1 HOc1 HOc1 HOc1 HOc1 HOc1 HOc1 HOc1 HOc1 HOc1 HOc1 HOc1 HOc1 HOc1 HOc1 HOc1 HOc1 HOc1 HOc1 HOc1 HOc1 HOc1 HOc1 HOc1 HOc1 HOc1 HOc1 HOc1 HOc1 HOc1 HOc1 HOc1 HOc1 HOc1 HOc1 HOc1 HOc1 HOc1 HOc1 HOc1 HOc1 HOc1 HOc1 HOc1 HOc1 HOc1 HOc1 HOc1 HOc1 HOc1 HOc1 HOc1 HOc1 HOc1 HOc1 HOc1 HOc1 HOc1 HOc1 HOc1 HOc1 HOc1 HOc1 HOc1 HOc1 HOc1 HOc1 HOc1 HOc1 HOc1 HOc1 HOc1 HOc1 HOc1 HOc1 HOc1 HOc1 HOc1 HOc1 HOc1 HOc1 HOc1 HOc1 HOc1 HOc1 HOc1 HOc1 HOc1 HOc1 HOc1 HOc1 HOc1 HOc1 HOc1 HOc1 HOc1 HOc1 HOc1 HOc1 HOc1 HOc1 HOc1 HOc1 HOc1 HOc1 HOc1 HOc1 HOc1 HOc1 HOc1 HOc1 HOc1 HOc1 HOc1 HOc1 HOc1 HOc1 HOc1 HOc1 HOc1 HOc1 HOc1 HOc1 HOc1 HOc1 HOc1 HOc1 HOc1 HOc1 HOc1 HOc1 HOc1 HOc1 HOc1 HOc1 RBc1 RBc1 RBc1 RBc1 RBc1 HOc1 HOc1 HOc1 HOc1 HOc1 RBc1 RBc1 RBc1 RBc1 RBc1 RBc1 HOc1 HOc1 HOc1 HOc1 RBc1 RBc1 RBc1 RBc1 RBc1 RBc1 RBc1 RBc1 RBc1 HOc1 HOc1 HOc1 HOc1 HOc1 HOc1 RBc1 RBc1 RBc1 RBc1 RBc1 RBc1 RBc1 RBc1 RBc1 RBc1 RBc1 HOc1 HOc1 HOc1 HOc1 HOc1 RBc1 RBc1 RBc1 RBc1 RBc1 RBc1 HOc1 HOc1 HOc1 HOc1 HOc1 HOc1 HOc1 HOc1 HOc1 HOc1 HOc1 HOc1 HOc1 HOc1 HOc1 HOc1 HOc1 HOc1 HOc1 HOc1 HOc1 HOc1 HOc1 HOc1 RBc1 RBc1 RBc1 RBc1 RBc1 LCc1 LCc1 LCc1 LCc1 LCc1 LCc1 LCc1 RBc1 RBc1 RBc1 RBc1 RBc1 RBc1 RBc1 RBc1 HOc1 HOc1 HOc1 RBc1 RBc1 HOc1 HOc1 HOc1 HOc1 RBc1 RBc1 HOc1 HOc1 RBc1 HOc1 RBc1 HOc1 RBc1 HOc1 RBc1 HOc1 RBc1 HOc1 RBc1 RBc1 RBc1 RBc1 HOc1 RBc1 HOc1 RBc1 HOc1 RBc1 HOc1 HOc1 HOc1 HOc1 HOc1 HOc1 RBc1 HOc1 RBc1 HOc1 RBc1 HOc1 RBc1 HOc1 HOc1 HOc1 HOc1 HOc1 RBc1 RBc1 RBc1 HOc1 RBc1 HOc1 RBc1 HOc1 RBc1 HOc1 RBc1 HOc1 RBc1 HOc1 RBc1 HOc1 RBc1 HOc1 RBc1 RBc1 HOc1 RBc1 HOc1 RBc1 HOc1 RBc1 HOc1 RBc1 HOc1 HOc1 HOc1 HOc1 HOc1 HOc1 HOc1 HOc1 HOc1 HOc1 HOc1 HOc1 HOc1 HOc1 HOc1 HOc1 RBc1 HOc1 RBc1 HOc1 RBc1 HOc1 RBc1 HOc1 RBc1 HOc1 HOc1 HOc1 HOc1 HOc1 HOc1 HOc1 HOc1 HOc1 HOc1 HOc1 HOc1 HOc1 HOc1 RBc1 HOc1 RBc1 HOc1 RBc1 HOc1 RBc1 RBc1 HOc1 RBc1 HOc1 RBc1 HOc1 RBc1 HOc1 RBc1 HOc1 RBc1 HOc1 RBc1 RBc1 RBc1 RBc1 RBc1 RBc1 HOc1 RBc1 HOc1 RBc1 HOc1
65,02::04::FX::USA,BPc1 BPc1 BPc1 BPc1 BPc1 BPc1 BPc1 BPc1 BPc1 BPc1 BPc1 BPc1 BPc1 BPc1 BPc1 BPc1 BPc1 BPc1 BPc1 BPc1 BPc1 BPc1 BPc1 BPc1 BPc1 BPc1 BPc1 BPc1 BPc1 BPc1 BPc1 BPc1 BPc1 BPc1 BPc1 BPc1 BPc1 BPc1 BPc1 BPc1 BPc1 BPc1 BPc1 BPc1 BPc1 BPc1 BPc1 BPc1 BPc1 BPc1 BPc1 BPc1 BPc1 BPc1 BPc1 BPc1 BPc1 BPc1 BPc1 BPc1 BPc1 BPc1 BPc1 BPc1 BPc1 BPc1 BPc1 BPc1 BPc1 BPc1 BPc1 BPc1 BPc1 BPc1 BPc1 BPc1 BPc1 BPc1 BPc1 BPc1 BPc1 BPc1 BPc1 BPc1 BPc1 BPc1 BPc1 BPc1 BPc1 BPc1 BPc1 BPc1 BPc1 BPc1 BPc1 BPc1 BPc1 BPc1 BPc1 BPc1 BPc1 BPc1 BPc1 BPc1 BPc1 BPc1 BPc1 BPc1 BPc1 BPc1 BPc1 BPc1 BPc1 BPc1 BPc1 BPc1 BPc1 BPc1 BPc1 BPc1 BPc1 BPc1 BPc1 BPc1 BPc1 BPc1 BPc1 BPc1 BPc1 BPc1 BPc1 BPc1 BPc1 BPc1 BPc1 BPc1 BPc1 BPc1 BPc1 BPc1 BPc1 BPc1 BPc1 BPc1 BPc1 BPc1 BPc1 BPc1 BPc1 BPc1 BPc1 BPc1 BPc1 BPc1 BPc1 BPc1 BPc1 BPc1 BPc1 BPc1 BPc1 BPc1 BPc1 BPc1 BPc1 BPc1 BPc1 BPc1 BPc1 BPc1 BPc1 BPc1 BPc1 BPc1 BPc1 BPc1 BPc1 BPc1 BPc1 BPc1 BPc1 BPc1 BPc1 BPc1 BPc1 BPc1 BPc1 BPc1 BPc1 BPc1 BPc1 BPc1 BPc1 BPc1 BPc1 BPc1 BPc1 BPc1 BPc1 BPc1 BPc1 BPc1 BPc1 BPc1 BPc1 BPc1 BPc1 BPc1 BPc1 BPc1 BPc1 BPc1 BPc1 BPc1 BPc1 BPc1 BPc1 BPc1 BPc1 BPc1 BPc1 BPc1 BPc1 BPc1 BPc1 BPc1 BPc1 BPc1 BPc1 BPc1 BPc1 BPc1 BPc1 BPc1 BPc1 BPc1 BPc1 BPc1 BPc1 BPc1 BPc1 BPc1 BPc1 BPc1 BPc1 BPc1 BPc1 BPc1 BPc1 BPc1 BPc1 BPc1 BPc1 BPc1 BPc1 BPc1 BPc1 BPc1 BPc1 BPc1 BPc1 BPc1 BPc1 BPc1 BPc1 BPc1 BPc1 BPc1 BPc1 BPc1 BPc1 BPc1 BPc1 BPc1 BPc1 BPc1 BPc1 BPc1 BPc1 BPc1 BPc1 BPc1 BPc1 BPc1 BPc1 BPc1 BPc1 BPc1 BPc1 BPc1 BPc1 BPc1 BPc1 BPc1 BPc1 BPc1 BPc1 BPc1 BPc1 BPc1 BPc1 BPc1 BPc1 BPc1 BPc1 BPc1 BPc1 BPc1 BPc1 BPc1 BPc1 BPc1 BPc1 BPc1 BPc1 BPc1 BPc1 BPc1 BPc1 BPc1 BPc1 BPc1 BPc1 BPc1 BPc1 BPc1 BPc1 BPc1 BPc1 BPc1 BPc1 BPc1 BPc1 BPc1 BPc1 BPc1 BPc1 BPc1 BPc1 BPc1 BPc1 BPc1 BPc1 BPc1 BPc1 BPc1 BPc1 BPc1 BPc1 BPc1 BPc1 BPc1 BPc1 BPc1 BPc1 BPc1 BPc1 BPc1 BPc1 BPc1 BPc1 BPc1 BPc1 BPc1 BPc1 BPc1 BPc1 BPc1 BPc1 BPc1 BPc1 BPc1 BPc1 BPc1 BPc1 BPc1 BPc1 BPc1 BPc1 BPc1 BPc1 BPc1 BPc1 BPc1 BPc1 BPc1 BPc1 BPc1 BPc1 BPc1 BPc1 BPc1 BPc1 BPc1 BPc1 BPc1 BPc1 BPc1 BPc1 BPc1 BPc1 BPc1 BPc1 BPc1 BPc1 BPc1 BPc1 BPc1 BPc1 BPc1 BPc1 BPc1 BPc1 BPc1 BPc1 BPc1 BPc1 BPc1 BPc1 BPc1 BPc1 BPc1 BPc1 BPc1 BPc1 BPc1 BPc1 BPc1 BPc1 BPc1 BPc1 BPc1 BPc1 BPc1 BPc1 BPc1 BPc1 BPc1 BPc1 BPc1 BPc1 BPc1 BPc1 BPc1 BPc1 BPc1 BPc1 BPc1 BPc1 BPc1 BPc1 BPc1 BPc1 BPc1 BPc1 BPc1 BPc1 BPc1 BPc1 BPc1 BPc1 BPc1 BPc1 BPc1 BPc1 BPc1 BPc1 BPc1 BPc1 BPc1 BPc1 BPc1 BPc1 BPc1 BPc1 BPc1 BPc1 BPc1 BPc1 BPc1 BPc1 BPc1 BPc1 BPc1 BPc1 BPc1 BPc1 BPc1 BPc1 BPc1 BPc1 BPc1 BPc1 BPc1 BPc1 BPc1 BPc1 BPc1 BPc1 BPc1 BPc1 BPc1 BPc1 BPc1 BPc1 BPc1 BPc1 BPc1 BPc1 BPc1 BPc1 BPc1 BPc1 BPc1 BPc1 BPc1 BPc1 BPc1 BPc1 BPc1 BPc1 BPc1 BPc1 BPc1 BPc1 BPc1 BPc1 BPc1 BPc1 BPc1 BPc1 BPc1 BPc1 BPc1 BPc1 BPc1 BPc1 BPc1 BPc1 BPc1 BPc1 BPc1 BPc1 BPc1 BPc1 BPc1 BPc1 BPc1 BPc1 BPc1 BPc1 BPc1 BPc1 BPc1 BPc1 BPc1 BPc1 BPc1 BPc1 BPc1 BPc1 BPc1 BPc1 BPc1 BPc1 BPc1 BPc1 BPc1 BPc1 BPc1 BPc1 BPc1 BPc1 BPc1 BPc1 BPc1 BPc1 BPc1 BPc1 BPc1 BPc1 BPc1 BPc1 BPc1 BPc1 BPc1 BPc1 BPc1 BPc1 BPc1 BPc1 BPc1 BPc1 BPc1 BPc1 BPc1 BPc1 BPc1 BPc1 BPc1 BPc1 BPc1 BPc1 BPc1 BPc1 BPc1 BPc1 BPc1 BPc1 BPc1 BPc1 BPc1 BPc1 BPc1 BPc1 BPc1 BPc1 BPc1 BPc1 BPc1 BPc1 UROc1 BPc1 UROc1 BPc1 BPc1 UROc1 BPc1 BPc1 BPc1 BPc1 UROc1 BPc1 UROc1 BPc1 UROc1 BPc1 BPc1 BPc1 BPc1 BPc1 BPc1 BPc1 BPc1 BPc1 BPc1 BPc1 BPc1 UROc1 BPc1 UROc1 BPc1 UROc1 BPc1 UROc1 BPc1 UROc1 BPc1 UROc1 BPc1 UROc1 BPc1 UROc1 BPc1 BPc1 BPc1 UROc1 BPc1 UROc1 UROc1 UROc1 UROc1 UROc1 UROc1 UROc1 UROc1 UROc1 UROc1 UROc1 UROc1 UROc1 UROc1 UROc1 UROc1 UROc1 UROc1 UROc1 UROc1 UROc1 UROc1 UROc1 UROc1 BPc1 UROc1 BPc1 UROc1 BPc1 BPc1 BPc1 BPc1 BPc1 UROc1 BPc1 UROc1 BPc1 UROc1 BPc1 BPc1 BPc1 BPc1 BPc1 BPc1 BPc1 BPc1 BPc1 BPc1 BPc1 BPc1 BPc1 BPc1 BPc1 BPc1 BPc1 UROc1 BPc1 BPc1 BPc1 BPc1 BPc1 BPc1 BPc1 BPc1 BPc1 BPc1 BPc1 BPc1 BPc1 BPc1 BPc1 BPc1 BPc1 BPc1 BPc1 BPc1 BPc1 BPc1 BPc1 BPc1 BPc1 BPc1 BPc1 BPc1 BPc1 BPc1 BPc1 BPc1 BPc1 BPc1 BPc1 BPc1 BPc1 BPc1 BPc1 BPc1 BPc1 BPc1 BPc1 BPc1 BPc1 BPc1 BPc1 BPc1 BPc1 BPc1 BPc1 BPc1 BPc1 BPc1 BPc1 BPc1 BPc1 BPc1 BPc1 BPc1 BPc1 BPc1 BPc1 BPc1 BPc1 BPc1 BPc1 BPc1 BPc1 BPc1 BPc1 BPc1 BPc1 BPc1 BPc1 BPc1 BPc1 BPc1 BPc1 BPc1 BPc1 BPc1 BPc1 BPc1 BPc1 BPc1 BPc1 BPc1 BPc1 BPc1 BPc1 BPc1 BPc1 BPc1 BPc1 BPc1 BPc1 BPc1 BPc1 BPc1 BPc1 BPc1 BPc1 BPc1 BPc1 BPc1 BPc1 BPc1 BPc1 BPc1 BPc1 BPc1 BPc1 BPc1 BPc1 BPc1 BPc1 BPc1 BPc1 BPc1 BPc1 BPc1 BPc1 BPc1 BPc1 BPc1 BPc1 BPc1 BPc1 BPc1 BPc1 BPc1 BPc1 BPc1 BPc1 BPc1 BPc1 BPc1 BPc1 BPc1 BPc1 BPc1 BPc1 BPc1 BPc1 BPc1 BPc1 BPc1 BPc1 BPc1 BPc1 BPc1 BPc1 BPc1 BPc1 BPc1 BPc1 BPc1 BPc1 BPc1 BPc1 BPc1 BPc1 BPc1 BPc1 BPc1 BPc1 BPc1 BPc1 BPc1 BPc1 BPc1 BPc1 BPc1 BPc1 BPc1 BPc1 BPc1 BPc1 BPc1 BPc1 BPc1 BPc1 BPc1 BPc1 BPc1 BPc1 BPc1 BPc1 BPc1 BPc1 BPc1 BPc1 BPc1 BPc1 BPc1 BPc1 BPc1 BPc1 BPc1 BPc1 BPc1 BPc1 BPc1 BPc1 BPc1 BPc1 BPc1 BPc1 BPc1 BPc1 BPc1 BPc1 BPc1 BPc1 BPc1 BPc1 BPc1 BPc1 BPc1 BPc1 BPc1 BPc1 BPc1 BPc1 BPc1 BPc1 BPc1 BPc1 BPc1 BPc1 BPc1 BPc1 BPc1 BPc1 BPc1 BPc1 BPc1 BPc1 BPc1 BPc1 BPc1 BPc1 BPc1 BPc1 BPc1 BPc1 BPc1 BPc1 BPc1 BPc1 BPc1 BPc1 BPc1 BPc1 BPc1 BPc1 BPc1 BPc1 BPc1 BPc1 BPc1 BPc1 BPc1 BPc1 BPc1 BPc1 UROc1 BPc1 UROc1 BPc1 BPc1 BPc1 BPc1 BPc1 BPc1 BPc1 BPc1 BPc1 BPc1 BPc1 BPc1 BPc1 BPc1 BPc1 BPc1 BPc1 BPc1 BPc1 BPc1 BPc1 BPc1 UROc1 BPc1 UROc1 BPc1 UROc1 BPc1 UROc1 BPc1 BPc1 BPc1 BPc1 BPc1 BPc1 BPc1 BPc1 BPc1 BPc1 BPc1 UROc1 UROc1 BPc1 BPc1 BPc1 BPc1 BPc1 BPc1 BPc1 BPc1 BPc1 BPc1 BPc1 BPc1 BPc1 BPc1 BPc1 BPc1 BPc1 BPc1 BPc1 BPc1 BPc1 BPc1 BPc1 BPc1 BPc1 BPc1 BPc1 BPc1 BPc1 BPc1 BPc1 BPc1 BPc1 UROc1 UROc1 UROc1 BPc1 BPc1 BPc1 BPc1 BPc1 BPc1 BPc1 BPc1 BPc1 BPc1 BPc1 BPc1 BPc1 BPc1 BPc1 BPc1 BPc1 BPc1 BPc1 BPc1 BPc1 BPc1 BPc1 BPc1 BPc1 BPc1 BPc1 BPc1 BPc1 BPc1 BPc1 BPc1 BPc1 BPc1 BPc1 BPc1 BPc1 BPc1 BPc1 BPc1 BPc1 BPc1 BPc1 BPc1 BPc1 UROc1 BPc1 UROc1 BPc1 UROc1 BPc1 BPc1 BPc1 BPc1 BPc1 BPc1 BPc1 BPc1 BPc1 BPc1 BPc1 BPc1 BPc1 BPc1 BPc1 BPc1 BPc1 BPc1 BPc1 BPc1 BPc1 BPc1 UROc1 UROc1 UROc1 BPc1 BPc1 BPc1 BPc1 BPc1 BPc1 BPc1 BPc1 BPc1 BPc1 BPc1 BPc1 BPc1 BPc1 BPc1 BPc1 BPc1 BPc1 BPc1 BPc1 BPc1 BPc1 BPc1 BPc1 BPc1 BPc1 BPc1 BPc1 BPc1 BPc1 UROc1 BPc1 UROc1 BPc1 UROc1 BPc1 BPc1 BPc1 BPc1 BPc1 BPc1 BPc1 BPc1 BPc1 BPc1 BPc1 BPc1 BPc1 BPc1 BPc1 BPc1 BPc1 BPc1 BPc1 BPc1 BPc1 BPc1 BPc1 BPc1 BPc1 BPc1 BPc1 BPc1 BPc1 BPc1 BPc1 BPc1 BPc1 BPc1 BPc1 BPc1 BPc1 BPc1 BPc1 BPc1 BPc1 BPc1 BPc1 BPc1 BPc1 BPc1 BPc1 BPc1 BPc1 UROc1 UROc1 UROc1 BPc1 BPc1 BPc1 BPc1 BPc1 BPc1 BPc1 BPc1 BPc1 BPc1 BPc1 BPc1 BPc1 BPc1 BPc1 BPc1 BPc1 BPc1 BPc1 BPc1 UROc1 BPc1 BPc1 BPc1 BPc1 BPc1 BPc1 BPc1 BPc1 BPc1 BPc1 BPc1 BPc1 UROc1 UROc1 BPc1 BPc1 BPc1 BPc1 BPc1 BPc1 BPc1 BPc1 BPc1 BPc1 BPc1 BPc1 BPc1 UROc1 UROc1 BPc1 BPc1 BPc1 CDc1 CDc1 SFc1 SFc1 SFc1 SFc1 BPc1 BPc1 UROc1 BPc1 BPc1 BPc1 BPc1 BPc1 BPc1 UROc1 UROc1 BPc1 UROc1 BPc1 BPc1 BPc1 BPc1
66,02::04::Fixed Income::Japan,JGBc1 JGBc1 JGBc1 JGBc1 JGBc1 JGBc1 JGBc1 JGBc1 JGBc1 JGBc1 JGBc1 JGBc1 JGBc1 JGBc1 JGBc1 JGBc1 JGBc1 JGBc1 JGBc1 JGBc1 JGBc1 JGBc1 JGBc1 JGBc1 JGBc1 JGBc1 JGBc1 JGBc1 JGBc1 JGBc1 JGBc1 JGBc1 JGBc1 JGBc1 JGBc1 JGBc1 JGBc1 JGBc1 JGBc1 JGBc1 JGBc1 JGBc1 JGBc1 JGBc1 JGBc1 JGBc1 JGBc1 JGBc1 JGBc1 JGBc1 JGBc1 JGBc1 JGBc1 JGBc1 JGBc1 JGBc1 JGBc1 JGBc1 JGBc1 JGBc1 JGBc1 JGBc1 JGBc1 JGBc1 JGBc1 JGBc1 JGBc1 JGBc1 JGBc1 JGBc1 JGBc1 JGBc1 JGBc1 JGBc1 JGBc1 JGBc1 JGBc1 JGBc1 JGBc1 JGBc1 JGBc1 JGBc1 JGBc1 JGBc1 JGBc1 JGBc1 JGBc1 JGBc1 JGBc1 JGBc1 JGBc1 JGBc1 JGBc1 JGBc1 JGBc1 JGBc1 JGBc1 JGBc1 JGBc1 JGBc1 JGBc1 JGBc1 JGBc1 JGBc1 JGBc1 JGBc1 JGBc1 JGBc1 JGBc1 JGBc1 JGBc1 JGBc1 JGBc1 JGBc1 JGBc1 JGBc1 JGBc1 JGBc1 JGBc1 JGBc1 JGBc1 JGBc1 JGBc1 JGBc1 JGBc1 JGBc1 JGBc1 JGBc1 JGBc1 JGBc1 JGBc1 JGBc1 JGBc1 JGBc1 JGBc1 JGBc1 JGBc1 JGBc1 JGBc1 JGBc1 JGBc1 JGBc1 JGBc1 JGBc1 JGBc1 JGBc1 JGBc1 JGBc1 JGBc1 JGBc1 JGBc1 JGBc1 JGBc1 JGBc1 JGBc1 JGBc1 JGBc1 JGBc1 JGBc1 JGBc1 JGBc1 JGBc1 JGBc1 JGBc1 JGBc1 JGBc1 JGBc1 JGBc1 JGBc1 JGBc1 JGBc1 JGBc1 JGBc1 JGBc1 JGBc1 JGBc1 JGBc1 JGBc1 JGBc1 JGBc1 JGBc1 JGBc1 JGBc1 JGBc1 JGBc1 JGBc1 JGBc1 JGBc1 JGBc1 JGBc1 JGBc1 JGBc1 JGBc1 JGBc1 JGBc1 JGBc1 JGBc1 JGBc1 JGBc1 JGBc1 JGBc1 JGBc1 JGBc1 JGBc1 JGBc1 JGBc1 JGBc1 JGBc1 JGBc1 JGBc1 JGBc1 JGBc1 JGBc1 JGBc1 JGBc1 JGBc1 JGBc1 JGBc1 JGBc1 JGBc1 JGBc1 JGBc1 JGBc1 JGBc1 JGBc1 JGBc1 JGBc1 JGBc1 JGBc1 JGBc1 JGBc1 JGBc1 JGBc1 JGBc1 JGBc1 JGBc1 JGBc1 JGBc1 JGBc1 JGBc1 JGBc1 JGBc1 JGBc1 JGBc1 JGBc1 JGBc1 JGBc1 JGBc1 JGBc1 JGBc1 JGBc1 JGBc1 JGBc1 JGBc1 JGBc1 JGBc1 JGBc1 JGBc1 JGBc1 JGBc1 JGBc1 JGBc1 JGBc1 JGBc1 JGBc1 JGBc1 JGBc1 JGBc1 JGBc1 JGBc1 JGBc1 JGBc1 JGBc1 JGBc1 JGBc1 JGBc1 JGBc1 JGBc1 JGBc1 JGBc1 JGBc1 JGBc1 JGBc1 JGBc1 JGBc1 JGBc1 JGBc1 JGBc1 JGBc1 JGBc1 JGBc1 JGBc1 JGBc1 JGBc1 JGBc1 JGBc1 JGBc1 JGBc1 JGBc1 JGBc1 JGBc1 JGBc1 JGBc1 JGBc1 JGBc1 JGBc1 JGBc1 JGBc1 JGBc1 JGBc1 JGBc1 JGBc1 JGBc1 JGBc1 JGBc1 JGBc1 JGBc1 JGBc1 JGBc1 JGBc1 JGBc1 JGBc1 JGBc1 JGBc1 JGBc1 JGBc1 JGBc1 JGBc1 JGBc1 JGBc1 JGBc1 JGBc1 JGBc1 JGBc1 JGBc1 JGBc1 JGBc1 JGBc1 JGBc1 JGBc1 JGBc1 JGBc1 JGBc1 JGBc1 JGBc1 JGBc1 JGBc1 JGBc1 JGBc1 JGBc1 JGBc1 JGBc1 JGBc1 JGBc1 JGBc1 JGBc1 JGBc1 JGBc1 JGBc1 JGBc1 JGBc1 JGBc1 JGBc1 JGBc1 JGBc1 JGBc1 JGBc1 JGBc1 JGBc1 JGBc1 JGBc1 JGBc1 JGBc1 JGBc1 JGBc1 JGBc1 JGBc1 JGBc1 JGBc1 JGBc1 JGBc1 JGBc1 JGBc1 JGBc1 JGBc1 JGBc1 JGBc1 JGBc1 JGBc1 JGBc1 JGBc1 JGBc1 JGBc1 JGBc1 JGBc1 JGBc1 JGBc1 JGBc1 JGBc1 JGBc1 JGBc1 JGBc1 JGBc1 JGBc1 JGBc1 JGBc1 JGBc1 JGBc1 JGBc1 JGBc1 JGBc1 JGBc1 JGBc1 JGBc1 JGBc1 JGBc1 JGBc1 JGBc1 JGBc1 JGBc1 JGBc1 JGBc1 JGBc1 JGBc1 JGBc1 JGBc1 JGBc1 JGBc1 JGBc1 JGBc1 JGBc1 JGBc1 JGBc1 JGBc1 JGBc1 JGBc1 JGBc1 JGBc1 JGBc1 JGBc1 JGBc1 JGBc1 JGBc1 JGBc1 JGBc1 JGBc1 JGBc1 JGBc1 JGBc1 JGBc1 JGBc1 JGBc1 JGBc1 JGBc1 JGBc1 JGBc1 JGBc1 JGBc1 JGBc1 JGBc1 JGBc1 JGBc1 JGBc1 JGBc1 JGBc1 JGBc1 JGBc1 JGBc1 JGBc1 JGBc1 JGBc1 JGBc1 JGBc1 JGBc1 JGBc1 JGBc1 JGBc1 JGBc1 JGBc1 JGBc1 JGBc1 JGBc1 JGBc1 JGBc1 JGBc1 JGBc1 JGBc1 JGBc1 JGBc1 JGBc1 JGBc1 JGBc1 JGBc1 JGBc1 JGBc1 JGBc1 JGBc1 JGBc1 JGBc1 JGBc1 JGBc1 JGBc1 JGBc1 JGBc1 JGBc1 JGBc1 JGBc1 JGBc1 JGBc1 JGBc1 JGBc1 JGBc1 JGBc1 JGBc1 JGBc1 JGBc1 JGBc1 JGBc1 JGBc1 JGBc1 JGBc1 JGBc1 JGBc1 JGBc1 JGBc1 JGBc1 JGBc1 JGBc1 JGBc1 JGBc1 JGBc1 JGBc1 JGBc1 JGBc1 JGBc1 JGBc1 JGBc1 JGBc1 JGBc1 JGBc1 JGBc1 JGBc1 JGBc1 JGBc1 JGBc1 JGBc1 JGBc1 JGBc1 JGBc1 JGBc1 JGBc1 JGBc1 JGBc1 JGBc1 JGBc1 JGBc1 JGBc1 JGBc1 JGBc1 JGBc1 JGBc1 JGBc1 JGBc1 JGBc1 JGBc1 JGBc1 JGBc1 JGBc1 JGBc1 JGBc1 JGBc1 JGBc1 JGBc1 JGBc1 JGBc1 JGBc1 JGBc1 JGBc1 JGBc1 JGBc1 JGBc1 JGBc1 JGBc1 JGBc1 JGBc1 JGBc1 JGBc1 JGBc1 JGBc1 JGBc1 JGBc1 JGBc1 JGBc1 JGBc1 JGBc1 JGBc1 JGBc1 JGBc1 JGBc1 JGBc1 JGBc1 JGBc1 JGBc1 JGBc1 JGBc1 JGBc1 JGBc1 JGBc1 JGBc1 JGBc1 JGBc1 JGBc1 JGBc1 JGBc1 JGBc1 JGBc1 JGBc1 JGBc1 JGBc1 JGBc1 JGBc1 JGBc1 JGBc1 JGBc1 JGBc1 JGBc1 JGBc1 JGBc1 JGBc1 JGBc1 JGBc1 JGBc1 JGBc1 JGBc1 JGBc1 JGBc1 JGBc1 JGBc1 JGBc1 JGBc1 JGBc1 JGBc1 JGBc1 JGBc1 JGBc1 JGBc1 JGBc1 JGBc1 JGBc1 JGBc1 JGBc1 JGBc1 JGBc1 JGBc1 JGBc1 JGBc1 JGBc1 JGBc1 JGBc1 JGBc1 JGBc1 JGBc1 JGBc1 JGBc1 JGBc1 JGBc1 JGBc1 JGBc1 JGBc1 JGBc1 JGBc1 JGBc1 JGBc1 JGBc1 JGBc1 JGBc1 JGBc1 JGBc1 JGBc1 JGBc1 JGBc1 JGBc1 JGBc1 JGBc1 JGBc1 JGBc1 JGBc1 JGBc1 JGBc1 JGBc1 JGBc1 JGBc1 JGBc1 JGBc1 JGBc1 JGBc1 JGBc1 JGBc1 JGBc1 JGBc1 JGBc1 JGBc1 JGBc1 JGBc1 JGBc1 JGBc1 JGBc1 JGBc1 JGBc1 JGBc1 JGBc1 JGBc1 JGBc1 JGBc1 JGBc1 JGBc1 JGBc1 JGBc1 JGBc1 JGBc1 JGBc1 JGBc1 JGBc1 JGBc1 JGBc1 JGBc1 JGBc1 JGBc1 JGBc1 JGBc1 JGBc1 JGBc1 JGBc1 JGBc1 JGBc1 JGBc1 JGBc1 JGBc1 JGBc1 JGBc1 JGBc1 JGBc1 JGBc1 JGBc1 JGBc1 JGBc1 JGBc1 JGBc1 JGBc1 JGBc1 JGBc1 JGBc1 JGBc1 JGBc1 JGBc1 JGBc1 JGBc1 JGBc1 JGBc1 JGBc1 JGBc1 JGBc1 JGBc1 JGBc1 JGBc1 JGBc1 JGBc1 JGBc1 JGBc1 JGBc1 JGBc1 JGBc1 JGBc1 JGBc1 JGBc1 JGBc1 JGBc1 JGBc1 JGBc1 JGBc1 JGBc1 JGBc1 JGBc1 JGBc1 JGBc1 JGBc1 JGBc1 JGBc1 JGBc1 JGBc1 JGBc1 JGBc1 JGBc1 JGBc1 JGBc1 JGBc1 JGBc1 JGBc1 JGBc1 JGBc1 JGBc1 JGBc1 JGBc1 JGBc1 JGBc1 JGBc1 JGBc1 JGBc1 JGBc1 JGBc1 JGBc1 JGBc1
67,02::05::Commodities::USA,NGc1 NGc1 NGc1 NGc1 NGc1 NGc1 Cc1 Cc1 Cc1 Cc1 Cc1 Cc1 Cc1 Cc1 Cc1 Cc1 NGc1 NGc1 HOc1 HOc1 HOc1 HOc1 HOc1 HOc1 HOc1 HOc1 HOc1 HOc1 HOc1 HOc1 HOc1 HOc1 HOc1 HOc1 HOc1 HOc1 HOc1 HOc1 HOc1 HOc1 HOc1 HOc1 HOc1 HOc1 HOc1 HOc1 HOc1 HOc1 HOc1 HOc1 HOc1 HOc1 HOc1 HOc1 HOc1 HOc1 HOc1 HOc1 HOc1 HOc1 HOc1 HOc1 HOc1 HOc1 HOc1 HOc1 HOc1 HOc1 HOc1 HOc1 HOc1 HOc1 HOc1 HOc1 HOc1 HOc1 HOc1 HOc1 HOc1 HOc1 HOc1 HOc1 HOc1 HOc1 HOc1 HOc1 HOc1 HOc1 HOc1 HOc1 HOc1 HOc1 HOc1 HOc1 HOc1 HOc1 HOc1 HOc1 HOc1 HOc1 HOc1 HOc1 HOc1 HOc1 HOc1 HOc1 HOc1 HOc1 HOc1 HOc1 HOc1 HOc1 HOc1 HOc1 HOc1 HOc1 HOc1 HOc1 HOc1 HOc1 HOc1 HOc1 HOc1 HOc1 HOc1 HOc1 HOc1 HOc1 HOc1 HOc1 HOc1 HOc1 HOc1 HOc1 HOc1 HOc1 HOc1 HOc1 HOc1 HOc1 HOc1 HOc1 HOc1 HOc1 HOc1 HOc1 HOc1 HOc1 HOc1 RBc1 RBc1 HOc1 HOc1 HOc1 HOc1 HOc1 HOc1 HOc1 HOc1 HOc1 HOc1 HOc1 HOc1 HOc1 HOc1 HOc1 HOc1 HOc1 LCc1 LCc1 LCc1 LCc1 LCc1 LCc1 RBc1 RBc1 RBc1 RBc1 RBc1 RBc1 HOc1 RBc1 HOc1 HOc1 HOc1 RBc1 RBc1 RBc1 RBc1 HOc1 RBc1 HOc1 RBc1 HOc1 RBc1 RBc1 HOc1 RBc1 RBc1 RBc1 RBc1 RBc1 RBc1 RBc1 RBc1 HOc1 RBc1 HOc1 RBc1 HOc1 HOc1 RBc1 RBc1 RBc1 HOc1 RBc1 HOc1 RBc1 HOc1 RBc1 HOc1 HOc1 RBc1 RBc1 RBc1 RBc1 HOc1 RBc1 HOc1 RBc1 RBc1 RBc1 RBc1 RBc1 RBc1 RBc1 HOc1 HOc1 HOc1 HOc1 HOc1 HOc1 RBc1 HOc1 RBc1 HOc1 RBc1 HOc1 RBc1 RBc1 RBc1 RBc1 RBc1 RBc1 RBc1 RBc1 HOc1 RBc1 HOc1 RBc1 HOc1 RBc1 HOc1 HOc1 HOc1
68,02::05::FX::USA,BPc1 BPc1 BPc1 BPc1 BPc1 BPc1 BPc1 BPc1 BPc1 BPc1 BPc1 BPc1 BPc1 BPc1 BPc1 BPc1 BPc1 BPc1 BPc1 BPc1 BPc1 BPc1 BPc1 BPc1 BPc1 BPc1 BPc1 BPc1 BPc1 BPc1 BPc1 BPc1 BPc1 BPc1 BPc1 BPc1 BPc1 BPc1 BPc1 BPc1 BPc1 BPc1 BPc1 BPc1 BPc1 BPc1 BPc1 BPc1 BPc1 BPc1 BPc1 BPc1 BPc1 BPc1 BPc1 BPc1 BPc1 BPc1 BPc1 BPc1 BPc1 BPc1 BPc1 BPc1 BPc1 BPc1 BPc1 BPc1 BPc1 BPc1 BPc1 BPc1 BPc1 BPc1 BPc1 BPc1 BPc1 BPc1 BPc1 BPc1 BPc1 BPc1 BPc1 BPc1 BPc1 BPc1 BPc1 BPc1 BPc1 BPc1 BPc1 BPc1 BPc1 BPc1 BPc1 BPc1 BPc1 BPc1 BPc1 BPc1 BPc1 BPc1 BPc1 BPc1 UROc1 UROc1 UROc1 UROc1 UROc1 UROc1 UROc1 UROc1 UROc1 UROc1 UROc1 UROc1 UROc1 UROc1 UROc1 UROc1 UROc1 UROc1 UROc1 UROc1 UROc1 UROc1 UROc1 UROc1 UROc1 UROc1 UROc1 UROc1 UROc1 UROc1 UROc1 UROc1 UROc1 UROc1 UROc1 UROc1 UROc1 UROc1 UROc1 UROc1 UROc1 UROc1 UROc1 UROc1 UROc1 UROc1 UROc1 UROc1 UROc1 UROc1 UROc1 UROc1 UROc1 UROc1 UROc1 UROc1 UROc1 UROc1 BPc1 UROc1 BPc1 UROc1 BPc1 UROc1 BPc1 UROc1 BPc1 UROc1 BPc1 UROc1 BPc1 UROc1 BPc1 UROc1 BPc1 BPc1 UROc1 BPc1 UROc1 BPc1 UROc1 BPc1 UROc1 BPc1 UROc1 BPc1 UROc1 BPc1 UROc1 BPc1 UROc1 BPc1 UROc1 BPc1 UROc1 BPc1 UROc1 BPc1 UROc1 BPc1 UROc1 BPc1 UROc1 BPc1 BPc1 BPc1 BPc1 BPc1 BPc1 BPc1 BPc1 BPc1 BPc1 BPc1 BPc1 UROc1 BPc1 UROc1 BPc1 BPc1 BPc1 BPc1 BPc1 BPc1 BPc1 BPc1 UROc1 BPc1 UROc1 BPc1 UROc1 BPc1 UROc1 BPc1 UROc1 BPc1 UROc1 BPc1 UROc1 BPc1 BPc1 BPc1 UROc1 BPc1 BPc1 UROc1 BPc1 UROc1 BPc1 UROc1 BPc1 BPc1 UROc1 BPc1 BPc1 UROc1 BPc1 BPc1 UROc1 BPc1 BPc1 UROc1 BPc1 UROc1 BPc1 UROc1 UROc1 UROc1 UROc1 UROc1 UROc1 UROc1 UROc1 UROc1 UROc1 UROc1 UROc1 UROc1 UROc1 UROc1 UROc1 UROc1 UROc1 UROc1 UROc1 UROc1 UROc1 UROc1 UROc1 UROc1 UROc1 UROc1 UROc1 UROc1 UROc1 UROc1 UROc1 UROc1 BPc1 BPc1 BPc1 BPc1 BPc1 BPc1 UROc1 BPc1 UROc1 BPc1 BPc1 BPc1 BPc1 BPc1 BPc1 BPc1 BPc1 BPc1 BPc1 BPc1 BPc1 BPc1 BPc1 BPc1 BPc1 BPc1 BPc1 BPc1 BPc1 BPc1 BPc1 BPc1 BPc1 BPc1 BPc1 BPc1 BPc1 BPc1 BPc1 BPc1 BPc1 BPc1 BPc1 BPc1 BPc1 BPc1 BPc1 BPc1 BPc1 BPc1 UROc1 BPc1 UROc1 BPc1 UROc1 BPc1 UROc1 BPc1 BPc1 UROc1 BPc1 UROc1 BPc1 BPc1 UROc1 BPc1 UROc1 BPc1 UROc1 BPc1 BPc1 BPc1 BPc1 BPc1 BPc1 BPc1 BPc1 BPc1 BPc1 BPc1 BPc1 BPc1 BPc1 BPc1 BPc1 BPc1 BPc1 BPc1 BPc1 BPc1 BPc1 BPc1 BPc1 BPc1 BPc1 BPc1 BPc1 BPc1 BPc1 BPc1 BPc1 BPc1 BPc1 BPc1 BPc1 BPc1 BPc1 BPc1 BPc1 BPc1 BPc1 BPc1 BPc1 BPc1 BPc1 BPc1 BPc1 UROc1 BPc1 UROc1 BPc1 UROc1 BPc1 UROc1 BPc1 UROc1 BPc1 UROc1 BPc1 UROc1 BPc1 UROc1 BPc1 UROc1 BPc1 UROc1 BPc1 BPc1 BPc1 BPc1 BPc1 BPc1 BPc1 BPc1 BPc1 BPc1 BPc1 BPc1 BPc1 BPc1 BPc1 BPc1 BPc1 BPc1 BPc1 BPc1 BPc1 BPc1 BPc1 BPc1 BPc1 BPc1 BPc1 BPc1 BPc1 BPc1 BPc1 BPc1 BPc1 BPc1 BPc1 BPc1 BPc1 BPc1 BPc1 BPc1 BPc1 BPc1 BPc1 BPc1 BPc1 BPc1 BPc1 BPc1 BPc1 BPc1 BPc1 BPc1 UROc1 BPc1 UROc1 BPc1 UROc1 BPc1 UROc1 BPc1 UROc1 BPc1 UROc1 BPc1 UROc1 BPc1 UROc1 BPc1 UROc1 BPc1 UROc1 BPc1 BPc1 BPc1 BPc1 BPc1 BPc1 BPc1 BPc1 BPc1 BPc1 BPc1 BPc1 BPc1 BPc1 BPc1 BPc1 BPc1 BPc1 BPc1 BPc1 BPc1 BPc1 BPc1 BPc1 BPc1 BPc1 BPc1 BPc1 BPc1 BPc1 BPc1 BPc1 BPc1 BPc1 BPc1 BPc1 BPc1 BPc1 BPc1 BPc1 BPc1 BPc1 BPc1 BPc1 BPc1 BPc1 BPc1 BPc1 BPc1 BPc1 BPc1 BPc1 BPc1 BPc1 BPc1 BPc1 BPc1 BPc1 BPc1 BPc1 BPc1 BPc1 BPc1 BPc1 BPc1 BPc1 BPc1 BPc1 BPc1 BPc1 BPc1 BPc1 BPc1 BPc1 BPc1 BPc1 BPc1 BPc1 BPc1 BPc1 BPc1 BPc1 BPc1 BPc1 BPc1 BPc1 BPc1 BPc1 BPc1 BPc1 BPc1 BPc1 BPc1 BPc1 BPc1 BPc1 BPc1 BPc1 BPc1 BPc1 BPc1 BPc1 BPc1 UROc1 BPc1 BPc1 BPc1 BPc1 BPc1 BPc1 BPc1 BPc1 BPc1 BPc1 BPc1 BPc1 BPc1 BPc1 BPc1 BPc1 BPc1 BPc1 BPc1 BPc1 BPc1 BPc1 BPc1 BPc1 BPc1 BPc1 BPc1 BPc1 BPc1 BPc1 BPc1 BPc1 BPc1 BPc1 BPc1 BPc1 BPc1 BPc1 BPc1 BPc1 BPc1 BPc1 BPc1 BPc1 BPc1 BPc1 BPc1 BPc1 BPc1 BPc1 BPc1 BPc1 BPc1 BPc1 BPc1 BPc1 BPc1 BPc1 BPc1 BPc1 BPc1 BPc1 BPc1 BPc1 BPc1 BPc1 BPc1 BPc1 BPc1 BPc1 BPc1 BPc1 UROc1 UROc1 UROc1 BPc1 BPc1 BPc1 BPc1 BPc1 BPc1 BPc1 BPc1 BPc1 BPc1 BPc1 BPc1 BPc1 BPc1 BPc1 BPc1 BPc1 BPc1 BPc1 BPc1 BPc1 BPc1 BPc1 BPc1 BPc1 BPc1 BPc1 BPc1 BPc1 BPc1 BPc1 BPc1 BPc1 BPc1 BPc1 BPc1 BPc1 BPc1 BPc1 UROc1 UROc1 UROc1 BPc1 BPc1 BPc1 BPc1 BPc1 BPc1 BPc1 BPc1 BPc1 BPc1 BPc1 BPc1 BPc1 BPc1 BPc1 BPc1 BPc1 BPc1 BPc1 BPc1 BPc1 BPc1 BPc1 BPc1 BPc1 BPc1 UROc1 UROc1 UROc1 UROc1 UROc1 BPc1 BPc1 UROc1 UROc1 UROc1 UROc1 UROc1 UROc1 UROc1 UROc1 CDc1 CDc1 CDc1 CDc1 CDc1 CDc1 CDc1 CDc1 CDc1 CDc1 BPc1 BPc1 BPc1 CDc1 CDc1 CDc1 UROc1 UROc1 BPc1 BPc1 BPc1 BPc1 BPc1 BPc1 UROc1 UROc1 BPc1 BPc1 BPc1 BPc1 BPc1 BPc1 UROc1 BPc1 UROc1 BPc1 UROc1 BPc1 BPc1 BPc1 BPc1 BPc1 BPc1 BPc1 BPc1 BPc1 BPc1 BPc1 BPc1 BPc1 BPc1 BPc1 BPc1 BPc1 BPc1 BPc1 BPc1 BPc1 BPc1 BPc1 BPc1 BPc1 BPc1 BPc1 BPc1 BPc1 BPc1 BPc1 BPc1 BPc1 BPc1 BPc1 BPc1 BPc1 BPc1 BPc1 BPc1 BPc1 BPc1 BPc1 BPc1 BPc1 BPc1 BPc1 BPc1 BPc1 BPc1 BPc1 BPc1 BPc1 BPc1 BPc1 BPc1 BPc1 BPc1 UROc1 UROc1 UROc1 BPc1 BPc1 BPc1 BPc1 BPc1 BPc1 BPc1 BPc1 BPc1 BPc1 BPc1 BPc1 BPc1 BPc1 BPc1 BPc1 BPc1 BPc1 BPc1 BPc1 BPc1 BPc1 BPc1 BPc1 BPc1 BPc1 BPc1 BPc1 BPc1 BPc1 BPc1 BPc1 BPc1 BPc1 BPc1 BPc1 BPc1 BPc1 BPc1 BPc1 BPc1 BPc1 BPc1 BPc1 BPc1 BPc1 BPc1 BPc1 BPc1 BPc1 BPc1 BPc1 BPc1 BPc1 BPc1 BPc1 BPc1 UROc1 UROc1 BPc1 BPc1 BPc1 BPc1 BPc1 BPc1 BPc1 BPc1 BPc1 BPc1 BPc1 BPc1 BPc1 BPc1 BPc1 BPc1 BPc1 BPc1 BPc1 BPc1 BPc1 BPc1 BPc1 BPc1 BPc1 BPc1 BPc1 BPc1 BPc1 BPc1 BPc1 BPc1 BPc1 BPc1 BPc1 BPc1 BPc1 BPc1 BPc1 BPc1 BPc1 BPc1 BPc1 BPc1 BPc1 BPc1 BPc1 BPc1 BPc1 BPc1 UROc1 BPc1 BPc1 BPc1 BPc1 BPc1 BPc1 BPc1 BPc1 BPc1 BPc1 BPc1 BPc1 BPc1 BPc1 BPc1 BPc1 BPc1 BPc1 BPc1 BPc1 BPc1 BPc1 BPc1 BPc1 UROc1 UROc1 BPc1 BPc1 BPc1 BPc1 BPc1 BPc1 BPc1 BPc1 BPc1 BPc1 BPc1 BPc1
