,Bucket,Sentence
258,07::02::Commodities::USA,SMc1 SMc1 SMc1 SMc1 SMc1 SMc1 SMc1 SMc1 SMc1 SMc1 SMc1 SMc1 SMc1 GCc1 SMc1 SMc1 SMc1 SMc1 GCc1 GCc1 GCc1 GCc1 SMc1 SMc1 SMc1 SMc1 SMc1 SMc1 SMc1 SMc1 SMc1 SMc1 SMc1 GCc1 SMc1 SMc1 SMc1 PLc1 SMc1 PLc1 SMc1 PLc1 SMc1 PLc1 SMc1 PLc1 SMc1 PLc1 SMc1 PLc1 SMc1 PLc1 SMc1 PLc1 PLc1 PLc1 PLc1 SMc1 SMc1 SMc1 SMc1 SMc1 SMc1 SMc1 SMc1 SMc1 GCc1 SMc1 SMc1 SMc1 SMc1 SMc1 SMc1 SMc1 SMc1 SMc1 PLc1 PLc1 PLc1 PLc1 GCc1 PLc1 SMc1 SMc1 PLc1 SMc1 PLc1 SMc1 PLc1 SMc1 SMc1 SMc1 SMc1 SMc1 SMc1 SMc1 SMc1 SMc1 SMc1 SMc1 SMc1 SMc1 SMc1 SMc1 SMc1 SMc1 SMc1 SMc1 SMc1 SMc1 PLc1 PLc1 PLc1 PLc1 PLc1 SMc1 PLc1 SMc1 PLc1 SMc1 PLc1 SMc1 PLc1 SMc1 SMc1 SMc1 SMc1 GCc1 GCc1 SMc1 SMc1 PAc1 SMc1 SMc1 SMc1 SMc1 SMc1 SMc1 SMc1 SMc1 SMc1 GCc1 SMc1 SMc1 SMc1 SMc1 SMc1 SMc1 SMc1 SMc1 SMc1 SMc1 SMc1 PAc1 PAc1 PAc1 PAc1 PAc1 SMc1 PAc1 SMc1 PAc1 SMc1 SMc1 SMc1 SMc1 SMc1 SMc1 SMc1 SMc1 SMc1 SMc1 SMc1 PAc1 SMc1 SMc1 SMc1 SMc1 SMc1 SMc1 SMc1 PLc1 SMc1 PLc1 SMc1 PLc1 SMc1 PLc1 PLc1 PLc1 PLc1 PLc1 SMc1 SMc1 SMc1 SMc1 SMc1 SMc1 PLc1 SMc1 PLc1 SMc1 SMc1 SMc1 SMc1 PLc1 PLc1 GCc1 PLc1 PLc1 PLc1 PLc1 PLc1 PAc1 PLc1 PAc1 PLc1 PAc1 PLc1 PAc1 PLc1 PAc1 PLc1 PAc1 PLc1 PAc1 PLc1 PAc1 PLc1 PAc1 PLc1 PLc1 PLc1 PLc1 PLc1 SMc1 PLc1 SMc1 SMc1 SMc1 SMc1 SMc1 SMc1 SMc1 SMc1 SMc1 SMc1 SMc1 SMc1 SMc1 SMc1 SMc1 SMc1 SMc1 SMc1 SMc1 PLc1 SMc1 PLc1 SMc1 PLc1 SMc1 SMc1 PLc1 PLc1 PLc1 PLc1 PLc1 PLc1 PLc1 PLc1 PLc1 PLc1 PLc1 PLc1 PLc1 PLc1 GCc1 PLc1 GCc1 PLc1 PLc1 PLc1 PLc1 PLc1 PLc1 PLc1 PLc1 SMc1 SMc1 SMc1 SMc1 SMc1 SMc1 SMc1 SMc1 SMc1 SMc1 SMc1 PLc1 PLc1 PLc1 PLc1 PLc1 PLc1 PLc1 PLc1 PLc1 PLc1 PLc1 PLc1 PLc1 PLc1 PLc1 PLc1 PLc1 PLc1 PLc1 PLc1 PLc1 PLc1 PLc1 PLc1 PLc1 PLc1 PLc1 PLc1 PLc1 PLc1 PLc1 PLc1 PLc1 PLc1 PLc1 PLc1 PLc1 PLc1 PLc1 PLc1 GCc1 PLc1 GCc1 SMc1 SMc1 SMc1 SMc1 SMc1 SMc1 SMc1 SMc1 SMc1 SMc1 PLc1 PLc1 PLc1 PLc1 PLc1 PLc1 PLc1 PLc1 PLc1 PLc1 PLc1 PLc1 PLc1 PLc1 PLc1 PLc1 PLc1 PLc1 PLc1 PLc1 PLc1 PLc1 PLc1 PLc1 PLc1 PLc1 PLc1 PLc1 PLc1 PLc1 PLc1 PLc1 PLc1 PLc1 PLc1 PLc1 PLc1 PLc1 PLc1 PLc1 PLc1 PLc1 PLc1 PLc1 PLc1 PLc1 PLc1 PLc1 PLc1 PLc1 PLc1 PLc1 PLc1 PLc1 PLc1 PLc1 PLc1 PLc1 PLc1 PLc1 PLc1 PLc1 PLc1 PLc1 PLc1 PLc1 PLc1 PLc1 PLc1 PLc1 PLc1 PLc1 PLc1 PLc1 PLc1 PLc1 PLc1 PLc1 PLc1 PLc1 PLc1 PLc1 PLc1 PLc1 PLc1 PLc1 GCc1 PLc1 GCc1 PLc1 PLc1 PLc1 PLc1 PLc1 PLc1 PLc1 PLc1 PLc1 PLc1 PLc1 PLc1 PLc1 PLc1 PLc1 PLc1 PLc1 PLc1 PLc1 PLc1 PLc1 PLc1 PLc1 PLc1 PLc1 PLc1 PLc1 PLc1 PLc1 PLc1 PLc1 PLc1 PLc1 PLc1 PLc1 PLc1 PLc1 PLc1 PLc1 PLc1 PLc1 PLc1 PLc1 PLc1 PLc1 PLc1 PLc1 PLc1 PLc1 PLc1 PLc1 PLc1 PLc1 PLc1 PLc1 PLc1 PLc1 PLc1 PLc1 PLc1 PLc1 PLc1 PLc1 PLc1 PLc1 PLc1 PLc1 PLc1 PLc1 PLc1 PLc1 PLc1 PLc1 PLc1 PLc1 PLc1 PLc1 PLc1 PLc1 PLc1 PLc1 PLc1 GCc1 PLc1 PLc1 PLc1 PLc1 PLc1 PLc1 PLc1 PLc1 PLc1 PLc1 PLc1 PLc1 PLc1 PLc1 PLc1 PLc1 PLc1 PLc1 PLc1 PLc1 PLc1 PLc1 PLc1 PLc1 PLc1 PLc1 PLc1 PLc1 PLc1 PLc1 PLc1 PLc1 PLc1 PLc1 PLc1 PLc1 PLc1 PLc1 PLc1 PLc1 PLc1 PLc1 PLc1 PLc1 PLc1 PLc1 PLc1 PLc1 PLc1 PLc1 PLc1 PLc1 PLc1 SMc1 SMc1 SMc1 SMc1 PLc1 PLc1 PLc1 PLc1 PLc1 PLc1 PLc1 PLc1 PLc1 PLc1 SMc1 SMc1 SMc1 SMc1 PLc1 SMc1 PLc1 SMc1 SMc1 SMc1 SMc1 PLc1 PLc1 PLc1 GCc1 GCc1 SMc1 SMc1 SMc1 SMc1 SMc1 SMc1 SMc1 GCc1 SMc1 SMc1 SMc1 SMc1 SMc1 SMc1 SMc1 SMc1 SMc1 SMc1 SMc1 SMc1 SMc1 SMc1 SMc1 SMc1 SMc1 GCc1 SMc1 SMc1 SMc1 SMc1 SMc1 SMc1 SMc1 SMc1 SMc1 SMc1 SMc1 SMc1 SMc1 SMc1 SMc1 SMc1 SMc1 GCc1 GCc1 SMc1 SMc1 SMc1 SMc1 SMc1 SMc1 SMc1 SMc1 SMc1 SMc1 SMc1 SMc1 SMc1 PLc1 SMc1 SMc1 PLc1 PLc1 PLc1 PLc1 PLc1 PLc1 PLc1 PLc1 PLc1 SMc1 PLc1 SMc1 PLc1 PLc1 PLc1 SMc1 PLc1 PLc1 SMc1 PLc1 SMc1 PLc1 SMc1 PLc1 SMc1 PLc1 PLc1 PLc1 PLc1 PLc1 PLc1 PLc1 PLc1 SMc1 GCc1 PLc1 PLc1 PLc1 PLc1 PLc1 PLc1 PLc1 PLc1 PLc1 PLc1 PLc1 PLc1 PLc1 PLc1 PLc1 PLc1 PLc1 PLc1 PLc1 PLc1 PLc1 PLc1 PLc1 PLc1 PLc1 PLc1 PLc1 PLc1 PLc1 GCc1 SMc1 SMc1 SMc1 SMc1 SMc1 SMc1 SMc1 SMc1 SMc1 SMc1 SMc1 SMc1 SMc1 SMc1 SMc1 SMc1 SMc1 SMc1 SMc1 SMc1 SMc1 SMc1 SMc1 SMc1 SMc1 SMc1 SMc1 SMc1 SMc1 GCc1 SMc1 SMc1 SMc1 SMc1 SMc1 SMc1 SMc1 SMc1 SMc1 SMc1 SMc1 SMc1 SMc1 GCc1 GCc1 SMc1 SMc1 SMc1 SMc1 SMc1 SMc1 SMc1 SMc1 SMc1 SMc1 SMc1 SMc1 SMc1 SMc1 SMc1 GCc1 SMc1 SMc1 SMc1 SMc1 SMc1 SMc1 SMc1 SMc1 SMc1 SMc1 SMc1 SMc1 SMc1 SMc1 SMc1 SMc1 SMc1 SMc1 SMc1 SMc1 SMc1 SMc1 SMc1 SMc1 SMc1 SMc1 SMc1 SMc1 SMc1 SMc1 SMc1 SMc1 SMc1 SMc1 SMc1 SMc1 SMc1 SMc1 SMc1 SMc1 SMc1 SMc1 SMc1 SMc1 SMc1 SMc1 SMc1 GCc1 SMc1 SMc1 SMc1 SMc1 GCc1 SMc1 SMc1 SMc1 SMc1 SMc1 SMc1 SMc1 SMc1 SMc1 SMc1 SMc1 SMc1 SMc1 SMc1 SMc1 SMc1 SMc1 SMc1 SMc1 SMc1 SMc1 SMc1 SMc1 SMc1 SMc1 SMc1 SMc1 SMc1 SMc1 SMc1 GCc1 GCc1 GCc1 GCc1 SMc1 SMc1 SMc1 SMc1 SMc1 SMc1 SMc1 SMc1 SMc1 SMc1 SMc1 SMc1 SMc1 SMc1 SMc1 SMc1 SMc1 SMc1 SMc1 SMc1 SMc1 SMc1 SMc1 SMc1 SMc1 GCc1 SMc1 SMc1 SMc1 SMc1 SMc1 SMc1 SMc1 SMc1 SMc1 SMc1 SMc1 SMc1 SMc1 SMc1 SMc1 SMc1 GCc1 GCc1 SMc1 SMc1 SMc1 SMc1 SMc1 SMc1 SMc1 SMc1 PAc1 SMc1 PAc1 SMc1 PAc1 PAc1 PAc1 PAc1 PAc1 PAc1 LBc1 PAc1 PAc1 PAc1 PAc1 PAc1 PAc1 PAc1 PAc1 PAc1 PAc1 PAc1 PAc1 PAc1 PAc1 PAc1 PAc1 PAc1 PAc1 PAc1 PAc1 PAc1 SMc1 PAc1 SMc1 SMc1 SMc1 SMc1 SMc1 SMc1 SMc1 SMc1 SMc1 SMc1 PAc1 PAc1 PAc1 PAc1 PAc1 SMc1 SMc1 SMc1 SMc1 PAc1 LBc1 LBc1 LBc1 LBc1 LBc1 LBc1 LBc1 LBc1 LBc1 LBc1 LBc1 LBc1 LBc1 LBc1 LBc1 SMc1 SMc1 SMc1 SMc1 SMc1 SMc1 SMc1 SMc1 LBc1 LBc1 LBc1 LBc1 SMc1 LBc1 SMc1 LBc1 SMc1 LBc1 PAc1 SMc1 LBc1 LBc1 LBc1 LBc1 LBc1 LBc1 LBc1 LBc1 LBc1 LBc1 LBc1 LBc1 LBc1 LBc1 LBc1 LBc1 LBc1 LBc1 LBc1 LBc1 SMc1 SMc1 SMc1 LBc1 LBc1 LBc1 LBc1 LBc1 LBc1 LBc1 LBc1 LBc1 LBc1 LBc1 SMc1 SMc1 SMc1 SMc1 SMc1 LBc1 LBc1 LBc1 LBc1 LBc1 LBc1 LBc1 LBc1 LBc1 LBc1 LBc1 LBc1 LBc1 SMc1 SMc1 SMc1 SMc1 SMc1 SMc1 SMc1 SMc1 SMc1 SMc1 LBc1 LBc1 LBc1 LBc1 LBc1 LBc1 LBc1 LBc1 LBc1 LBc1 LBc1 LBc1 LBc1 LBc1 SMc1 LBc1 SMc1 LBc1 SMc1 LBc1 SMc1 SMc1 SMc1 LBc1 LBc1 LBc1 LBc1 LBc1 LBc1 LBc1 LBc1 LBc1 LBc1 LBc1 LBc1 SMc1 LBc1 SMc1 LBc1 SMc1 LBc1 SMc1 LBc1 LBc1 SMc1 SMc1 SMc1 SMc1 SMc1 LBc1 LBc1 LBc1 LBc1 LBc1 LBc1 LBc1 LBc1 LBc1 LBc1 LBc1 LBc1 LBc1 LBc1 LBc1 LBc1 LBc1 LBc1 LBc1 SMc1 SMc1 SMc1 SMc1 SMc1 SMc1 LBc1 LBc1 LBc1 LBc1 LBc1 LBc1 LBc1 LBc1 LBc1 LBc1 LBc1 LBc1 LBc1 LBc1 LBc1 LBc1 SMc1 SMc1 SMc1 LBc1 LBc1 LBc1 LBc1 LBc1 LBc1 LBc1 LBc1 LBc1 LBc1 LBc1 LBc1 LBc1 LBc1 LBc1 LBc1 LBc1 LBc1 SMc1 SMc1 SMc1 SMc1 SMc1 LBc1 LBc1 LBc1 LBc1 LBc1 LBc1 LBc1 LBc1 LBc1 LBc1 LBc1 LBc1 LBc1 SMc1 LBc1 SMc1 LBc1 SMc1 LBc1 SMc1 SMc1 SMc1 SMc1 SMc1 SMc1 SMc1 LBc1 LBc1 LBc1 LBc1 LBc1 LBc1 LBc1 LBc1 LBc1 LBc1 LBc1 SMc1 LBc1 SMc1 LBc1 SMc1 LBc1 SMc1 LBc1 SMc1 LBc1 LBc1 LBc1 LBc1 LBc1 LBc1 LBc1 LBc1 LBc1 SMc1 SMc1 SMc1 SMc1 SMc1 SMc1 SMc1 SMc1 SMc1 SMc1 SMc1 LBc1 LBc1 SMc1 SMc1 SMc1 SMc1 SMc1 SMc1 SMc1 SMc1 SMc1 SMc1 SMc1 SMc1 SMc1 LBc1 LBc1 SMc1 SMc1 SMc1 SMc1 SMc1 LBc1 LBc1 LBc1 LBc1 LBc1 LBc1 LBc1 LBc1 LBc1 SMc1 LBc1 SMc1 LBc1 SMc1 LBc1 SMc1 SMc1 SMc1 SMc1 SMc1 SMc1 SMc1 SMc1 SMc1 LBc1 LBc1 LBc1 LBc1 LBc1 LBc1 LBc1 LBc1 LBc1 SMc1 LBc1 SMc1 LBc1 SMc1 LBc1 SMc1 LBc1 SMc1 LBc1 SMc1 LBc1 SMc1 LBc1 LBc1 LBc1 LBc1 LBc1 LBc1 LBc1 LBc1 LBc1 LBc1 LBc1 SMc1 LBc1 LBc1 SMc1 LBc1 SMc1 LBc1 SMc1 SMc1 SMc1 SMc1 SMc1 SMc1 SMc1 SMc1
259,07::02::Equity::Canada,SXFc1 SXFc1 SXFc1 SXFc1 SXFc1
260,07::02::Equity::Netherlands,AEXc1 AEXc1 AEXc1 AEXc1 AEXc1 AEXc1 AEXc1 AEXc1 AEXc1 AEXc1 AEXc1 AEXc1 AEXc1 AEXc1 AEXc1 AEXc1 AEXc1 AEXc1 AEXc1 AEXc1 AEXc1 AEXc1 AEXc1 AEXc1 AEXc1 AEXc1 AEXc1 AEXc1 AEXc1 AEXc1 AEXc1 AEXc1 AEXc1 AEXc1 AEXc1 AEXc1 AEXc1 AEXc1 AEXc1 AEXc1 AEXc1 AEXc1 AEXc1 AEXc1 AEXc1 AEXc1 AEXc1 AEXc1 AEXc1 AEXc1 AEXc1 AEXc1 AEXc1 AEXc1 AEXc1 AEXc1 AEXc1 AEXc1 AEXc1 AEXc1 AEXc1 AEXc1 AEXc1 AEXc1 AEXc1 AEXc1 AEXc1 AEXc1 AEXc1 AEXc1 AEXc1 AEXc1 AEXc1 AEXc1 AEXc1 AEXc1 AEXc1 AEXc1 AEXc1 AEXc1 AEXc1 AEXc1 AEXc1 AEXc1 AEXc1 AEXc1 AEXc1 AEXc1 AEXc1 AEXc1 AEXc1 AEXc1 AEXc1 AEXc1 AEXc1 AEXc1 AEXc1 AEXc1 AEXc1 AEXc1 AEXc1 AEXc1 AEXc1 AEXc1 AEXc1 AEXc1 AEXc1 AEXc1 AEXc1 AEXc1 AEXc1 AEXc1 AEXc1 AEXc1 AEXc1 AEXc1 AEXc1 AEXc1 AEXc1 AEXc1 AEXc1 AEXc1 AEXc1 AEXc1 AEXc1 AEXc1 AEXc1 AEXc1 AEXc1 AEXc1 AEXc1 AEXc1 AEXc1 AEXc1 AEXc1 AEXc1 AEXc1 AEXc1 AEXc1 AEXc1 AEXc1 AEXc1
261,07::02::Fixed Income::Germany,FBTPc1 FBTPc1 FBTPc1 FBTPc1 FBTPc1 FBTPc1 FBTPc1 FBTPc1 FBTPc1 FBTPc1 FBTPc1 FBTPc1 FBTPc1 FBTPc1 FBTPc1 FBTPc1 FBTPc1 FBTPc1 FBTPc1 FBTPc1 FBTPc1 FBTPc1 FBTPc1 FBTPc1 FBTPc1 FBTPc1 FBTPc1 FBTPc1 FBTPc1 FBTPc1 FBTPc1 FBTPc1 FBTPc1 FBTPc1 FBTPc1 FBTPc1 FBTPc1 FBTPc1 FBTPc1 FBTPc1 FBTPc1 FBTPc1 FBTPc1 FBTPc1 FBTPc1 FBTPc1 FBTPc1 FBTPc1 FBTPc1 FBTPc1 FBTPc1 FBTPc1 FBTPc1 FBTPc1 FBTPc1 FBTPc1 FBTPc1 FBTPc1 FBTPc1 FBTPc1 FBTPc1 FBTPc1 FBTPc1 FBTPc1 FBTPc1 FBTPc1 FBTPc1 FBTPc1 FBTPc1 FBTPc1 FBTPc1
262,07::02::Fixed Income::UK,FLGc1 FLGc1 FLGc1 FLGc1 FLGc1 FLGc1 FLGc1 FLGc1 FLGc1 FLGc1 FLGc1 FLGc1 FLGc1 FLGc1 FLGc1 FLGc1 FLGc1 FLGc1 FLGc1 FLGc1 FLGc1 FLGc1 FLGc1 FLGc1 FLGc1 FLGc1 FLGc1 FLGc1 FLGc1 FLGc1 FLGc1 FLGc1 FLGc1 FLGc1 FLGc1 FLGc1 FLGc1 FLGc1 FLGc1 FLGc1 FLGc1 FLGc1 FLGc1 FLGc1 FLGc1 FLGc1 FLGc1 FLGc1 FLGc1 FLGc1 FLGc1 FLGc1 FLGc1 FLGc1 FLGc1 FLGc1 FLGc1 FLGc1 FLGc1 FLGc1 FLGc1 FLGc1 FLGc1 FLGc1 FLGc1 FLGc1 FLGc1 FLGc1 FLGc1 FLGc1 FLGc1 FLGc1 FLGc1 FLGc1 FLGc1 FLGc1 FLGc1 FLGc1 FLGc1 FLGc1 FLGc1 FLGc1 FLGc1 FLGc1 FLGc1 FLGc1 FLGc1 FLGc1 FLGc1 FLGc1 FLGc1 FLGc1 FLGc1 FLGc1 FLGc1 FLGc1 FLGc1 FLGc1 FLGc1 FLGc1 FLGc1 FLGc1 FLGc1 FLGc1 FLGc1 FLGc1 FLGc1 FLGc1 FLGc1 FLGc1 FLGc1 FLGc1 FLGc1 FLGc1 FLGc1 FLGc1 FLGc1 FLGc1 FLGc1 FLGc1 FLGc1 FLGc1 FLGc1 FLGc1 FLGc1 FLGc1 FLGc1 FLGc1 FLGc1 FLGc1 FLGc1 FLGc1 FLGc1 FLGc1 FLGc1 FLGc1 FLGc1 FLGc1 FLGc1 FLGc1 FLGc1 FLGc1 FLGc1 FLGc1 FLGc1 FLGc1 FLGc1 FLGc1 FLGc1 FLGc1 FLGc1 FLGc1 FLGc1 FLGc1 FLGc1 FLGc1 FLGc1 FLGc1 FLGc1 FLGc1 FLGc1 FLGc1 FLGc1 FLGc1 FLGc1 FLGc1 FLGc1 FLGc1 FLGc1 FLGc1 FLGc1 FLGc1 FLGc1 FLGc1 FLGc1 FLGc1 FLGc1 FLGc1 FLGc1 FLGc1 FLGc1 FLGc1 FLGc1 FLGc1 FLGc1 FLGc1 FLGc1 FLGc1 FLGc1 FLGc1 FLGc1 FLGc1 FLGc1 FLGc1 FLGc1 FLGc1 FLGc1 FLGc1 FLGc1 FLGc1 FLGc1 FLGc1 FLGc1 FLGc1 FLGc1 FLGc1 FLGc1 FLGc1 FLGc1 FLGc1 FLGc1 FLGc1 FLGc1 FLGc1 FLGc1 FLGc1 FLGc1 FLGc1 FLGc1 FLGc1 FLGc1 FLGc1 FLGc1 FLGc1 FLGc1 FLGc1 FLGc1 FLGc1 FLGc1 FLGc1 FLGc1 FLGc1 FLGc1 FLGc1 FLGc1 FLGc1 FLGc1 FLGc1 FLGc1 FLGc1 FLGc1 FLGc1 FLGc1 FLGc1 FLGc1 FLGc1 FLGc1 FLGc1 FLGc1 FLGc1 FLGc1 FLGc1 FLGc1 FLGc1 FLGc1 FLGc1 FLGc1 FLGc1 FLGc1 FLGc1 FLGc1 FLGc1 FLGc1 FLGc1 FLGc1 FLGc1 FLGc1 FLGc1 FLGc1 FLGc1 FLGc1 FLGc1 FLGc1 FLGc1 FLGc1 FLGc1 FLGc1 FLGc1 FLGc1 FLGc1 FLGc1 FLGc1 FLGc1 FLGc1 FLGc1 FLGc1 FLGc1 FLGc1 FLGc1 FLGc1 FLGc1 FLGc1 FLGc1 FLGc1 FLGc1 FLGc1 FLGc1 FLGc1 FLGc1 FLGc1 FLGc1 FLGc1 FLGc1 FLGc1 FLGc1 FLGc1 FLGc1 FLGc1 FLGc1 FLGc1 FLGc1 FLGc1 FLGc1 FLGc1 FLGc1 FLGc1 FLGc1 FLGc1 FLGc1 FLGc1 FLGc1 FLGc1 FLGc1 FLGc1 FLGc1 FLGc1 FLGc1 FLGc1 FLGc1 FLGc1 FLGc1 FLGc1 FLGc1 FLGc1 FLGc1 FLGc1 FLGc1 FLGc1 FLGc1 FLGc1 FLGc1 FLGc1 FLGc1 FLGc1 FLGc1 FLGc1 FLGc1 FLGc1 FLGc1 FLGc1 FLGc1 FLGc1 FLGc1 FLGc1 FLGc1 FLGc1 FLGc1 FLGc1 FLGc1 FLGc1 FLGc1 FLGc1 FLGc1 FLGc1 FLGc1 FLGc1 FLGc1 FLGc1 FLGc1 FLGc1 FLGc1 FLGc1 FLGc1 FLGc1 FLGc1 FLGc1 FLGc1 FLGc1 FLGc1
263,07::03::Commodities::USA,SMc1 SMc1 SMc1 SMc1 SMc1 SMc1 SMc1 SMc1 SMc1 SMc1 SMc1 SMc1 SMc1 SMc1 SMc1 SMc1 SMc1 SMc1 SMc1 SMc1 SMc1 SMc1 SMc1 SMc1 SMc1 SMc1 SMc1 SMc1 PLc1 SMc1 PLc1 SMc1 PLc1 SMc1 PLc1 SMc1 PLc1 SMc1 PLc1 SMc1 PLc1 SMc1 PLc1 SMc1 PLc1 SMc1 PLc1 SMc1 PLc1 SMc1 PLc1 PLc1 PLc1 PLc1 PLc1 PLc1 PLc1 PLc1 PLc1 PLc1 PLc1 PLc1 PLc1 PLc1 PLc1 SMc1 SMc1 SMc1 SMc1 PLc1 SMc1 PLc1 PLc1 PLc1 SMc1 SMc1 SMc1 SMc1 SMc1 SMc1 PLc1 PLc1 PLc1 SMc1 PLc1 SMc1 PLc1 SMc1 PLc1 SMc1 PLc1 SMc1 PLc1 SMc1 PLc1 PLc1 PLc1 PLc1 PLc1 PLc1 PLc1 PLc1 PLc1 PLc1 PLc1 PLc1 PLc1 PLc1 SMc1 PLc1 PLc1 PLc1 SMc1 PLc1 SMc1 PLc1 SMc1 PLc1 SMc1 PLc1 SMc1 PLc1 SMc1 PLc1 SMc1 PLc1 SMc1 PLc1 SMc1 PLc1 SMc1 PLc1 SMc1 SMc1 SMc1 SMc1 SMc1 SMc1 SMc1 SMc1 SMc1 PLc1 PLc1 PLc1 PLc1 PLc1 PLc1 PLc1 PLc1 PLc1 PLc1 PLc1 PLc1 PLc1 PLc1 PLc1 SMc1 PLc1 SMc1 SMc1 PLc1 SMc1 PLc1 SMc1 PLc1 SMc1 PLc1 SMc1 PLc1 SMc1 PLc1 SMc1 PLc1 SMc1 PLc1 SMc1 PLc1 SMc1 PLc1 SMc1 PLc1 SMc1 PLc1 SMc1 SMc1 SMc1 SMc1 SMc1 SMc1 SMc1 SMc1 SMc1 SMc1 SMc1 SMc1 SMc1 SMc1 SMc1 SMc1 SMc1 SMc1 SMc1 SMc1 SMc1 SMc1 SMc1 SMc1 SMc1 SMc1 SMc1 SMc1 SMc1 SMc1 SMc1 SMc1 SMc1 SMc1 SMc1 SMc1 SMc1 SMc1 SMc1 SMc1 SMc1 SMc1 SMc1 SMc1 SMc1 SMc1 SMc1 SMc1 SMc1 SMc1 SMc1 SMc1 SMc1 SMc1 SMc1 SMc1 SMc1 SMc1 SMc1 SMc1 SMc1 SMc1 SMc1 SMc1 SMc1 SMc1 SMc1 SMc1 SMc1 SMc1 SMc1 SMc1 SMc1 SMc1 SMc1 SMc1 SMc1 SMc1 SMc1 SMc1 SMc1 SMc1 SMc1 SMc1 SMc1 SMc1 SMc1 SMc1 SMc1 SMc1 SMc1 SMc1 SMc1 SMc1 SMc1 SMc1 SMc1 SMc1 SMc1 SMc1 SMc1 SMc1 SMc1 SMc1 SMc1 SMc1 SMc1 SMc1 SMc1 SMc1 SMc1 SMc1 SMc1 SMc1 SMc1 SMc1 SMc1 SMc1 SMc1 SMc1 SMc1 SMc1 SMc1 SMc1 SMc1 SMc1 SMc1 SMc1 SMc1 SMc1 SMc1 SMc1 SMc1 SMc1 SMc1 SMc1 SMc1 SMc1 SMc1 SMc1 SMc1 SMc1 SMc1 SMc1 SMc1 SMc1 SMc1 SMc1 SMc1 SMc1 SMc1 SMc1 SMc1 SMc1 SMc1 SMc1 SMc1 SMc1 SMc1 SMc1 SMc1 SMc1 GCc1 SMc1 SMc1 SMc1 SMc1 SMc1 SMc1 SMc1 SMc1 SMc1 SMc1 SMc1 SMc1 SMc1 SMc1 SMc1 SMc1 SMc1 SMc1 SMc1 SMc1 SMc1 SMc1 SMc1 SMc1 SMc1 SMc1 SMc1 SMc1 SMc1 SMc1 SMc1 SMc1 SMc1 SMc1 SMc1 SMc1 SMc1 SMc1 SMc1 SMc1 SMc1 SMc1 SMc1 SMc1 SMc1 SMc1 SMc1 SMc1 SMc1 SMc1 SMc1 SMc1 SMc1 SMc1 SMc1 SMc1 SMc1 SMc1 SMc1 SMc1 SMc1 SMc1 SMc1 SMc1 SMc1 SMc1 SMc1 SMc1 SMc1 SMc1 SMc1 SMc1 SMc1 SMc1 SMc1 SMc1 SMc1 SMc1 SMc1 SMc1 SMc1 SMc1 SMc1 SMc1 SMc1 SMc1 SMc1 SMc1 SMc1 SMc1 SMc1 SMc1 SMc1 SMc1 SMc1 SMc1 SMc1 SMc1 SMc1 SMc1 SMc1 SMc1 SMc1 SMc1 SMc1 SMc1 SMc1 SMc1 SMc1 SMc1 SMc1 SMc1 SMc1 SMc1 SMc1 SMc1 SMc1 SMc1 SMc1 SMc1 SMc1 SMc1 SMc1 SMc1 SMc1 SMc1 SMc1 SMc1 SMc1 SMc1 SMc1 SMc1 SMc1 SMc1 SMc1 SMc1 SMc1 SMc1 SMc1 SMc1 SMc1 SMc1 SMc1 SMc1 SMc1 SMc1 SMc1 SMc1 SMc1 SMc1 SMc1 SMc1 SMc1 SMc1 SMc1 SMc1 SMc1 SMc1 SMc1 SMc1 SMc1 SMc1 SMc1 SMc1 SMc1 SMc1 SMc1 SMc1 SMc1 SMc1 SMc1 SMc1 SMc1 SMc1 SMc1 SMc1 SMc1 SMc1 SMc1 SMc1 SMc1 SMc1 SMc1 SMc1 SMc1 SMc1 SMc1 SMc1 SMc1 SMc1 SMc1 SMc1 SMc1 SMc1 SMc1 SMc1 SMc1 SMc1 SMc1 SMc1 SMc1 SMc1 SMc1 SMc1 SMc1 SMc1 SMc1 SMc1 SMc1 SMc1 SMc1 SMc1 SMc1 SMc1 SMc1 SMc1 SMc1 SMc1 SMc1 SMc1 SMc1 SMc1 SMc1 SMc1 SMc1 SMc1 SMc1 SMc1 SMc1 SMc1 SMc1 SMc1 SMc1 SMc1 SMc1 SMc1 SMc1 SMc1 SMc1 SMc1 SMc1 SMc1 SMc1 SMc1 SMc1 SMc1 SMc1 SMc1 SMc1 SMc1 SMc1 SMc1 SMc1 SMc1 SMc1 SMc1 SMc1 SMc1 SMc1 SMc1 SMc1 SMc1 SMc1 SMc1 SMc1 SMc1 SMc1 SMc1 SMc1 SMc1 SMc1 SMc1 SMc1 SMc1 SMc1 SMc1 SMc1 SMc1 SMc1 SMc1 SMc1 SMc1 SMc1 SMc1 SMc1 SMc1 SMc1 SMc1 SMc1 SMc1 SMc1 SMc1 SMc1 SMc1 SMc1 SMc1 SMc1 SMc1 SMc1 SMc1 SMc1 SMc1 SMc1 SMc1 SMc1 SMc1 SMc1 SMc1 SMc1 SMc1 SMc1 SMc1 SMc1 SMc1 SMc1 SMc1
264,07::03::Equity::Canada,SXFc1 SXFc1 SXFc1 SXFc1 SXFc1 SXFc1 SXFc1 SXFc1 SXFc1 SXFc1 SXFc1 SXFc1 SXFc1 SXFc1 SXFc1 SXFc1 SXFc1 SXFc1 SXFc1 SXFc1 SXFc1 SXFc1 SXFc1 SXFc1 SXFc1 SXFc1 SXFc1 SXFc1 SXFc1 SXFc1 SXFc1 SXFc1 SXFc1 SXFc1 SXFc1 SXFc1 SXFc1 SXFc1 SXFc1 SXFc1 SXFc1 SXFc1 SXFc1 SXFc1 SXFc1 SXFc1 SXFc1 SXFc1 SXFc1 SXFc1 SXFc1 SXFc1 SXFc1 SXFc1 SXFc1 SXFc1 SXFc1 SXFc1 SXFc1 SXFc1 SXFc1 SXFc1 SXFc1 SXFc1 SXFc1 SXFc1 SXFc1 SXFc1 SXFc1 SXFc1 SXFc1 SXFc1 SXFc1 SXFc1 SXFc1 SXFc1
265,07::03::Equity::Netherlands,AEXc1 AEXc1 AEXc1 AEXc1 AEXc1 AEXc1 AEXc1 AEXc1 AEXc1 AEXc1 AEXc1 AEXc1 AEXc1 AEXc1 AEXc1 AEXc1 AEXc1 AEXc1 AEXc1 AEXc1 AEXc1 AEXc1 AEXc1 AEXc1 AEXc1 AEXc1 AEXc1 AEXc1 AEXc1 AEXc1 AEXc1 AEXc1 AEXc1 AEXc1 AEXc1 AEXc1 AEXc1 AEXc1 AEXc1 AEXc1 AEXc1 AEXc1 AEXc1 AEXc1 AEXc1 AEXc1 AEXc1 AEXc1 AEXc1 AEXc1 AEXc1 AEXc1 AEXc1 AEXc1 AEXc1 AEXc1 AEXc1 AEXc1 AEXc1 AEXc1 AEXc1 AEXc1 AEXc1 AEXc1 AEXc1 AEXc1 AEXc1 AEXc1 AEXc1 AEXc1 AEXc1 AEXc1 AEXc1 AEXc1 AEXc1 AEXc1 AEXc1 AEXc1 AEXc1 AEXc1 AEXc1 AEXc1 AEXc1 AEXc1 AEXc1 AEXc1 AEXc1 AEXc1 AEXc1 AEXc1 AEXc1 AEXc1 AEXc1 AEXc1 AEXc1 AEXc1 AEXc1 AEXc1 AEXc1 AEXc1 AEXc1 AEXc1 AEXc1 AEXc1 AEXc1 AEXc1 AEXc1 AEXc1 AEXc1 AEXc1 AEXc1 AEXc1 AEXc1 AEXc1 AEXc1 AEXc1 AEXc1 AEXc1 AEXc1 AEXc1 AEXc1 AEXc1 AEXc1 AEXc1 AEXc1 AEXc1 AEXc1 AEXc1 AEXc1 AEXc1 AEXc1 AEXc1 AEXc1 AEXc1 AEXc1 AEXc1 AEXc1 AEXc1 AEXc1 AEXc1 AEXc1 AEXc1 AEXc1 AEXc1 AEXc1 AEXc1 AEXc1 AEXc1 AEXc1 AEXc1 AEXc1 AEXc1 AEXc1 AEXc1 AEXc1 AEXc1 AEXc1 AEXc1 AEXc1 AEXc1 AEXc1 AEXc1 AEXc1 AEXc1 AEXc1 AEXc1 AEXc1 AEXc1 AEXc1 AEXc1 AEXc1 AEXc1 AEXc1 AEXc1 AEXc1 AEXc1 AEXc1 AEXc1 AEXc1 AEXc1 AEXc1 AEXc1 AEXc1 AEXc1 AEXc1 AEXc1 AEXc1 AEXc1 AEXc1 AEXc1 AEXc1 AEXc1 AEXc1 AEXc1 AEXc1 AEXc1 AEXc1 AEXc1 AEXc1 AEXc1 AEXc1 AEXc1 AEXc1 AEXc1 AEXc1 AEXc1 AEXc1 AEXc1 AEXc1 AEXc1 AEXc1 AEXc1 AEXc1 AEXc1 AEXc1 AEXc1 AEXc1 AEXc1 AEXc1 AEXc1 AEXc1 AEXc1 AEXc1 AEXc1 AEXc1 AEXc1 AEXc1 AEXc1 AEXc1 AEXc1 AEXc1 AEXc1 AEXc1 AEXc1 AEXc1 AEXc1 AEXc1 AEXc1 AEXc1 AEXc1 AEXc1 AEXc1 AEXc1 AEXc1 AEXc1 AEXc1 AEXc1 AEXc1 AEXc1 AEXc1 AEXc1 AEXc1 AEXc1 AEXc1 AEXc1 AEXc1 AEXc1 AEXc1 AEXc1 AEXc1 AEXc1 AEXc1 AEXc1 AEXc1 AEXc1 AEXc1 AEXc1 AEXc1 AEXc1 AEXc1 AEXc1 AEXc1 AEXc1 AEXc1 AEXc1 AEXc1 AEXc1 AEXc1 AEXc1 AEXc1 AEXc1 AEXc1 AEXc1 AEXc1 AEXc1 AEXc1 AEXc1 AEXc1 AEXc1 AEXc1 AEXc1 AEXc1 AEXc1 AEXc1 AEXc1 AEXc1 AEXc1 AEXc1 AEXc1 AEXc1 AEXc1 AEXc1 AEXc1 AEXc1 AEXc1 AEXc1 AEXc1 AEXc1 AEXc1 AEXc1 AEXc1 AEXc1 AEXc1 AEXc1 AEXc1 AEXc1 AEXc1 AEXc1 AEXc1 AEXc1 AEXc1 AEXc1 AEXc1 AEXc1 AEXc1 AEXc1 AEXc1 AEXc1 AEXc1 AEXc1 AEXc1 AEXc1 AEXc1 AEXc1 AEXc1 AEXc1 AEXc1 AEXc1 AEXc1 AEXc1 AEXc1 AEXc1 AEXc1 AEXc1 AEXc1 AEXc1 AEXc1 AEXc1 AEXc1 AEXc1 AEXc1 AEXc1 AEXc1 AEXc1 AEXc1 AEXc1 AEXc1 AEXc1 AEXc1 AEXc1 AEXc1 AEXc1 AEXc1 AEXc1 AEXc1 AEXc1 AEXc1 AEXc1 AEXc1 AEXc1 AEXc1 AEXc1 AEXc1 AEXc1 AEXc1 AEXc1 AEXc1 AEXc1 AEXc1 AEXc1 AEXc1 AEXc1 AEXc1 AEXc1 AEXc1 AEXc1 AEXc1 AEXc1 AEXc1 AEXc1 AEXc1 AEXc1 AEXc1 AEXc1 AEXc1 AEXc1 AEXc1 AEXc1 AEXc1 AEXc1 AEXc1 AEXc1 AEXc1 AEXc1 AEXc1 AEXc1 AEXc1 AEXc1 AEXc1 AEXc1 AEXc1 AEXc1 AEXc1 AEXc1 AEXc1 AEXc1 AEXc1 AEXc1 AEXc1 AEXc1 AEXc1 AEXc1 AEXc1 AEXc1 AEXc1 AEXc1 AEXc1 AEXc1 AEXc1 AEXc1 AEXc1 AEXc1 AEXc1 AEXc1 AEXc1 AEXc1 AEXc1 AEXc1 AEXc1 AEXc1 AEXc1 AEXc1 AEXc1 AEXc1 AEXc1 AEXc1 AEXc1 AEXc1 AEXc1 AEXc1 AEXc1 AEXc1 AEXc1 AEXc1 AEXc1 AEXc1 AEXc1 AEXc1 AEXc1 AEXc1 AEXc1 AEXc1 AEXc1 AEXc1 AEXc1 AEXc1 AEXc1 AEXc1 AEXc1 AEXc1 AEXc1 AEXc1 AEXc1 AEXc1 AEXc1 AEXc1 AEXc1 AEXc1 AEXc1 AEXc1 AEXc1 AEXc1 AEXc1 AEXc1 AEXc1 AEXc1 AEXc1 AEXc1 AEXc1 AEXc1 AEXc1 AEXc1 AEXc1 AEXc1 AEXc1 AEXc1 AEXc1 AEXc1 AEXc1 AEXc1 AEXc1 AEXc1 AEXc1 AEXc1 AEXc1 AEXc1 AEXc1 AEXc1 AEXc1 AEXc1 AEXc1 AEXc1 AEXc1 AEXc1 AEXc1 AEXc1 AEXc1 AEXc1 AEXc1 AEXc1 AEXc1 AEXc1 AEXc1 AEXc1 AEXc1 AEXc1 AEXc1 AEXc1 AEXc1 AEXc1 AEXc1 AEXc1 AEXc1 AEXc1 AEXc1 AEXc1 AEXc1 AEXc1 AEXc1 AEXc1 AEXc1 AEXc1 AEXc1 AEXc1 AEXc1 AEXc1 AEXc1 AEXc1 AEXc1 AEXc1 AEXc1 AEXc1 AEXc1 AEXc1 AEXc1 AEXc1 AEXc1 AEXc1 AEXc1 AEXc1 AEXc1 AEXc1 AEXc1
266,07::03::Fixed Income::Germany,FBTPc1 FBTPc1 FBTPc1 FBTPc1
267,07::03::Fixed Income::UK,FLGc1 FLGc1 FLGc1 FLGc1 FLGc1 FLGc1 FLGc1 FLGc1 FLGc1 FLGc1 FLGc1 FLGc1 FLGc1 FLGc1 FLGc1 FLGc1 FLGc1 FLGc1 FLGc1 FLGc1 FLGc1 FLGc1 FLGc1 FLGc1 FLGc1 FLGc1 FLGc1 FLGc1 FLGc1 FLGc1 FLGc1 FLGc1 FLGc1 FLGc1 FLGc1 FLGc1 FLGc1 FLGc1 FLGc1 FLGc1 FLGc1 FLGc1 FLGc1 FLGc1 FLGc1 FLGc1 FLGc1 FLGc1 FLGc1 FLGc1 FLGc1 FLGc1 FLGc1 FLGc1 FLGc1 FLGc1 FLGc1 FLGc1 FLGc1 FLGc1 FLGc1 FLGc1 FLGc1 FLGc1 FLGc1 FLGc1 FLGc1 FLGc1 FLGc1 FLGc1 FLGc1 FLGc1 FLGc1 FLGc1 FLGc1 FLGc1 FLGc1 FLGc1 FLGc1 FLGc1 FLGc1 FLGc1 FLGc1 FLGc1 FLGc1 FLGc1 FLGc1 FLGc1 FLGc1 FLGc1 FLGc1 FLGc1 FLGc1 FLGc1 FLGc1 FLGc1 FLGc1 FLGc1 FLGc1 FLGc1 FLGc1 FLGc1 FLGc1 FLGc1 FLGc1 FLGc1 FLGc1 FLGc1 FLGc1 FLGc1 FLGc1 FLGc1 FLGc1 FLGc1 FLGc1 FLGc1 FLGc1 FLGc1 FLGc1 FLGc1 FLGc1 FLGc1 FLGc1 FLGc1 FLGc1 FLGc1 FLGc1 FLGc1 FLGc1 FLGc1 FLGc1 FLGc1 FLGc1 FLGc1 FLGc1 FLGc1 FLGc1 FLGc1 FLGc1 FLGc1 FLGc1 FLGc1 FLGc1 FLGc1 FLGc1 FLGc1 FLGc1 FLGc1 FLGc1 FLGc1 FLGc1 FLGc1 FLGc1 FLGc1 FLGc1 FLGc1 FLGc1 FLGc1 FLGc1 FLGc1 FLGc1 FLGc1 FLGc1 FLGc1 FLGc1 FLGc1 FLGc1 FLGc1 FLGc1 FLGc1 FLGc1 FLGc1 FLGc1 FLGc1 FLGc1 FLGc1 FLGc1 FLGc1 FLGc1 FLGc1 FLGc1 FLGc1 FLGc1 FLGc1 FLGc1 FLGc1 FLGc1 FLGc1 FLGc1 FLGc1 FLGc1 FLGc1 FLGc1 FLGc1 FLGc1 FLGc1 FLGc1 FLGc1 FLGc1 FLGc1 FLGc1 FLGc1 FLGc1 FLGc1 FLGc1 FLGc1 FLGc1 FLGc1 FLGc1 FLGc1 FLGc1 FLGc1 FLGc1 FLGc1 FLGc1 FLGc1 FLGc1 FLGc1 FLGc1 FLGc1 FLGc1 FLGc1 FLGc1 FLGc1 FLGc1 FLGc1 FLGc1 FLGc1 FLGc1 FLGc1 FLGc1 FLGc1 FLGc1 FLGc1 FLGc1 FLGc1 FLGc1 FLGc1 FLGc1 FLGc1 FLGc1 FLGc1 FLGc1 FLGc1 FLGc1 FLGc1 FLGc1 FLGc1 FLGc1 FLGc1 FLGc1 FLGc1 FLGc1 FLGc1 FLGc1 FLGc1 FLGc1 FLGc1 FLGc1 FLGc1 FLGc1 FLGc1 FLGc1 FLGc1 FLGc1 FLGc1 FLGc1 FLGc1 FLGc1 FLGc1 FLGc1 FLGc1 FLGc1 FLGc1 FLGc1 FLGc1 FLGc1 FLGc1 FLGc1 FLGc1 FLGc1 FLGc1 FLGc1 FLGc1 FLGc1 FLGc1 FLGc1 FLGc1 FLGc1 FLGc1 FLGc1 FLGc1 FLGc1 FLGc1 FLGc1 FLGc1 FLGc1 FLGc1 FLGc1 FLGc1 FLGc1 FLGc1 FLGc1 FLGc1 FLGc1 FLGc1 FLGc1 FLGc1 FLGc1 FLGc1 FLGc1 FLGc1 FLGc1 FLGc1 FLGc1 FLGc1 FLGc1 FLGc1 FLGc1 FLGc1
268,07::04::Commodities::USA,SMc1 SMc1 SMc1 SMc1 SMc1 SMc1 SMc1 SMc1 SMc1 SMc1 SMc1 SMc1 SMc1 SMc1 SMc1 SMc1 SMc1 SMc1 SMc1 SMc1 SMc1 SMc1 SMc1 SMc1 SMc1 SMc1 SMc1 SMc1 SMc1 SMc1 SMc1 SMc1 SMc1 SMc1 SMc1 SMc1 SMc1 SMc1 SMc1 SMc1 SMc1 SMc1 SMc1 SMc1 SMc1 SMc1 SMc1 SMc1 SMc1 SMc1 SMc1 SMc1 SMc1 SMc1 SMc1 SMc1 SMc1 SMc1 SMc1 SMc1 SMc1 SMc1 SMc1 SMc1 SMc1 SMc1 SMc1 SMc1 SMc1 SMc1 SMc1 SMc1 SMc1 SMc1 SMc1 SMc1 SMc1 SMc1 SMc1 SMc1 SMc1 SMc1 SMc1 SMc1 SMc1 SMc1 SMc1 SMc1 SMc1 SMc1 SMc1 SMc1 SMc1 SMc1 SMc1 SMc1 SMc1 SMc1 SMc1 SMc1 SMc1 SMc1 SMc1 SMc1 SMc1 SMc1 SMc1 SMc1 SMc1 SMc1 SMc1 SMc1 SMc1 SMc1 SMc1 SMc1 SMc1 SMc1 SMc1 SMc1 SMc1 SMc1 SMc1 SMc1 SMc1 SMc1 SMc1 SMc1 SMc1 SMc1 SMc1 SMc1 SMc1 SMc1 SMc1 SMc1 SMc1 SMc1 SMc1 SMc1 SMc1 SMc1 SMc1 SMc1 SMc1 SMc1 SMc1 SMc1 SMc1 SMc1 SMc1 SMc1 SMc1 SMc1 SMc1 SMc1 SMc1 SMc1 SMc1 SMc1 SMc1 SMc1 SMc1 SMc1 SMc1 SMc1 SMc1 SMc1 SMc1 SMc1 SMc1 SMc1 SMc1 SMc1 SMc1 SMc1 SMc1 SMc1 SMc1 SMc1 SMc1 SMc1 SMc1 SMc1 SMc1 SMc1 SMc1 SMc1 SMc1 SMc1 SMc1 SMc1 SMc1 SMc1 SMc1 SMc1 SMc1 SMc1 SMc1 SMc1 SMc1 SMc1 SMc1 SMc1 SMc1 SMc1 SMc1 SMc1 SMc1 SMc1 SMc1 SMc1 SMc1 SMc1 SMc1 SMc1 SMc1 SMc1 SMc1 SMc1 SMc1 SMc1 SMc1 SMc1 SMc1 SMc1 SMc1 SMc1 SMc1 SMc1 SMc1 SMc1 SMc1 SMc1 SMc1 SMc1 SMc1 SMc1 SMc1 SMc1 SMc1 SMc1 SMc1 SMc1 SMc1 SMc1 SMc1 SMc1 SMc1 SMc1 SMc1 SMc1 SMc1 SMc1 SMc1 SMc1 SMc1 SMc1 SMc1 SMc1 SMc1 SMc1 SMc1 SMc1 SMc1 SMc1 SMc1 SMc1 SMc1 SMc1 SMc1 SMc1 SMc1 SMc1 SMc1 SMc1 SMc1 SMc1 SMc1 SMc1 SMc1 SMc1 SMc1 SMc1 SMc1 SMc1 SMc1 SMc1 SMc1 SMc1 SMc1 SMc1 SMc1 SMc1 SMc1 SMc1 SMc1 SMc1 SMc1 SMc1 SMc1 SMc1 SMc1 SMc1 SMc1 SMc1 SMc1 SMc1 SMc1 SMc1 SMc1 SMc1 SMc1 SMc1 SMc1 SMc1 SMc1 SMc1 SMc1 SMc1 SMc1 SMc1 SMc1 SMc1 SMc1 SMc1 SMc1 SMc1 SMc1 SMc1 SMc1 SMc1 SMc1 SMc1 SMc1 SMc1 SMc1 SMc1 SMc1 SMc1 SMc1 SMc1 SMc1 SMc1 SMc1 SMc1 SMc1 SMc1 SMc1 SMc1 SMc1 SMc1 SMc1 SMc1 SMc1 SMc1 SMc1 SMc1 SMc1 SMc1 SMc1 SMc1 SMc1 SMc1 SMc1 SMc1 SMc1 SMc1 SMc1 SMc1 SMc1 SMc1 SMc1 SMc1 SMc1 SMc1 SMc1 SMc1 SMc1 SMc1 SMc1 SMc1 SMc1 SMc1 SMc1 SMc1 SMc1 SMc1 SMc1 SMc1 SMc1 SMc1 SMc1 SMc1 SMc1 SMc1 SMc1 SMc1 SMc1 SMc1 SMc1 SMc1 SMc1 SMc1 SMc1 SMc1 SMc1 SMc1 SMc1 SMc1 SMc1 SMc1 SMc1 SMc1 SMc1 SMc1 SMc1 SMc1 SMc1 SMc1 SMc1 SMc1 SMc1 SMc1 SMc1 SMc1 SMc1 SMc1 SMc1 SMc1 SMc1 SMc1 SMc1 SMc1 SMc1 SMc1 SMc1 SMc1 SMc1 SMc1 SMc1 SMc1 SMc1 SMc1 SMc1 SMc1 SMc1 SMc1 SMc1 SMc1 SMc1 SMc1 SMc1 SMc1 SMc1 SMc1 SMc1 SMc1 SMc1 SMc1 SMc1 SMc1 SMc1 SMc1 SMc1 SMc1 SMc1 SMc1 SMc1 SMc1 SMc1 SMc1 SMc1 SMc1 SMc1 SMc1 SMc1 SMc1 SMc1 SMc1 SMc1 SMc1 SMc1 SMc1 SMc1 SMc1 SMc1 SMc1 SMc1 SMc1 SMc1 SMc1 SMc1 SMc1 SMc1 SMc1 SMc1 SMc1 SMc1 SMc1 SMc1 SMc1 SMc1 SMc1 SMc1 SMc1 SMc1 SMc1 SMc1 SMc1 SMc1 SMc1 SMc1 SMc1 SMc1 SMc1 SMc1 SMc1 SMc1 SMc1 SMc1 SMc1 SMc1 SMc1 SMc1 SMc1 SMc1 SMc1 SMc1 SMc1 SMc1 SMc1 SMc1 SMc1 SMc1 SMc1 SMc1 SMc1 SMc1 SMc1 SMc1 SMc1 SMc1 SMc1 SMc1 SMc1 SMc1 SMc1 SMc1 SMc1 SMc1 SMc1 SMc1 SMc1 SMc1 SMc1 SMc1
269,07::04::Equity::Canada,SXFc1 SXFc1 SXFc1 SXFc1 SXFc1 SXFc1 SXFc1 SXFc1 SXFc1 SXFc1 SXFc1 SXFc1 SXFc1 SXFc1 SXFc1 SXFc1 SXFc1 SXFc1 SXFc1 SXFc1 SXFc1 SXFc1 SXFc1 SXFc1 SXFc1 SXFc1 SXFc1 SXFc1 SXFc1 SXFc1 SXFc1 SXFc1 SXFc1 SXFc1 SXFc1 SXFc1 SXFc1 SXFc1 SXFc1 SXFc1 SXFc1 SXFc1 SXFc1 SXFc1 SXFc1 SXFc1 SXFc1 SXFc1 SXFc1 SXFc1 SXFc1 SXFc1 SXFc1 SXFc1 SXFc1 SXFc1 SXFc1 SXFc1 SXFc1 SXFc1 SXFc1 SXFc1 SXFc1 SXFc1 SXFc1 SXFc1 SXFc1 SXFc1 SXFc1 SXFc1 SXFc1 SXFc1 SXFc1 SXFc1 SXFc1 SXFc1 SXFc1 SXFc1 SXFc1 SXFc1 SXFc1 SXFc1 SXFc1 SXFc1 SXFc1 SXFc1 SXFc1 SXFc1 SXFc1 SXFc1 SXFc1 SXFc1 SXFc1 SXFc1 SXFc1 SXFc1 SXFc1 SXFc1 SXFc1 SXFc1 SXFc1 SXFc1 SXFc1 SXFc1 SXFc1 SXFc1 SXFc1 SXFc1 SXFc1 SXFc1 SXFc1 SXFc1 SXFc1 SXFc1 SXFc1 SXFc1 SXFc1 SXFc1 SXFc1 SXFc1 SXFc1 SXFc1 SXFc1 SXFc1 SXFc1 SXFc1 SXFc1 SXFc1 SXFc1 SXFc1 SXFc1 SXFc1 SXFc1 SXFc1 SXFc1 SXFc1 SXFc1 SXFc1 SXFc1 SXFc1 SXFc1 SXFc1 SXFc1 SXFc1 SXFc1 SXFc1 SXFc1 SXFc1 SXFc1 SXFc1 SXFc1 SXFc1 SXFc1 SXFc1 SXFc1 SXFc1 SXFc1 SXFc1 SXFc1 SXFc1 SXFc1 SXFc1 SXFc1 SXFc1 SXFc1 SXFc1 SXFc1 SXFc1 SXFc1 SXFc1 SXFc1 SXFc1 SXFc1 SXFc1 SXFc1 SXFc1 SXFc1 SXFc1 SXFc1 SXFc1 SXFc1 SXFc1 SXFc1 SXFc1 SXFc1 SXFc1 SXFc1 SXFc1 SXFc1 SXFc1 SXFc1 SXFc1 SXFc1 SXFc1 SXFc1 SXFc1 SXFc1 SXFc1 SXFc1 SXFc1 SXFc1 SXFc1 SXFc1 SXFc1 SXFc1 SXFc1 SXFc1 SXFc1 SXFc1 SXFc1 SXFc1 SXFc1 SXFc1 SXFc1 SXFc1 SXFc1 SXFc1 SXFc1 SXFc1 SXFc1 SXFc1 SXFc1 SXFc1 SXFc1 SXFc1 SXFc1 SXFc1 SXFc1 SXFc1 SXFc1 SXFc1 SXFc1 SXFc1 SXFc1 SXFc1 SXFc1 SXFc1 SXFc1 SXFc1 SXFc1 SXFc1 SXFc1 SXFc1 SXFc1 SXFc1 SXFc1 SXFc1 SXFc1 SXFc1 SXFc1 SXFc1 SXFc1 SXFc1 SXFc1 SXFc1 SXFc1 SXFc1 SXFc1 SXFc1 SXFc1 SXFc1 SXFc1 SXFc1 SXFc1 SXFc1 SXFc1 SXFc1 SXFc1 SXFc1 SXFc1 SXFc1 SXFc1 SXFc1 SXFc1 SXFc1 SXFc1 SXFc1 SXFc1 SXFc1 SXFc1 SXFc1 SXFc1 SXFc1 SXFc1 SXFc1 SXFc1 SXFc1 SXFc1 SXFc1 SXFc1 SXFc1 SXFc1 SXFc1 SXFc1 SXFc1 SXFc1 SXFc1 SXFc1 SXFc1 SXFc1 SXFc1 SXFc1 SXFc1 SXFc1 SXFc1 SXFc1 SXFc1 SXFc1 SXFc1 SXFc1 SXFc1 SXFc1 SXFc1 SXFc1 SXFc1 SXFc1 SXFc1 SXFc1 SXFc1 SXFc1 SXFc1 SXFc1 SXFc1 SXFc1 SXFc1 SXFc1 SXFc1 SXFc1 SXFc1 SXFc1 SXFc1 SXFc1 SXFc1 SXFc1 SXFc1
